title,author,url,description,host_platform,language,image,dateAdded,id,status,link,timeAdded,contentHash,itunesId,source,dead,is_corporate
In the WILD Podcast,Cookie Crumble & Nelly Belly,https://anchor.fm/s/1146807f8/podcast/rss,"Two women. Two survivors. One unapologetic journey back to ourselves. In the WILD is where raw conversations meet healing, laughter, and hot girl summer energy. Hosted by Cookie Crumble & Nelly Belly, we dive into life after toxic relationships, surviving domestic violence, rediscovering confidence, embracing womanhood, and learning to love yourself again. Expect unfiltered girl talk, hard truths, dating disasters, lifestyle adventures, friendships and the reminder that your past doesn't define your future. We survived. Now we're thriving—wild and free.",Anchor,en-us,https://d3t3ozftmdmh3i.cloudfront.net/staging/podcast_uploaded_nologo/46273294/46273294-1784130626041-2140d10ed41da.jpg,2026-07-16 15:25:48,7958978,confirmed,https://linktr.ee/inthewildpodcast,1784215548,30859ad1828e0672e4439dcb7dcc12cf,6788803171.0,2,0,CORPORATE
Echoes of Hope,Hopewell Church,https://anchor.fm/s/1146f89d8/podcast/rss,"Echoes of Hope is the official podcast of Hopewell Church in Elverson, Pennsylvania. Join us each week as we explore God's Word, share biblical teaching, and discuss practical ways to grow in your Christian faith. Through inspiring sermons, faith-filled conversations, discipleship insights, and real-life testimonies, Echoes of Hope seeks to encourage believers, strengthen spiritual growth, and point listeners toward the hope found in Jesus Christ.
Subscribe to Echoes of Hope to stay connected with the ministry of Hopewell Church far beyond Sunday mornings.",Anchor,en,https://d3t3ozftmdmh3i.cloudfront.net/staging/podcast_uploaded_nologo/46278214/46278214-1783948938523-d0ab20dc414ed.jpg,2026-07-16 15:25:14,7958977,confirmed,https://podcasters.spotify.com/pod/show/jonathan247,1784215514,efb560731228f8eabc3ae2777886fb39,6791194244.0,2,0,CORPORATE
Nine Lives and Counting - When You Think You're Bulletproof,Randalph Bland,https://anchor.fm/s/11323f000/podcast/rss,"A gripping true story told in 20 episodes. From mischief-filled teenage years in 1970s Scotland to near-death experiences in war zones across Asia, Africa and the Middle East — this is the story of a man who lived life on the wrong side of caution.",Anchor,en-gb,https://d3t3ozftmdmh3i.cloudfront.net/staging/podcast_uploaded_nologo/46060896/46060896-1783164892672-e471f4b77adde.jpg,2026-07-16 15:21:12,7958974,confirmed,https://podcasters.spotify.com/pod/show/ralphbland,1784215272,10f2d28f837b452b1479f0354740ec3a,6790126818.0,2,0,CORPORATE
The rDrama Podcast,Jack08,https://anchor.fm/s/10d06b07c/podcast/rss,The show talks about a lot of stuff. Mainly rDrama forums stuff. Don’t give any hate.,Anchor,en-us,https://d3t3ozftmdmh3i.cloudfront.net/staging/podcast_uploaded_nologo/45035095/45035095-1777385224563-30b91c0664f3c.jpg,2026-07-16 15:18:25,7958971,confirmed,https://podcasters.spotify.com/pod/show/lance4,1784215105,881120e4019da80dd8953a53ad5c3d34,6790242407.0,2,0,INDIVIDUAL
TSG Directors Cut,The Skin Games,https://anchor.fm/s/114e2ece8/podcast/rss,"TSG’s Director’s Cut takes you behind The Skin Games and into the professional journeys of the people shaping the beauty and wellness industry. Hosted by two estheticians, Brenda Hogsett, Director of Player Experience, and Kelly Wolcott, Director of Judges, these candid conversations feature founders, competitors, judges, educators, ambassadors, and industry leaders. Hear how they got started, what tested them, the lessons that shaped their careers, and how The Skin Games became part of their story, in around 15 minutes, give or take a really good story.",Anchor,en-us,https://d3t3ozftmdmh3i.cloudfront.net/staging/podcast_uploaded_nologo/46353834/46353834-1783979854128-28489e65ec2a4.jpg,2026-07-16 15:08:32,7958964,confirmed,https://podcasters.spotify.com/pod/show/kelly-wolcott8,1784214512,dd5a36ec9e8e8f599acc21597ba6d85d,6790864488.0,2,0,CORPORATE
SPIRIT OF INTIMACY BROADCAST,Pastor Courage Ighodaro,https://anchor.fm/s/10eaf2314/podcast/rss,"SPIRIT OF INTIMACY BROADCAST
Spirit of Intimacy Broadcast exists to teach you that intimacy with the Holy Spirit is not something you struggle to earn. It is a promise already given, and with the right understanding, it can become a daily, living experience.
Through simple, Spirit-led teachings, Pastor Courage helps believers understand Person and ministry of the Holy Spirit and guides them into learning how to walk with Him in the reality of His presence daily. 
NEW EPISODES ARE AVAILABLE EVERY TUESDAYS AND FRIDAYS .",Anchor,en-gb,https://d3t3ozftmdmh3i.cloudfront.net/staging/podcast_uploaded_nologo/45313261/45313261-1771716170946-7c440c4d3cbbc.jpg,2026-07-16 15:08:02,7958961,confirmed,https://podcasters.spotify.com/pod/show/osasogie,1784214482,1a48ae0162f47fe12a175a77654ed00e,1876873065.0,2,0,INDIVIDUAL
Surf and Sales,Richard Harris & Scott Leese,https://feeds.captivate.fm/surf-and-sales/,"Everyone is looking for help in sales, yet so few are willing to give it unselfishly.
Richard Harris and Scott Leese have teamed up to bring their best advice from their own life experiences, real-world job experiences, and what they see sales reps and leaders do right and, equally, do wrong so you can be the best at your craft as well.
And yeah, there will be the occasional surf story.",Captivate,en,https://artwork.captivate.fm/87bbb029-4309-4519-81b4-6912524cf340/surf-sales-podcast-thumbnail.jpg,2026-07-16 15:01:08,7958953,confirmed,https://surf-and-sales.captivate.fm,1784214068,d5c38e2e0aaa65cb59923bc566b4dee7,,4,0,CORPORATE
The Iliad by Homer,Gates of Imagination,https://www.spreaker.com/show/7184669/episodes/feed,"<i>Sing, goddess, the wrath of Achilles.</i><br /><br />For nine long years, the armies of Greece have besieged the walls of Troy. But when a bitter quarrel erupts between King Agamemnon and Achilles, the greatest of all warriors, rage threatens to destroy the Greeks from within. As Achilles withdraws from battle, the tide of war turns – and gods and mortals alike are drawn into a conflict where honor demands blood, and glory comes at a terrible price.<br /><br />Homer's Iliad stands at the very beginning of Western literature: a monumental epic of war, pride, grief, and the fleeting nature of human life. From the duel of Paris and Menelaus to the death of Hector before the gates of Troy, its scenes have echoed through three millennia – and lost none of their power.<br /><br />This audiobook presents Samuel Butler's celebrated prose translation, prized for its clarity and directness, which renders the ancient epic vivid and accessible to the modern listener.<br /><br />A timeless story of anger and reconciliation, fate and free will – and of what it truly costs to be remembered forever.",Spreaker,en,https://d3wo5wojvuv7l.cloudfront.net/t_rss_itunes_square_1400/images.spreaker.com/original/fbc14deac4c3b25ceec61673d4b44afd.jpg,2026-07-16 15:00:50,7958951,confirmed,https://www.spreaker.com/podcast/the-iliad-by-homer--7184669,1784214050,fb6611b5574067637c3f76791ad99b09,6791629959.0,4,0,INDIVIDUAL
"Time management, Accountability, Goal Setting, Self Improvement, Small Business : Your Productivity Pulse",Michelle Oucharek-Deo,https://feeds.captivate.fm/time-management/,"Your minutes matter. Every single one of them. And this podcast exists to help you use them with intention, energy, and a spark of joy.
Your Productivity Pulse is where time management meets real life. Whether you are a small business owner trying to get more done without burning out, an entrepreneur building something meaningful between the demands of everyday life, or someone who simply knows there has to be a better way to move through your days, this is your space. Hosted by Michelle Oucharek-Deo, a productivity coach, creative arts therapist, and business entrepreneur with over 30 years of experience, each episode blends practical strategy with genuine human insight to help you stop waiting for the perfect moment and start making the most of the one you are in.
This show goes beyond the checklist. Through her Time Core Strategy System, Michelle explores the real reasons we stall, scroll, and put our own goals last, and she offers grounded, sustainable strategies to shift that. From accountability and goal setting to mindset and self improvement, every episode is built around one belief: productivity is not about doing more. It is about doing what matters, in a way that actually fits your life.
If you have ever asked yourself any of these questions, you are in the right place:
How can I be more productive without working longer hours? Why am I so exhausted even when I feel busy? How do I stop procrastinating and actually follow through? Why do I keep putting my own goals last? How do I build a realistic schedule that I can stick to? How can I get more done and still have energy left at the end of the day? How do I take control of my time instead of letting it run me? How can I use my 168 hours differently this week?
These questions only scratch the surface. But they are exactly the right place to start. Pull up a chair, hit play, and let's figure this out together. Because the life you want to be living is already waiting for the time you are about to reclaim.",Captivate,en,https://artwork.captivate.fm/3c7f2a56-0cf8-4f6a-9337-03006abf47ea/ypp-png-podcast-image-final.png,2026-07-16 15:00:16,7958949,confirmed,https://preview.mailerlite.io/forms/28276/175552782637466835/share,1784214016,908061bd8d96766aa103d2addfde96e8,,4,0,INDIVIDUAL
2minBible,Crosspaint,https://feeds.transistor.fm/2minbible,Simply understand the Bible — in just 2 minutes. Discover the 2-minute videos that make God's Word simple and make reading the Bible easy again.,Transistor,en,https://img.transistorcdn.com/fDeUJhxyzjxLgwFCXDhZlPQBt0MyLePzzrubB1HXCk8/rs:fill:0:0:1/w:1400/h:1400/q:60/mb:500000/aHR0cHM6Ly9pbWct/dXBsb2FkLXByb2R1/Y3Rpb24udHJhbnNp/c3Rvci5mbS85MDdi/ZmRjZGM0OWYxZTBh/MGQxNzUxNzU5MDZi/N2VlNi5wbmc.jpg,2026-07-16 14:54:51,7958942,confirmed,https://www.2minbible.com/,1784213691,bb4d29ddefa555258e0e2bcda737384d,,4,0,INDIVIDUAL
Build Your Life in Japan,Yoko,https://anchor.fm/s/11321b740/podcast/rss,"Thinking about moving to Japan? Whether you're interested in real estate, visas, business, or everyday life, this podcast shares practical insights and real stories from people building their lives in Japan.
Hosted by Yoko Furukawa, a Japan immigration and real estate consultant, each episode features interviews with expats, professionals, and experts covering topics such as Japanese visas, buying property, taxes, international schools, and relocation.
Facebook: https://www.facebook.com/InvestVisaJapan?locale
Email: fyoko@ablife.jp
Our listings: https://mbottf.short.gy/zwn2xX",Anchor,en,https://d3t3ozftmdmh3i.cloudfront.net/staging/podcast_uploaded_nologo/46059440/46059440-1781690520190-defddd6aeee26.jpg,2026-07-16 14:52:37,7958939,confirmed,https://podcasters.spotify.com/pod/show/yoko-furukawa,1784213557,2c76357b01a0c830cc0f21d24c01865e,1896840201.0,2,0,INDIVIDUAL
The Ghassen Fintech Show,Ghassen BENHADJASALAH,https://rss.buzzsprout.com/2630751.rss,"<p>The Ghassen Fintech Show brings you short, sharp conversations with the founders, operators, and leaders shaping the future of fintech.<br><br>With a sharp operator lens, Ghassen Benhadjsalah sits down with fintech founders and leaders to unpack the market shifts, strategic decisions, and bold ideas shaping the future of the industry.<br><br>No fluff. No generic talk. Just focused conversations with the people building fintech in real time.</p>",Buzzsprout,en-us,https://storage.buzzsprout.com/r9ri0hoyp54bgivqgy4ce0pbzwwo?.jpg,2026-07-16 14:47:24,7958934,confirmed,https://theghassenfintechshow.com/,1784213244,3040d71b25dc3c7dd6325b56490e45b0,,4,0,INDIVIDUAL
England vs Argentina,"Dominic, Elliot and Abigail",https://rss.buzzsprout.com/2630763.rss,<p>It was rigged!</p><p>Hear us talk about the England vs Argentina match</p>,Buzzsprout,en-us,https://storage.buzzsprout.com/n4952wtlcxk02b4b0ybcb5zof80n?.jpg,2026-07-16 14:47:08,7958933,confirmed,,1784213228,ab4ae241debdd64d056d1808532965e0,,4,0,CORPORATE
Trademarks With Chelsea | A Trademark Law Basics Business Podcast,Chelsea Fournier,https://feeds.captivate.fm/trademarks-with-chelsea/,"Trademark law makes a lot more sense when it's connected to real business decisions.  Each episode tackles one question—a common trademark question, a legal definition explained in plain terms, or a specific example of how trademark strategy plays out for a real business—so you can see exactly how it applies to what you're building.  Clear, practical, trademarks chat in under 12 minutes.",Captivate,en,https://artwork.captivate.fm/63572f7b-7e54-4f97-99ec-1bcaae266df4/trademark-law-basics-business-podcast-with-host-chelsea-fournier.jpg,2026-07-16 14:46:25,7958931,confirmed,https://trademarks-with-chelsea.captivate.fm,1784213185,b0685155fb2b5df8dbabe252a25a3042,,4,0,INDIVIDUAL
The Captain & Kennedy Air Show,Captain Steeeve,https://feeds.megaphone.fm/captainandkennedyairshow,"<p>Captain Steeeve, Retired Airline Captain, and Steve Kennedy, Retired Air Traffic Controller, talk through the aviation world, aimed at aviators and the passengers in the back of an airplane. Answering questions on current day events and interviewing guests with a range from other airline media influencers to state senators.</p>",Megaphone,en,"https://megaphone.imgix.net/podcasts/12410ad2-7ecc-11f1-82f4-23c107d1d2bc/image/1e1adc9fd7f9dc4185a8b942110f5295.jpg?ixlib=rails-4.3.1&max-w=3000&max-h=3000&fit=crop&auto=format,compress",2026-07-16 14:46:05,7958930,confirmed,https://www.captainsteeeve.com/,1784213165,d224b125c2707ec536003ce719aa265e,6791201620.0,2,0,INDIVIDUAL
Life in the Age of Ai,Koto IO,https://anchor.fm/s/114fcda04/podcast/rss,"The rules have changed. Technology at its best doesn't just change how we work. It changes what we are capable of.
Every once in a generation, a shift occurs that redefines the boundaries of human potential. We are living in that moment. Life in the Age of AI is not a podcast about algorithms, code, or complex systems. It’s a podcast about you. It’s about the profound ways artificial intelligence is quietly reshaping our world.
In each episode, we explore how artificial intelligence is dismantling the old barriers between your ideas and reality.",Anchor,en,https://d3t3ozftmdmh3i.cloudfront.net/staging/podcast_uploaded_nologo/46370825/46370825-1784209720652-74d4b50a0f03.jpg,2026-07-16 14:40:25,7958924,confirmed,https://koto.so,1784212825,aab28c83f870df85bc8ab1dc61556d69,6791613506.0,2,0,INDIVIDUAL
Nikolaï Ray,Nikolaï Ray,https://feeds.redcircle.com/83989f44-80c9-4728-b09e-bba7bfb03fd8,"Ce n'est pas un podcast.
Pas d'invités. Pas de structure. Pas de deck.
Nikolaï Ray — président de Ikigai Impact — s'assoit avec toi et pense à voix haute.
Sur le temps. Sur l'argent. Sur les décisions qu'on juge par là où elles atterrissent. Sur ce qu'on bâtit qu'on ne sera pas là pour voir finir.
Une lampe. Une chaise. Une conversation ouverte.
C'est tout.",Spotify for Podcasters,en-US,https://media.redcircle.com/images/2026/7/16/14/f2c97c7b-fc76-455a-830d-3aae040cec50_ragraph_text__1000_x_1000_px___1400_x_1400_px_.jpg,2026-07-16 14:39:24,7958922,confirmed,https://redcircle.com/shows/nikolai-ray,1784212764,c3226cc7d88646f100fee7e55b6f5588,,4,0,INDIVIDUAL
Sober Sunrise - AA Speaker Podcast,Sober Sunrise,https://feeds.captivate.fm/sober-sunrise-aa-speaker/,"Sober Sunrise brings you AA Speaker Tapes from around the world. Rather than an AA discussion podcast, Sober Sunrise brings you speakers who share step-work, workshops, and general fellowship discussion points.<br /><br />We are not affiliated with AA in anyway.",Captivate,en,https://artwork.captivate.fm/7df10775-1ae3-46fd-a7e4-7eb0e60fcab6/goldbestsslogo.png,2026-07-16 14:27:02,7958910,confirmed,https://sober-sunrise.com/,1784212022,89421ef2ab4d37600dd92b60ce8ff108,,4,0,INDIVIDUAL
Dearly Defied,ShorTee,https://anchor.fm/s/114d5d878/podcast/rss,"Raw Stories. Real Judgement. No Exceptions.
Think Dear Abby if she had a spine & AITA if the verdict was based on pure honesty. I’m ShorTee, and this is the space where the filter comes off. Tired of performing? So am I. I’m breaking down your messy real-life letters with total accountability—no sugar-coating, no fluff. Whether you’re dealing with an emotional parasite or you’re the one creating the chaos, you’ll get the cold, hard truth here.
Got a story? Submit your letter at https://tally.so/r/RGaoav
Are you ready for the truth, or are you just looking for someone to agree with you?",Anchor,en,https://d3t3ozftmdmh3i.cloudfront.net/staging/podcast_uploaded_nologo/46345262/46345262-1783869794309-5f855068104b5.jpg,2026-07-16 14:20:59,7958907,confirmed,https://podcasters.spotify.com/pod/show/shortee5,1784211659,012d7a123b081e38ba39e7c97d6ac0d7,6790990883.0,2,0,INDIVIDUAL
Capital Lives Here - Multifamily Series,SAMRRA,https://anchor.fm/s/114e6fd24/podcast/rss,"The series brings together industry voices to examine how South African Residential Rental can be better understood, better measured and more confidently allocated to by institutional investors in South Africa.",Anchor,en-za,https://d3t3ozftmdmh3i.cloudfront.net/staging/podcast_uploaded_nologo/46356497/46356497-1784020373937-68e6e19afa33c.jpg,2026-07-16 14:20:18,7958906,confirmed,https://podcasters.spotify.com/pod/show/samrra9,1784211618,70b3b2c8634e4f62da5b7ed414a969c7,6791103501.0,2,0,INDIVIDUAL
Evidencia GA4-240202502-AA1-EV02,Carlos Castro Villalobos,https://www.spreaker.com/show/7184641/episodes/feed,"De acuerdo con la temática revisada en el material de estudio del cuarto nivel, elabore un audio en inglés,<br /> con el fin de identificar sus actitudes, creencias y obligaciones en el contexto laboral y académico",Spreaker,en,https://d3wo5wojvuv7l.cloudfront.net/images.spreaker.com/nuvolari-assets/blue_square_mic.jpg,2026-07-16 14:19:41,7958905,confirmed,https://www.spreaker.com/podcast/evidencia-ga4-240202502-aa1-ev02--7184641,1784211581,c95ba02cdf52b48f27a69bdfdd266b55,,4,0,INDIVIDUAL
From The Floor,Amazon,https://anchor.fm/s/114e47a90/podcast/rss,"From the Floor brings you conversations with Operations leaders about the experiences that have shaped how they lead. From building trust and earning credibility to coaching others and staying close to the work, each episode explores practical advice and leadership perspectives, straight from the floor.",Anchor,en,https://d3t3ozftmdmh3i.cloudfront.net/staging/podcast_uploaded_nologo/46354852/46354852-1783994308781-1d6c0b0365d0c.jpg,2026-07-16 14:03:59,7958899,confirmed,https://podcasters.spotify.com/pod/show/from-the-floor0,1784210639,e339d02207d38a6b35d1c7408aa0b5c5,6790862571.0,2,0,INDIVIDUAL
Burgh Breakdown,BurghBreakdown,https://feed.podbean.com/BurghBreakdown/feed.xml,"<p><em><strong>Burgh Breakdown</strong></em><span><strong> is your home for everything Pittsburgh sports. Hosted by Nick Belsky, the show covers the latest news, trade rumors, game reactions, player performances, roster moves, and the biggest storylines surrounding the Pittsburgh Steelers, Pittsburgh Penguins, and Pittsburgh Pirates. </strong>Whether you're following the NFL, NHL, or MLB, Burgh Breakdown delivers insightful discussions and fresh perspectives on all things Black and Gold. New episodes drop every Tuesday and Friday.</span></p>",Podbean,en,https://pbcdn1.podbean.com/imglogo/image-logo/22491806/Burgh_Breakdown9fgdd.jpg,2026-07-16 14:03:09,7958898,confirmed,https://BurghBreakdown.podbean.com,1784210589,96e121e12673385815bbf3cbb43650a5,6790737599.0,2,0,INDIVIDUAL
Conditions for Curiosity,Kevin O'Neil,https://anchor.fm/s/114ebc0ac/podcast/rss,"Curiosity isn't something people have or don't have—it's something environments create. If you're a teacher, parent, coach, or leader who's watched curiosity appear and disappear in real rooms, this season explores the conditions that make it more likely to emerge, and how to intentionally design for it. Based on nearly twenty years in classrooms and the research that explains why great teaching practices actually work.",Anchor,en-us,https://d3t3ozftmdmh3i.cloudfront.net/staging/podcast_uploaded_nologo/46359619/46359619-1784055430526-68f991e4a5098.jpg,2026-07-16 13:56:47,7958892,confirmed,https://podcasters.spotify.com/pod/show/knockout6,1784210207,a198a5a7b238d2e4bfee6a4af4251c5c,6790927800.0,2,0,INDIVIDUAL
Awakening Conversations with Natalie Namaste,Natalie Namaste,https://anchor.fm/s/10ee4de28/podcast/rss,"Awakening Conversations with Natalie Namaste is a space for curious minds and open hearts.
This podcast features expansive, grounded conversations with teachers, researchers, and thought-leaders exploring consciousness, ancient wisdom, science, human potential, and the collective awakening unfolding in our world.
Rather than offering beliefs or dogma, each episode invites inquiry, presence, and remembrance, bridging ancient knowledge with modern understanding.
This is not about seeking something outside yourself, but remembering what’s already here.",Anchor,en,https://d3t3ozftmdmh3i.cloudfront.net/staging/podcast_uploaded_nologo/45348474/45348474-1770681745898-81f7e7eaa9032.jpg,2026-07-16 13:54:54,7958891,confirmed,https://podcasters.spotify.com/pod/show/natalie-namaste,1784210094,e4b658d4c99e8e30d2568fb2e3d1f895,6789635763.0,2,0,INDIVIDUAL
Getting Unstuck with Marisa Liza Pell - Audio Series,Marisa Liza Pell: Master Intuitive,https://feeds.transistor.fm/getting-unstuck-with-marisa-liza-pell-audio-series,Not sure what's keeping you stuck from Manifesting your highest level dreams and goals? Listen here!,Transistor,en,https://img.transistorcdn.com/2l8MKRTxDHkGY5DNcBpv68NvwHcYzQKXGY3Jak0vrNk/rs:fill:0:0:1/w:1400/h:1400/q:60/mb:500000/aHR0cHM6Ly9pbWct/dXBsb2FkLXByb2R1/Y3Rpb24udHJhbnNp/c3Rvci5mbS82NWM1/MjY5NjU5NzQ4MzBm/ZTExOWJiOWY5ZDI5/YTkwNi5qcGc.jpg,2026-07-16 13:51:38,7958890,confirmed,https://www.marisalizapell.com,1784209898,46ade2ddfd425ffdbaa50bab5d90f322,,4,0,INDIVIDUAL
Sideline Roots,WHSV Sports,https://anchor.fm/s/111f12a68/podcast/rss,"WHSV's Connor Burgan sits down with coaches throughout the Shenandoah Valley to learn more of their upbringing into coaching, stories they've learned along the way that've helped shape them into who they are today.",Anchor,en-us,https://d3t3ozftmdmh3i.cloudfront.net/staging/podcast_uploaded_nologo/45859850/45859850-1777238663013-13fad9a7f09d9.jpg,2026-07-16 13:51:32,7958889,confirmed,https://podcasters.spotify.com/pod/show/whsv-sports5,1784209892,f70bb0d8a233a561118aa6a8efcf4c6c,1896187051.0,2,0,INDIVIDUAL
What If - Outside the Echo Chamber,Dash Hound Media,https://rss.buzzsprout.com/2630736.rss,"<p><b>What If</b> is a series of thought-provoking essays based on what's in the air at the moment, exploring the everyday topics, assumptions and underlying beliefs that shape the world around us.</p><p>We don't tell you what to think. Instead, each episode asks a simple question: ""What if...?"" while examining everything from politics and technology to ethics, science and society, and, at times, some more offbeat subjects. The series examines familiar subjects from unexpected angles, questioning certainty and inviting curiosity.</p><p>With absolutely no political agenda, the Dash Hound suggests, rather than draws, conclusions, and doesn't pretend to have all the answers. It gently asks whether we're really asking the right questions.</p>",Buzzsprout,en-gb,https://storage.buzzsprout.com/qjagjfq2ugvog7inxicfv60cayzl?.jpg,2026-07-16 13:41:53,7958883,confirmed,,1784209313,37d9a5bbc63b04c328d3826776c8bf76,,4,0,CORPORATE
The Soft Landing,Sherryl Jordan,https://rss.buzzsprout.com/2630750.rss,"Welcome to The Soft landing Podcast — your new home for unfiltered conversations, bold moves, and next-level growth.
Every week, we break down the real shifts happening inside us and around us — from mindset, business, and leadership to purpose, energy, and resilience.
No gurus. No fake positivity. Just a circle of builders, dreamers, and doers sharing tools, strategies, and stories that move you forward.
If you’re ready to stop waiting for permission and start owning your power, you’re in the right place.
Tap in. Turn up. Let’s move.
 <br/><br/><a href=""https://dduchesswrites.substack.com?utm_medium=podcast"">dduchesswrites.substack.com</a>",Buzzsprout,en,https://storage.buzzsprout.com/7imawczm6hsspmw1yxcopq4q3hik?.jpg,2026-07-16 13:41:48,7958882,confirmed,https://dduchesswrites.substack.com/podcast,1784209308,6a085d96e1ed3485c58d1bad460263c2,,4,0,INDIVIDUAL
Cart Path Only,Cart Path Only,https://anchor.fm/s/114a83f6c/podcast/rss,"Cart Path Only is the podcast for the conversations that happen between tee shots.
Hosted by Scott Atwood and Tim Tully, we talk golf, sports, business, family, current events, and whatever else comes up along the way. Some episodes are packed with golf, others barely stay on the fairway. Either way, it's the kind of conversation you'd have riding around in the cart with your buddies.
New episodes every Tuesday.",Anchor,en,https://d3t3ozftmdmh3i.cloudfront.net/staging/podcast_uploaded_nologo/46315379/46315379-1783456908576-45eecc1d8188b.jpg,2026-07-16 13:38:43,7958879,confirmed,https://podcasters.spotify.com/pod/show/cart-path-only2,1784209123,1b9f95414074b70e4faaa701afbe224c,6790967823.0,2,0,INDIVIDUAL
