title,author,url,description,host_platform,language,image,dateAdded,id,status,link,timeAdded,contentHash,itunesId,source,dead,is_corporate
"""Accidental Education"" Reality Lab",Talk Red,https://www.spreaker.com/show/7199974/episodes/feed,"Accidental Education: Reality Lab is a curiosity-driven podcast where odd facts, fascinating stories, and surprising slices of history collide. Each episode starts with a simple question and spirals into unexpected discoveries—proving that the best learning often happens by accident. Come for the weird, stay for the “wait, that’s real?” moments.",Spreaker,en,https://d3wo5wojvuv7l.cloudfront.net/t_rss_itunes_square_1400/images.spreaker.com/original/5dac3ca087a44902f7723f7fd3a8c8cc.jpg,2026-07-23 13:11:58,7967083,confirmed,https://www.spreaker.com/podcast/accidental-education-reality-lab--7199974,1784812318,bb51331ee6c725acc43009644844b658,,4,0,INDIVIDUAL
On Point Plumbing & Heating,OnPointPlumbing,https://www.spreaker.com/show/7199973/episodes/feed,"Your Local Plumbing Experts Ready When You Need Us<br /><br />When you need a dependable Plumber in North Wales, trust the professionals at On Point Plumbing & Heating. We provide comprehensive plumbing solutions for homeowners and businesses throughout the area, delivering quality workmanship, prompt service, and lasting results. Whether you’re facing a plumbing emergency, dealing with clogged drains, or planning a system upgrade, our experienced team is here to help.<br />At On Point Plumbing & Heating, we understand how important a properly functioning plumbing system is to your comfort and daily routine. That’s why we are committed to providing reliable services, transparent communication, and exceptional customer care on every project. Call us today at (267) 638-7151 to schedule service with a trusted local plumber.<br /><br />",Spreaker,en,https://d3wo5wojvuv7l.cloudfront.net/t_rss_itunes_square_1400/images.spreaker.com/original/fff35046a86812da434a702c040ad0cc.jpg,2026-07-23 13:10:17,7967077,confirmed,https://www.spreaker.com/podcast/on-point-plumbing-heating--7199973,1784812217,29691ad5a895b194aba56a28f3326dad,,4,0,INDIVIDUAL
Naomi Campbelle's podcast,Naomi Campbelle,https://www.spreaker.com/show/6197747/episodes/feed,"Hi do you love listening to music, you don't know who sang a particular song no worries this podcast doesn't only give you remix karaoke of a song it also helps you discover new sounds. What is your type of music is it AFRO,RAP or R'n'R etc you can find them here 👍👍<br /> Follow me for more songs. Love y'all ❣️❣️❣️❣️",Spreaker,en,https://d3wo5wojvuv7l.cloudfront.net/images.spreaker.com/nuvolari-assets/yellow_square_mic.jpg,2026-07-23 13:09:18,7967075,confirmed,https://www.spreaker.com/podcast/naomi-campbelle-s-podcast--6197747,1784812158,c15ac8027d611a052a781364a7dd6a08,,4,0,INDIVIDUAL
Rewinding Success,Reva Desai,https://anchor.fm/s/113fc6f70/podcast/rss,"Success can look obvious from the outside — but the real story starts much earlier. Rewinding Success with Reva Desai goes back to the early choices, risks, failures, mentors, and turning points that shaped leaders, builders, and changemakers into who they are today. Each conversation uncovers lessons young people can actually use as they build their own path.",Anchor,en,https://d3t3ozftmdmh3i.cloudfront.net/staging/podcast_uploaded_nologo/46202780/46202780-1781909951932-09679e96270e7.jpg,2026-07-23 13:03:21,7967070,confirmed,https://podcasters.spotify.com/pod/show/reva-desai2,1784811801,c7041f6ccfe3ba7c77d081b91274b683,1896944367.0,2,0,INDIVIDUAL
Earth Hoe's Are Lame,Stefon Thompson,https://feeds.acast.com/public/shows/6a5c15e878e0412bc68f96f9,<p>Host: Flying Saucer Stef</p><p>🛸 Expect cultural commentary. 🛸</p><hr><p style='color:grey; font-size:0.75em;'> Hosted on Acast. See <a style='color:grey;' target='_blank' rel='noopener noreferrer' href='https://acast.com/privacy'>acast.com/privacy</a> for more information.</p>,Acast,en,https://assets.pippa.io/shows/cover/1784419579888-64fba600-a40a-4a35-bcdd-3360385f0b8a.jpeg,2026-07-23 13:00:54,7967068,confirmed,https://feeds.acast.com/public/shows/earth-hoes-are-lame,1784811654,9cee9061e605d5f937aa0915d37b56d0,6792774593.0,2,0,INDIVIDUAL
Painting Pros Podcast,Colonial Painting Pros,https://anchor.fm/s/11482bd14/podcast/rss,"A father-son podcast from Colonial Painting Pros in Naples, Florida.
I sit down with my dad, JR, to talk through painting, business, family, and the lessons he’s learned from decades in the trade. Some episodes will be about painting tips and homeowner questions, and others will be more about the stories, mistakes, and experiences that shaped our business.",Anchor,en,https://d3t3ozftmdmh3i.cloudfront.net/staging/podcast_uploaded_nologo/46290797/46290797-1783099908058-d990f7383cdba.jpg,2026-07-23 12:54:21,7967063,confirmed,https://colonialpaintingpros.com/,1784811261,d08eb63eb1018aaeda9eaf9f81773286,6787214486.0,2,0,INDIVIDUAL
WhenJillianSpeaks,Jillian Lee,https://anchor.fm/s/11296bf78/podcast/rss,"Welcome to WhenJillianSpeaks — a podcast hosted by Jillian Lee where real conversations about love, healing, self-worth, heartbreak, growth, and emotional struggles come to life. Through personal stories and honest reflections, Jillian creates a safe space for anyone feeling lost, unheard, or emotionally exhausted. Each episode is a reminder that healing takes time, your feelings are valid, and you deserve the space to grow, love yourself, and start again.",Anchor,en-au,https://d3t3ozftmdmh3i.cloudfront.net/staging/podcast_uploaded_nologo/45968366/45968366-1779539229496-d198270cfc286.jpg,2026-07-23 12:53:34,7967062,confirmed,https://whenjillianspeaks.com.au,1784811214,ede1bd5ab453ab12890a0c5d106939b3,1896650303.0,2,0,INDIVIDUAL
The 10-Minute Advantage,Robert Coles,https://rss.buzzsprout.com/2631964.rss,"<p>Business growth doesn’t have to be complicated—or time-consuming. Join Robert Coles each week for practical 10-minute lessons on marketing, AI, operations, sales, productivity, and business strategy that you can put into action immediately. <b>One idea. Ten minutes. Better business.</b></p>",Buzzsprout,en-us,https://storage.buzzsprout.com/rwho2aix9mo94fkrmnmx0yspartw?.jpg,2026-07-23 12:37:26,7967046,confirmed,,1784810246,1ceade2f3c7c3ede521898276f739d3c,,0,0,INDIVIDUAL
Dinner at the Rectory,dinnerattherectory,https://feed.podbean.com/dinnerattherectory/feed.xml,<p>Join Fr. Mike and Fr. Tim for a monthly conversation around the table on what they have been reading and reflecting upon over the past month.</p>,Podbean,en,https://pbcdn1.podbean.com/imglogo/image-logo/22435433/logo_1400x14006udwu.png,2026-07-23 12:35:07,7967042,confirmed,https://dinnerattherectory.podbean.com,1784810107,f5ebffa0a77bf7f8e8c108f738e0fd9e,6787241119.0,2,0,INDIVIDUAL
Founder Stories,Tech Oman,https://anchor.fm/s/114f84c00/podcast/rss,"Founder Stories is the flagship podcast of the Tech Oman Innovation Campus, Oman's community-led home for founders, mentors, and investors. Every episode sits down with an entrepreneur from Oman and the wider GCC to trace the real arc of building a company — the origin story, the moment they leapt, the technology and decisions that set them apart, and the lessons earned along the way. From traditional businesses reinvented through tech to first-time founders scaling from zero, these are candid, practical conversations, not highlight reels. Whether you're building, mentoring, investing, or just",Anchor,en,https://d3t3ozftmdmh3i.cloudfront.net/staging/podcast_uploaded_nologo/46367840/46367840-1784162111316-d0f4d1e086e9c.jpg,2026-07-23 12:34:49,7967041,confirmed,https://podcasters.spotify.com/pod/show/saqibddb6,1784810089,bd772d7f7c4232a7e1b61412b92cd50c,6791382703.0,2,0,CORPORATE
Beyond The Recitation,Nasir,https://rss.buzzsprout.com/2626143.rss,"<p><b>Beyond the Recitation</b> is a podcast for those who want a deeper relationship with the Quran — not just to recite it, but to truly understand it.</p><p>Each episode is a conversation with someone who carries the Quran close — exploring how they connect with the words of Allah beyond memorisation. </p><p><br></p><p><em>Conversations with those who carry the Quran.</em></p><p><br></p><p><br></p>",Buzzsprout,en-gb,https://storage.buzzsprout.com/w9b5m1jtq75urcw4q3cqnxo3y6z7?.jpg,2026-07-23 12:29:20,7967036,confirmed,,1784809760,181d82e7a0328184084518f7d1f2bb5b,,4,0,INDIVIDUAL
StandUp Wireless,StandUp Wireless,https://www.spreaker.com/show/7199706/episodes/feed,"StandUp Wireless provides the StandUp Wireless free government phone service through the Lifeline Program, helping eligible low-income individuals stay connected with free monthly phone service. Qualified customers may receive free talk, text, and data with no monthly bills or long-term contracts. In addition to Lifeline benefits, StandUp Wireless also offers affordable prepaid plans starting at just $5 per month for customers who need extra flexibility. Check your eligibility online, apply in minutes, manage your account, recertify your Lifeline benefits, or add minutes and data with ease. Stay connected with reliable wireless service designed to keep you in touch with family, work, healthcare, and emergency services.<br /><br />",Spreaker,en,https://d3wo5wojvuv7l.cloudfront.net/t_rss_itunes_square_1400/images.spreaker.com/original/8e4e39af109c2b6f9312123a2ab054aa.jpg,2026-07-23 12:19:41,7967032,confirmed,https://www.spreaker.com/podcast/standup-wireless--7199706,1784809181,a4c995e3b1772cc16f55a7b21618b22e,,4,0,CORPORATE
Boardroom Ledger,3Peaks,https://feeds.simplecast.com/qgwMLuf4,"Boardroom Ledger is for operators who've just become their company's most critical finance voice—whether the CFO title exists yet or not. We unpack the strategic finance decisions that actually move the needle: what boards hunt for in your numbers, building a finance function on a shoestring, spotting the signals that mean exit planning starts now. Real founders and operators share the wins and the wreckage, because the finance seat is where strategy meets survival.",Simplecast,en,https://image.simplecastcdn.com/images/cb1c55c2-766f-461b-8b40-2e38ff7f0503/292fc8ed-3d22-453d-9e17-7ae54ebc6c50/3000x3000/0d2681c01b6e5222d5a1cf927907ace0.jpg?aid=rss_feed,2026-07-23 12:19:27,7967031,confirmed,https://www.spreaker.com/podcast/boardroom-ledger--7179655,1784809167,c372cbb11bb7e4ca30a3f82bed68c33f,6791198765.0,2,0,INDIVIDUAL
Woningontruiming Zoetermeer,Daan De Vries,https://www.spreaker.com/show/7199678/episodes/feed,"Welkom bij de podcast van <a href=""https://woningontruimingzoetermeer.com/"" target=""_blank"" rel=""noreferrer noopener""><b>Woningontruiming Zoetermeer</b></a>, dé plek waar we praktische informatie, tips en inzichten delen over professionele woningontruiming. Of het nu gaat om een verhuizing, een nalatenschap, een seniorenverhuizing of het leegmaken van een woning na een bijzondere situatie, wij bespreken hoe een woningontruiming efficiënt, respectvol en zorgvuldig kan worden uitgevoerd. Onze afleveringen behandelen veelvoorkomende vragen, handige voorbereidingen en waardevolle adviezen om het proces zo soepel mogelijk te laten verlopen. Daarnaast delen we ervaringen uit de praktijk en leggen we uit waar je op kunt letten bij het kiezen van een betrouwbare specialist. Met onze kennis helpen we particulieren, families en bedrijven om goed geïnformeerde keuzes te maken. Bij <b><a href=""https://woningontruimingzoetermeer.com"" target=""_blank"" rel=""noreferrer noopener"">Woningontruiming Zoetermeer</a></b> staan kwaliteit, betrouwbaarheid en persoonlijke service centraal. Bezoek onze website <b><a href=""https://woningontruimingzoetermeer.com/"" target=""_blank"" rel=""noreferrer noopener"">https://woningontruimingzoetermeer.com</a></b> voor meer informatie over onze dienstverlening, praktische tips en het aanvragen van een vrijblijvende offerte. Luister mee en ontdek hoe een professionele woningontruiming rust, overzicht en gemak kan bieden in iedere situatie.",Spreaker,en,https://d3wo5wojvuv7l.cloudfront.net/t_rss_itunes_square_1400/images.spreaker.com/original/fe0f04dc2419916f239e995cd750e445.jpg,2026-07-23 12:16:26,7967028,confirmed,https://woningontruimingzoetermeer.com,1784808986,78fb59a049ab75432017715a1547837f,,4,0,INDIVIDUAL
Good vibes and gifts,Zanda,https://www.spreaker.com/show/7199676/episodes/feed,Good vibes and gifts ,Spreaker,en,https://d3wo5wojvuv7l.cloudfront.net/t_rss_itunes_square_1400/images.spreaker.com/original/5e14873f4d30cca4664429aa139d579e.jpg,2026-07-23 12:14:48,7967027,confirmed,https://www.spreaker.com/podcast/good-vibes-and-gifts--7199676,1784808888,5fe062120d90a58c015924a220231e84,,4,0,CORPORATE
Rural-E,Sara,https://rss.buzzsprout.com/2631839.rss,"<p>Telling the real stories of rural energy; connecting farmers, small businesses, conservation partners, and funders through authentic conversations and practical insights.</p>",Buzzsprout,en-us,https://storage.buzzsprout.com/gze1o8982zw4pvbl0rl6yopy5f0q?.jpg,2026-07-23 12:05:40,7967020,confirmed,,1784808340,1abb7998ff221ccfc12109dc299a79ab,,4,0,INDIVIDUAL
Netscape Netizen,RebiDezi,https://anchor.fm/s/f4605230/podcast/rss,"Stories from around the internet, both big and small, significant and trivial.",Anchor,en,https://d3t3ozftmdmh3i.cloudfront.net/staging/podcast_uploaded_nologo/40899532/40899532-1712362451907-f65005378d6d6.jpg,2026-07-23 11:56:21,7967009,confirmed,https://scootakip.carrd.co,1784807781,4ffcbef4370fd905014e88b7607960f4,6781375731.0,2,0,INDIVIDUAL
8xbet,8xbetvn.in.net,https://anchor.fm/s/1153c100c/podcast/rss,"<a href=""https://8xbetvn.in.net/"">8xbet</a> - Mọi chi tiết từ màu sắc, bố cục cho đến cách sắp xếp nội dung đều hướng đến sự thuận tiện và dễ tiếp cận. Bên cạnh đó, khả năng hoạt động ổn định cùng tốc độ xử lý nhanh giúp người dùng tiết kiệm thời gian khi thực hiện các thao tác cần thiết. Việc liên tục cập nhật và tối ưu hệ thống cũng góp phần duy trì chất lượng dịch vụ, mang lại sự hài lòng và tạo ấn tượng tích cực trong suốt quá trình sử dụng.	WEB: <a href=""https://8xbetvn.in.net/"">https://8xbetvn.in.net/</a>",Anchor,en-au,https://d3t3ozftmdmh3i.cloudfront.net/staging/podcast_uploaded_nologo/46412251/46412251-1784807248709-4e5230f04b4dc.jpg,2026-07-23 11:55:11,7967007,confirmed,https://8xbetvn.in.net/,1784807711,a1d8bcb2a5aec778e8b8a14f61b274f4,,0,0,INDIVIDUAL
Built For This with Talia Bronfman and Jessica Green,Talia Bronfman and Jessica Green,https://anchor.fm/s/11263c7d0/podcast/rss,"Stop waiting for the blueprint. Start building a life that actually fits you.
Built For This is a Canadian podcast about the business of womanhood—ambition, caregiving, relationships, money, identity, reinvention, and the invisible work shaping women’s lives. Hosted by Jessica Green and Talia Bronfman, each episode features honest conversations with women who have built something real: a company, career, family, community, second act, or new version of themselves. Smart, emotionally honest conversations women actually see themselves in.
Welcome to Built For This.
Instagram: @built_for_this.",Anchor,en-ca,https://d3t3ozftmdmh3i.cloudfront.net/staging/podcast_uploaded_nologo/45934964/45934964-1781567202016-021fdf51d68d.jpg,2026-07-23 11:54:42,7967004,confirmed,https://podcasters.spotify.com/pod/show/built-for-this-hq,1784807682,8cb5f475135c828311dfe5f56f149e8d,6792974677.0,2,0,CORPORATE
The Friendly Behavour,hanli puala,https://www.spreaker.com/show/7197272/episodes/feed,"Welcome to Things on My Mind, the podcast where honest thoughts become meaningful conversations. Every episode explores the ideas, questions, and observations that shape the way we think, live, and grow. From personal development and relationships to success, faith, mental resilience, current issues, and everyday life lessons, nothing is off-limits.This is a space for reflection, curiosity, and real talk—where complex topics are broken down into practical insights that inspire positive change. Whether you're seeking motivation, fresh perspectives, or simply a thoughtful conversation to accompany your day, you'll find something here that resonates.Join us as we explore the thoughts that challenge assumptions, spark meaningful discussions, and encourage intentional living. Sometimes the smallest idea can lead to the biggest",Spreaker,en,https://d3wo5wojvuv7l.cloudfront.net/images.spreaker.com/nuvolari-assets/green_square_mic.jpg,2026-07-23 11:50:34,7967001,confirmed,https://www.spreaker.com/podcast/the-friendly-behavour--7197272,1784807434,053e499978382726b74f80059f4646cc,,4,0,INDIVIDUAL
The Enchanted Mouse Ears Podcast,Shawn DeVore,https://anchor.fm/s/114a09488/podcast/rss,"Welcome to The Enchanted Mouse Ears Podcast, where we celebrate the history, stories, and magic of Walt Disney World. Join your host, Shawn DeVore, as we explore favorite attractions, Disney history, Imagineering, park updates, and the little details that make the parks special. From beloved classics to new experiences, we’ll share stories, discuss what makes these places memorable, and look at where Disney has been, where it is today, and where it’s headed tomorrow. Come join our Disney family and discover the magic behind the magic.",Anchor,en,https://d3t3ozftmdmh3i.cloudfront.net/staging/podcast_uploaded_nologo/46310354/46310354-1783395705782-15b7c3e8c0664.jpg,2026-07-23 11:36:44,7966988,confirmed,https://podcasters.spotify.com/pod/show/theenchantedmouseears,1784806604,ad4f518c22e81de5b4c4b128e8ef4670,6788241149.0,2,0,INDIVIDUAL
Our Story,College of the Ozarks,https://anchor.fm/s/115222fd4/podcast/rss,"From passionate professors to first generation college students, each one has left what is easy and known to reach for something more. Their stories are inspiring. Some of them will bring you to your knees, some will make you stand and cheer. Step into the shoes of the cycle-breakers… You won’t regret it, and you just may come away inspired.
Listen in each month as we hear the stories of the cycle-breakers, passion seekers, and image bearers who write the College of the Ozarks story, one chapter at a time.",Anchor,en-us,https://d3t3ozftmdmh3i.cloudfront.net/staging/podcast_uploaded_nologo/46395293/46395293-1784662420195-7990e45e22bcc.jpg,2026-07-23 11:31:13,7966980,confirmed,https://podcasters.spotify.com/pod/show/college-of-the-ozarks7,1784806273,02053c3498797b34ffb09b4adc9af395,6793257244.0,2,0,CORPORATE
Your Questions Answered,Police & Crime Commissioner,https://www.spreaker.com/show/7194802/episodes/feed,"<b>What happens to the questions you raise about policing in South Wales?</b><br /><br />Every day, South Wales Police & Crime Commissioner Emma Wools hears directly from residents about the issues affecting their communities, from anti-social behaviour to police visibility and public safety. <br /><br /><b>Your Questions Answered</b> puts those concerns at the centre of the conversation. From crime prevention and public safety to police performance and accountability, each episode explores the issues that matter most to local people.<br /><br />Join the Police & Crime Commissioner as she puts your questions directly to the Chief Constable for South Wales Police. Together they discuss the issues impacting communities, the action being taken to tackle them, and the challenges facing modern policing.<br /><br />----------------------<br /><b>Beth sy'n digwydd i'r cwestiynau rydych chi'n eu gofyn am blismona yn ne Cymru? </b><br /><b></b><br />Bob dydd, mae trigolion yn dweud wrth Gomisiynydd yr Heddlu a Throseddu De Cymru, Emma Wools, am y materion sy'n effeithio ar eu cymunedau, o ymddygiad gwrthgymdeithasol i bresenoldeb yr heddlu a diogelwch y cyhoedd. <br /><br />Mae <b>‘Ateb Eich Cwestiynau’ </b>yn cynnig cyfle i drin a thrafod y pryderon hynny. O atal troseddau a sicrhau diogelwch y cyhoedd i berfformiad ac atebolrwydd yr heddlu, mae pob pennod yn archwilio'r materion pwysicaf i bobl leol. <br /><br />Ymunwch â Chomisiynydd yr Heddlu a Throseddu wrth iddi ofyn eich cwestiynau i'r Prif Gwnstabl. Gyda'i gilydd, bydd y ddau’n trafod gwahanol faterion sy'n effeithio ar gymunedau, y camau sy'n cael eu cymryd i fynd i'r afael â phroblemau o’r fath, a'r heriau sy'n wynebu plismona modern.",Spreaker,en,https://d3wo5wojvuv7l.cloudfront.net/t_rss_itunes_square_1400/images.spreaker.com/original/ec48aa0b2fd2d7c09839cee9058945fb.jpg,2026-07-23 11:30:24,7966978,confirmed,https://www.spreaker.com/podcast/your-questions-answered--7194802,1784806224,cc9492215eab25d917a927e616e0d684,,4,0,CORPORATE
Football Pinacle,Noah Mearns,https://www.spreaker.com/show/7199181/episodes/feed,The greatness of the world's game,Spreaker,en,https://d3wo5wojvuv7l.cloudfront.net/t_rss_itunes_square_1400/images.spreaker.com/original/f306e910a2e9f9441cc5e913ec441d67.jpg,2026-07-23 11:27:30,7966967,confirmed,https://www.spreaker.com/podcast/football-pinacle--7199181,1784806050,06757655da5f175fda25f63b499c0632,,4,0,INDIVIDUAL
The Kid Who... | True Stories of Real Kid Heroes,Jon Michael,https://feeds.redcircle.com/d57440d7-ecc2-4a89-9780-2a1eb6c02c0d,"The Kid Who... is a kids podcast that tells incredible true stories of real kids who changed history, showed extraordinary courage, solved impossible problems, and proved you're never too young to make a difference.
Each family-friendly episode is filled with suspense, surprising twists, and unforgettable heroes, all based on real events. From brave kids who saved lives to young inventors, explorers, athletes, and everyday children who did the extraordinary, every story inspires curiosity, confidence, resilience, and kindness.
Perfect for car rides, road trips, bedtime, classrooms, homeschooling, and screen free family time, The Kid Who... gives kids ages 5 to 12 exciting stories they'll actually ask to hear again, and gives parents educational entertainment they can feel great about.
If your family loves true stories for kids, educational podcasts, inspiring real life adventures, history for kids, and podcasts the whole family can enjoy together, you've found your next favorite listen.
Because sometimes...the biggest heroes are...little.",Spotify for Podcasters,en-US,https://media.redcircle.com/images/2026/7/21/14/fde24f5b-b389-4505-bbbd-fd70c8db4cd6_tkwcoverart.jpg,2026-07-23 11:20:36,7966962,confirmed,https://redcircle.com/shows/the-kid-who-true-stories-of-real-kids,1784805636,5f43243d9be66e4d021490dae38d5d7c,,4,0,INDIVIDUAL
(So) How's Business?,alma mabachi,https://rss.buzzsprout.com/2632190.rss,"(So) How's Business? is the podcast for African women entrepreneurs who are figuring it out as they go. Hosted by Alma Mabachi, a bootstrapping founder and mother, this show trades polished success stories for raw, honest conversations.
Every week is a candid look into the lives of women entrepreneurs and hustlers navigating the messy middle: the pivots, failures, small wins, big dreams, and what it actually takes to build something from scratch. 
Connect with us @sohowsbusiness on IG, X, Facebook, Tiktok, and Linkedin. Send us an email on sohowsbusinesspodcast@gmail.com",Buzzsprout,en,https://storage.buzzsprout.com/zeibbtukvyof9sibj8jwbhcbg3hl?.jpg,2026-07-23 11:15:20,7966957,confirmed,https://podcasters.spotify.com/pod/show/alma-mabachi,1784805320,0e43758a5ba3e178840ed66dd13551ce,,4,0,INDIVIDUAL
Journey Through LBS,Robert Hickman,https://feeds.libsyn.com/624765/rss,"Journey Through LBS is a podcast dedicated to sharing authentic stories of perseverance, transformation, and purpose. Each episode features athletes, musicians, entrepreneurs, creators, and everyday people who have overcome obstacles and embraced the journey that shaped their lives.
In addition to these inspiring life stories, the podcast shines a light on incredible health and weight-loss journeys, exploring the physical, mental, and emotional challenges behind lasting change. Guests share their struggles, victories, setbacks, and the lessons they've learned along the way, offering encouragement and practical insight for anyone striving to become a better version of themselves.",Libsyn,en,https://static.libsyn.com/p/assets/0/c/f/7/0cf7cdeba718f1e816c3140a3186d450/JTL.png,2026-07-23 11:07:23,7966951,confirmed,https://journeythroughlbs.com,1784804843,e93bb2e73269479e98120aed72c14b08,6790869285.0,2,0,INDIVIDUAL
STILL HERE: The Car-Living Tapes,PRASAD,https://anchor.fm/s/1152ebf74/podcast/rss,"An audio diary recorded inside the Toyota Corolla where Himanshu Prasad currently lives in Los Angeles. These are not stories told after the struggle has ended. They are reflections from inside it, on ambition, survival, discipline, faith, loneliness, identity, and continuing without knowing how the story will turn out. An unfinished life, documented in real time.",Anchor,en,https://d3t3ozftmdmh3i.cloudfront.net/staging/podcast_uploaded_nologo/46403525/46403525-1784693998725-bc6b4ecccd50a.jpg,2026-07-23 11:05:13,7966949,confirmed,https://podcasters.spotify.com/pod/show/prasad4,1784804713,33a563dca11e702423a8d46e106c0a80,6793370419.0,2,0,INDIVIDUAL
Get Ahead of It,Business & Rural Solutions,https://anchor.fm/s/114ee1f50/podcast/rss,"A free monthly webinar series designed to help primary producers navigate the realities of running their farming business. Featuring Rural Financial Counsellors and industry experts, each session tackles the topics shaping life on the land.",Anchor,en-au,https://d3t3ozftmdmh3i.cloudfront.net/staging/podcast_uploaded_nologo/46361172/46361172-1784074552251-2c395968817ee.jpg,2026-07-23 10:52:02,7966943,confirmed,https://podcasters.spotify.com/pod/show/business--rural-solutions9,1784803922,8981ed46b0d2a3e0020f09929e9e9f68,6793344806.0,2,0,CORPORATE
