title,author,url,description,host_platform,language,image,dateAdded,id,status,link,timeAdded,contentHash,itunesId,source,dead,is_corporate
Voice Memos from your Best Friend,Emily Kraus,https://anchor.fm/s/114e03b74/podcast/rss,Come with me as I go down rabbit holes about pop culture and other things that I like!,Anchor,en,https://d3t3ozftmdmh3i.cloudfront.net/staging/podcast_uploaded_nologo/46352069/46352069-1783962824159-6dac40a6a95a9.jpg,2026-07-16 23:34:55,7959332,confirmed,https://podcasters.spotify.com/pod/show/emily-kraus4,1784244895,85308f25fe49eeff7e257d9715786fec,6790531437.0,2,0,INDIVIDUAL
Sip of Light,Sip of Light Collective,https://anchor.fm/s/1109b9ce8/podcast/rss,"Sip of Light is a podcast for individuals, parents, and healers curious to discover spiritual and alternative healing tools for feeling more whole, more at peace, and more ease in everyday life.
Host Kara has spent decades experimenting with tools like astrology, human design, gene keys, gemmotherapy, alchemical constellations, and more. New to all of this? You're in the right place.
Each episode features healers and wayshowers sharing best practices, real stories, and practical entry points into these topics.
An open mind, an open heart, and some curiosity is all you need. Follow along.",Anchor,en-us,https://d3t3ozftmdmh3i.cloudfront.net/staging/podcast_uploaded_nologo/45636010/45636010-1774725591441-52de542497a6c.jpg,2026-07-16 23:25:48,7959330,confirmed,https://podcasters.spotify.com/pod/show/kara-with-a-k5,1784244348,f43f29c91d2ca6bc0647efd0f9b8303f,1888726299.0,2,0,CORPORATE
Cheap Miracles,Ishmael,https://anchor.fm/s/1134dd49c/podcast/rss,"Audio and video essays about modern life, memory, work, desire and the small things that keep us human.",Anchor,en,https://d3t3ozftmdmh3i.cloudfront.net/staging/podcast_uploaded_nologo/46088351/46088351-1783086447765-170e54c6f632.jpg,2026-07-16 23:21:43,7959329,confirmed,https://podcasters.spotify.com/pod/show/cheap-miracles,1784244103,6ffc53731a89234adc0b556bda638e34,6787386727.0,2,0,INDIVIDUAL
Liberation- Moksha,Pradeep Vijay Spiritual Academy,https://anchor.fm/s/114f1f7b0/podcast/rss,"In this show, Master Pradeep Vijay speaks on Moksha, Liberation, and freedom from inner suffering. He talks about freedom from physical, emotional, mental, and intellectual suffering. Master Pradeep Vijay speaks on Moksha through Patanjali’s Yama and Niyama principles.",Anchor,en,https://d3t3ozftmdmh3i.cloudfront.net/staging/podcast_uploaded_nologo/46363692/46363692-1784113323090-271d17c7d94bd.jpg,2026-07-16 23:15:20,7959326,confirmed,https://podcasters.spotify.com/pod/show/pradeep-vijay-spiritual-a1,1784243720,847ad74f66e225f4db2cc2ce99de7f36,6791156100.0,2,0,CORPORATE
The Art of Speaking Up,Jessica Guzik,https://rss.buzzsprout.com/2630838.rss,"The Art of Speaking Up is a podcast that empowers professional women to achieve their wildest career goals by helping them strengthen their voices and find their inner power.  The show aims to motivate, entertain, and remind working women that no matter what they might be struggling with, anything is possible for them in their careers.  In addition to providing strengths-based professional empowerment, the show curates practical career advice on topics like career advancement, goal setting, job searching, stress management, salary negotiation and more.",Buzzsprout,en,https://storage.buzzsprout.com/v3kpvm41pq1gdk7ad5emfi0v9i46?.jpg,2026-07-16 23:12:03,7959325,confirmed,https://jessicanguzik.podbean.com,1784243523,b622abd4034de377e4c7359ac81d9253,,4,0,INDIVIDUAL
The Case Against Tyler Robinson,Bobby Capucci,https://www.spreaker.com/show/7185391/episodes/feed,"The Case Against Tyler Robinson: The Murder of Charlie Kirk is a comprehensive examination of the criminal case surrounding the killing of Charlie Kirk and the prosecution of the man accused of carrying it out. From the earliest stages of the investigation through the pretrial hearings and, ultimately, the courtroom battle itself, this podcast will follow the evidence wherever it leads. Each episode will break down the testimony, forensic findings, surveillance evidence, legal filings, witness accounts, investigative decisions, and defense challenges that shape the case against Tyler Robinson.<br /><br />This will not be a story told through rumors, internet speculation, or predetermined conclusions. The focus will remain on the record: what prosecutors say they can prove, how the defense attempts to challenge that evidence, and what the court allows the jury to hear. When new evidence emerges, it will be examined carefully. When claims conflict, those contradictions will be explored. When questions remain unanswered, they will not be ignored or filled in with convenient assumptions.<br /><br />The road to trial is rarely direct, especially in a case of this magnitude. There will be delays, motions, evidentiary disputes, strategic maneuvering, unexpected rulings, and developments that could change the direction of the case entirely. The prosecution will be forced to defend the strength of its evidence, while the defense will search for weaknesses, inconsistencies, procedural failures, and reasonable doubt. Every significant twist and turn will be followed, explained, and placed into the larger context of the case.<br /><br />Along the way, the podcast will examine the physical and digital evidence, the timeline of events, the alleged movements of the accused, the handling of forensic material, the statements attributed to those involved, and the decisions made by investigators and prosecutors. It will also look closely at the legal strategies being used on both sides, including efforts to suppress evidence, challenge expert testimony, limit what can be presented at trial, and shape how the jury ultimately understands the case.<br /><br />Most importantly, The Case Against Tyler Robinson will remain grounded in the principle that the evidence must lead the story, not the other way around. The purpose is not to manufacture certainty before the trial has run its course. It is to document the process honestly, scrutinize every major claim, and provide listeners with a clear understanding of what is happening inside and outside the courtroom.<br /><br />As the case develops, the narrative may change. Evidence may become stronger, weaker, or more complicated than it first appeared. Witnesses may offer new information. Legal rulings may reshape the prosecution’s case or the defense’s response. This podcast will follow those developments in real time, separating established facts from contested claims and courtroom evidence from online speculation.<br /><br />From the opening arguments to the final verdict, The Case Against Tyler Robinson: The Murder of Charlie Kirk will track one of the most closely watched criminal proceedings in the country. Wherever the evidence goes, wherever the trial leads, and whatever the final outcome may be, this podcast will be there to document it.<br /><br /><br /><br /><br /><br /><br /><br /><br /><br /><br /><br /><br /><br /><br /><br /><br /><br /><br />",Spreaker,en,https://d3wo5wojvuv7l.cloudfront.net/t_rss_itunes_square_1400/images.spreaker.com/original/2f98e29b069bb103dc3167449f0afd52.jpg,2026-07-16 23:10:41,7959322,confirmed,https://www.spreaker.com/podcast/the-case-against-tyler-robinson--7185391,1784243441,2132929c5e5358643a073d0df65b2d79,,4,0,INDIVIDUAL
The Monday After,Darren Carlson,https://www.spreaker.com/show/7125986/episodes/feed,"The Monday After is a weekly reflection from Darren Carlson—pastor, missionary trainer, and writer—on the ordinary, unglamorous work of following Christ when the crowds have gone home and the week begins again.<br /><br />Each episode moves through a simple rhythm: an honest devotional that doesn't flinch from hard truths, a story of God quietly at work in everyday encounters, and something worth reading to carry you through the week. Expect spare, declarative reflection rooted in Scripture, shaped by the local church, and aimed at the long obedience of staying, showing up, and being known.<br /><br />For anyone who suspects the real test of faith isn't Sunday's high but Monday's grind.",Spreaker,en,https://d3wo5wojvuv7l.cloudfront.net/t_rss_itunes_square_1400/images.spreaker.com/original/0970ef680de0a2ffc1328e7ba94cc0e5.jpg,2026-07-16 22:58:21,7959306,confirmed,https://www.spreaker.com/podcast/the-monday-after--7125986,1784242701,66f75399588cf67e63ff6a000a77f6af,,4,0,INDIVIDUAL
Midnight in the Dark Forest,Aaron Marshall,https://anchor.fm/s/114d81584/podcast/rss,"The fire is lit. The woods are listening. Pull in close. Strange stories, told plain and slow. Some of them happened. Some are stirring tales of fiction. Eerie history, firsthand encounters, old legends, and imaginative journeys from somewhere just off the beaten path. Every story is scored with original music, on Spotify and everywhere else you listen, under Aaron Marshall.
You can also find these on youtube @ https://www.youtube.com/aaronmarshall",Anchor,en-us,https://d3t3ozftmdmh3i.cloudfront.net/staging/podcast_uploaded_nologo/46346729/46346729-1783887117302-c6fe8fa206721.jpg,2026-07-16 22:51:31,7959304,confirmed,https://podcasters.spotify.com/pod/show/aaron-marshall8,1784242291,001c3d385b1420e498ec107d0aebe8f6,6790932437.0,2,0,INDIVIDUAL
Patient Playback with Dr. David K. Tan,St. Charles County Ambulance District,https://anchor.fm/s/110b132b0/podcast/rss,"Acclaimed emergency medical director, Dr. David K. Tan of St. Charles County Ambulance District in Missouri, discusses complicated EMS patient encounters with the paramedics who were on the scene. From unusual cases, cutting edge interventions, to lessons learned in the field, this is as real as it gets. New episodes are coming soon!",Anchor,en-us,https://d3t3ozftmdmh3i.cloudfront.net/staging/podcast_uploaded_nologo/45650156/45650156-1774543632004-ec85eb150eb23.jpg,2026-07-16 22:51:06,7959303,confirmed,https://podcasters.spotify.com/pod/show/sccad,1784242266,400265057536a12cc79396c7eb4ccfc8,6791257218.0,2,0,INDIVIDUAL
Distant Relatives,The First Borns,https://anchor.fm/s/113befe88/podcast/rss,"Two cousins, raised on opposite sides of the world, having the conversations they would have had anyway.
<p>
From identity and relationships to culture, psychology, technology, current events, and life's bigger questions, Distant Relatives follows two cousins with very different upbringings as they compare perspectives, explore what's on their minds, and follow the conversation wherever it leads.
</p>",Anchor,en,https://d3t3ozftmdmh3i.cloudfront.net/staging/podcast_uploaded_nologo/46162514/46162514-1781617786077-f7ca0b97ad27f.jpg,2026-07-16 22:36:38,7959298,confirmed,https://podcasters.spotify.com/pod/show/thefirstborns,1784241398,29cb5518204cbe7eea73ae1564d74e16,1896928761.0,2,0,CORPORATE
Gnarly Radio with Phil Gough,Philip Gough,https://www.spreaker.com/show/7185186/episodes/feed,Hanging with Kim DeSante. Playing my favorite tunes. We have an occasional guest. I do a little playing and talk about upcomming events.,Spreaker,en,https://d3wo5wojvuv7l.cloudfront.net/t_rss_itunes_square_1400/images.spreaker.com/original/38fe3d1214c8c30aeb3033db82a981ba.jpg,2026-07-16 22:34:28,7959297,confirmed,https://www.spreaker.com/podcast/gnarly-radio-with-phil-gough--7185186,1784241268,281b8bde7ac03f5ecdde6c9648d9e2c4,,4,0,INDIVIDUAL
A Platform for Modern Finance,Tensure,https://rss.buzzsprout.com/2629559.rss,"<p>A Platform for Modern Finance is a podcast for technology leaders inside financial services who are trying to modernize without losing control. Each episode explores the decisions behind faster software delivery, stronger compliance, better developer experience, safer AI adoption, and more resilient platforms across banking, payments, insurance, wealth, and fintech. Hosted as practical conversations with operators, architects, security leaders, and industry experts, the show goes beyond buzzwords to unpack how modern financial institutions actually ship, scale, and stay audit-ready.</p>",Buzzsprout,en-us,https://storage.buzzsprout.com/2hyuixh4es0npa7m059z97v1z136?.jpg,2026-07-16 22:34:06,7959296,confirmed,https://www.buzzsprout.com/2629559,1784241246,e1857e86111c88d5611adb2d82ec2b00,,0,0,INDIVIDUAL
Who Does She Think She Is?,Sabeen Faheem,https://www.spreaker.com/show/7185361/episodes/feed,"Who do you think you think you are? Who do I think I am? Let’s find out together! This podcast explores how to stay true to yourself. It will specifically talk about being South Asian and visibly Muslim in the entertainment space. It will also contain Film and TV news, the impact of media on the world, and how it affects audiences. It will have celebrity guests from beloved films and tv shows and will explore their past and upcoming projects. It will showcase diversity and inclusivity in past and upcoming releases, reviews and reactions to global releases including Indian cinema, and personal anecdotes and relatable narratives that showcase the humanity behind entertainment. Hosted by Sabeen Faheem, an entertainment host who encourages you to “wear your heart on your long sleeves” as @thehijabibounder across platforms, this podcast takes you on the journey of how a movie fan became the certified fangirl that you can trust will recommend the best in entertainment to you. ",Spreaker,en,https://d3wo5wojvuv7l.cloudfront.net/t_rss_itunes_square_1400/images.spreaker.com/original/83287b3dd36bad8e57e1f45c724cda88.jpg,2026-07-16 22:20:05,7959292,confirmed,https://www.spreaker.com/podcast/who-does-she-think-she-is--7185361,1784240405,9cf2332e0059b83081ec3f4b91d12843,,4,0,INDIVIDUAL
Feel Good News!,Brandon Liebert,https://rss.buzzsprout.com/2610517.rss,"<p><b>Welcome to Feel Good News-where we shine light on the stories that matter most.  Our goal is to share inspiring stories, uplifting moments, and real-life acts of kindness that remind you the world is full of good.  So if you’re looking for hope, joy, motivation, and to inspire change that brings out the best in all of us, then you’ve come to the right place!</b></p>",Buzzsprout,en-us,https://storage.buzzsprout.com/ugd4lmh649u6q3y401qjisiizl77?.jpg,2026-07-16 22:18:18,7959288,confirmed,,1784240298,e6cc5d9ce50484dd23892f53ff93d38f,,4,0,CORPORATE
Collectors Club AI,Dan Mccabe,https://feeds.redcircle.com/17f84def-c423-4a3b-9506-e6e5c7a04a1a,"Collector's Club AI delivers daily market intelligence for the sports card and collectibles hobby. Each episode breaks down what's HOT, what's COOLING, and which sleepers are quietly heating up — backed by real comps and real sales data, not guesswork.
Built for collectors chasing a grail and dealers moving slabs at volume alike, this show gives you the timing edge to buy, hold, or rip at the right moment. If you're tired of guessing when to list, this is your daily edge.
New episodes drop daily with actionable market moves you can use immediately.",Spotify for Podcasters,en-US,https://media.redcircle.com/images/2026/7/16/21/c3b52cbf-7a48-4989-897a-e9eb9701713b_ccai_logo_full_color_1400x1400px.jpg,2026-07-16 22:16:54,7959286,confirmed,https://redcircle.com/shows/collectors-club-ai,1784240214,ab2fe2b768a21d8eaaad61fdc3536124,,4,0,INDIVIDUAL
Women Game Changers 2026 - Season 6 by Raunaq Roy,Hungama,https://anchor.fm/s/11464a978/podcast/rss,"Hungama Game Changers 2026 is a special podcast series by Hungama celebrating the Women Game Changers of the 2026 cohort across music, video, and gaming. The series brings together an inspiring lineup of creators, leaders, innovators, and changemakers who are shaping the future of entertainment through bold ideas, cultural impact, and fearless creativity.
Through candid conversations and personal stories, the podcast explores the defining moments of their journeys, the challenges they have overcome, and the perspectives that continue to drive their success. Each episode offers valuable insigh",Anchor,en-gb,https://d3t3ozftmdmh3i.cloudfront.net/staging/podcast_uploaded_nologo/46271086/46271086-1782820557835-092852c98bfa3.jpg,2026-07-16 22:16:35,7959285,confirmed,https://podcasters.spotify.com/pod/show/women-game-changers24,1784240195,deeb58264ee1f4f690a237fef5943c46,6790750650.0,2,0,INDIVIDUAL
Shikoku Pilgrimage,yoyochichi,https://anchor.fm/s/113b45730/podcast/rss,The complete route guide for Shikoku 88 sacred sites,Anchor,en-us,https://d3t3ozftmdmh3i.cloudfront.net/staging/podcast_uploaded_nologo/46155532/46155532-1781360213176-04dcc197d9089.jpg,2026-07-16 22:14:58,7959282,confirmed,https://podcasters.spotify.com/pod/show/yoyochichi7,1784240098,52eb9f8362ede958c5b0bff9632dbd6b,6790440038.0,2,0,INDIVIDUAL
Powered to Win Podcast,PowerChampions,https://feed.podbean.com/nkuttam082i/feed.xml,"Powered to Win is the official podcast of PowerChampions, featuring conversations with leaders, operators, technicians, and partners across the skilled trades and critical power industry. Each episode explores what it takes to build resilient service businesses and to work directly for them through conversations surrounding people-first leadership, strong partnerships, workforce development, technology, and a commitment to doing the right thing for customers and communities.",Podbean,en,https://pbcdn1.podbean.com/imglogo/image-logo/22397134/PTW_podcast_logobksi4.jpg,2026-07-16 22:12:53,7959279,confirmed,https://nkuttam082i.podbean.com,1784239973,5dd293fcbc42710271bb867e90df11fa,6782422496.0,2,0,INDIVIDUAL
Audio GA3-240202501-AA2-EV02,Susana,https://www.spreaker.com/show/7185356/episodes/feed,"Throughout this audio, I would like to share some insights into my academic background, my career plans, and my work experience.",Spreaker,en,https://d3wo5wojvuv7l.cloudfront.net/images.spreaker.com/nuvolari-assets/green_square_mic.jpg,2026-07-16 22:06:49,7959277,confirmed,https://www.spreaker.com/podcast/audio-ga3-240202501-aa2-ev02--7185356,1784239609,e36e01379544eb425101d1ac21e5df0c,,4,0,INDIVIDUAL
Conscious Evolution,Danae,https://rss.buzzsprout.com/2629076.rss,"<p><b>Conscious Evolution</b> is where I share the thoughts I can't seem to let go of. No script, no agenda, just honest conversations about life, growth, relationships, work, healing, and everything in between. Think of it as sitting down for coffee while we make sense of this human experience together.</p>",Buzzsprout,en-us,https://storage.buzzsprout.com/bkodj64ey40rwvylbg88qvzpnpu1?.jpg,2026-07-16 22:05:30,7959276,confirmed,https://www.buzzsprout.com/2629076,1784239530,4c07c2954ecaf1bee3cafcaf512cbfd3,,4,0,INDIVIDUAL
This Week in Longevity,Studio Talbot,https://anchor.fm/s/114ca5aac/podcast/rss,"We bring you the week's three biggest stories in longevity, health, fitness, nutrition and consumer health technology. We sift through the studies, follow the product launches, and separate evidence from hype—so you don't have to.",Anchor,en-us,https://d3t3ozftmdmh3i.cloudfront.net/staging/podcast_uploaded_nologo/46337731/46337731-1783951934073-5eec8b594e147.jpg,2026-07-16 21:57:55,7959274,confirmed,https://podcasters.spotify.com/pod/show/kim553,1784239075,bcb1fc31d0c42bdd44830665faec9318,6789839466.0,2,0,CORPORATE
The Sports Advisors Podcast,JohnWallStreet,https://anchor.fm/s/112656c84/podcast/rss,"JohnWallStreet's The Sports Advisors Podcast, is a bi-weekly roundtable discussion of major issues impacting the business of sports by some of the sharpest minds in Sports. This is podcast for decision-makers hosted by genuine peers talking about the stories that actually matter and their second-order effects. Actionable intelligence from senior operators who have actually built, bought, sold, programmed, monetized, and scaled sports businesses.",Anchor,en,https://d3t3ozftmdmh3i.cloudfront.net/staging/podcast_uploaded_nologo/45936041/45936041-1778286392586-781d269412914.jpg,2026-07-16 21:54:21,7959273,confirmed,https://podcasters.spotify.com/pod/show/johnwallstreet,1784238861,5d19c3fd822bb46426d78aee5688f01d,6790923782.0,2,0,INDIVIDUAL
Got Therapy?,Got Therapy?,https://rss.buzzsprout.com/2630611.rss,"<p>What is self-esteem, really? In this episode of Got Therapy?, Dr. Michael Baltimore and Dr. Dan Rose reconsider self-esteem through a psychodynamic lens — not as a high score you defend, but as the acceptance of a complex, often conflicted self.</p><p><br></p><p>The conversation moves through not-me states (the parts of ourselves we'd rather not own, from Sullivan and Bromberg), self-compassion, and why a rigid, always-positive self becomes brittle. Dan walks through normative narcissism after Kohut — why everyone feels a flash of ""I don't measure up"" driving past the neighbor's new car — the spectrum from healthy-level to disordered narcissism, and how mirroring and validation open the door to real change. Along the way: microtrauma and social comparison, holding a relationship with someone whose views you can't stand, and Fromm's question of having vs. being — the thread they carry into next week's ""Cultivate Life.""</p><p><br></p><p>Chapters and timestamps are in the pinned comment.</p><p><br></p><p>Got Therapy? makes complex psychological concepts accessible and practically applicable. New episodes weekly.</p>",Buzzsprout,en-us,https://storage.buzzsprout.com/95r0vl8bd05m4w5mdd3rlfubw415?.jpg,2026-07-16 21:51:54,7959271,confirmed,https://www.buzzsprout.com/2630611,1784238714,24c1b6e1212b913bb2143f0db65031a3,,4,0,INDIVIDUAL
Temple Maison Origins: The First Four Conversations,Temple Maison,https://anchor.fm/s/1140f179c/podcast/rss,"Temple Maison: The Becoming Series
A four-part audio experience exploring identity, nervous system regulation, purpose-driven creation, and personal transformation.
Through founder reflections, practical insights, and embodiment-based conversations, Temple Maison invites listeners to move beyond performance and reconnect with the person they are becoming.
This series serves as an introduction to the philosophy behind Temple Maison where ambition meets presence, creation meets embodiment, and success begins from within.",Anchor,en-us,https://d3t3ozftmdmh3i.cloudfront.net/staging/podcast_uploaded_nologo/46215007/46215007-1782090631979-d391281c2e4ba.jpg,2026-07-16 21:39:39,7959262,confirmed,https://podcasters.spotify.com/pod/show/temple-maison,1784237979,23a053d1478c51402d105cadf2fff370,6786748517.0,2,0,CORPORATE
Yasha,Jeremy Gendelman,https://rss.buzzsprout.com/2630830.rss,"<p><em>When Hitler invaded the Soviet Union in 1941, eleven-year-old Yasha’s mother made a decision that would save generations to come—the decision to flee. </em></p><p>​​<em>​​</em></p><p>What followed was an odyssey spanning thousands of miles in the shadow of two of history’s most brutal regimes.​​ In 2008, Yasha sat with his grandson, Jeremy, who recorded on an old camcorder as he told his story.</p>",Buzzsprout,en-us,https://storage.buzzsprout.com/7yk8ke7cf6a9056q5v3ab69n50ic?.jpg,2026-07-16 21:34:48,7959261,confirmed,,1784237688,2cbe19c118c71570c1ded8f996dfcc7d,,4,0,INDIVIDUAL
Truth to Count On,M.B. Mac,https://feeds.libsyn.com/625525/rss,"The Truth to Count On podcast, hosted by M.B. Mac, is dedicated to studying the academic disciplines through the lens of Scripture so that every field of study will be rightly understood as subject to Jesus Christ.",Libsyn,en-us,https://static.libsyn.com/p/assets/f/1/c/8/f1c848afd4ec38c316c3140a3186d450/TTCOpodcast.jpg,2026-07-16 21:31:27,7959257,confirmed,https://sites.libsyn.com/625525,1784237487,aa63f426b5ee6b2b7d4f672d6407f15a,6791387803.0,2,0,INDIVIDUAL
Still Running,Ashley Arnold and Rebecca Trachsel,https://feeds.transistor.fm/still-running,"Still Running is a podcast for women runners still figuring it out. It’s like the long-run conversation we’re all having — about running, motherhood, hormones, ambition and identity — with expert answers to the questions we’re actually asking. Hosted by Ashley and Trax, two women runners 10 years apart, the show explores what it means to keep chasing big goals through a changing life.",Transistor,en,https://img.transistorcdn.com/faKcD4VmDlFtredNIHmpV_h_-pelZYyMnOpkOxIfrdM/rs:fill:0:0:1/w:1400/h:1400/q:60/mb:500000/aHR0cHM6Ly9pbWct/dXBsb2FkLXByb2R1/Y3Rpb24udHJhbnNp/c3Rvci5mbS9hNjQw/YmU0Mzg0MWYyNzlk/OGM3YzIwMzAzMWY2/YzQwYi5wbmc.jpg,2026-07-16 21:28:28,7959254,confirmed,http://stillrunningpod.com,1784237308,c6edf18c2469b2cdb957ccd1a7ee45e0,,0,0,CORPORATE
Goosed with Kim Blythe,Kim Blythe,https://feeds.acast.com/public/shows/6a1d7f21c1105f0d11ebb0e4,<p>Goosed with Kim Blythe!</p><br><p>Coming soon...</p><hr><p style='color:grey; font-size:0.75em;'> Hosted on Acast. See <a style='color:grey;' target='_blank' rel='noopener noreferrer' href='https://acast.com/privacy'>acast.com/privacy</a> for more information.</p>,Acast,en,https://assets.pippa.io/shows/6a1d7f21c1105f0d11ebb0e4/1784237354728-6907f952-63cc-4a7d-b95b-266ef0a1a908.jpeg,2026-07-16 21:28:23,7959253,confirmed,https://shows.acast.com/goosed-with-kim-blythe,1784237303,9faab8a8022e5bc7770a88700d2b8b58,,0,0,INDIVIDUAL
