title,author,url,description,host_platform,language,image,dateAdded,id,status,link,timeAdded,contentHash,itunesId,source,dead,is_corporate
In the Yo with King Vito,King Vito,https://anchor.fm/s/114618978/podcast/rss,An intimate conversation with your favorite artist and groups on their biggest songs and greatest albums!,Anchor,en,https://d3t3ozftmdmh3i.cloudfront.net/staging/podcast_uploaded_nologo/46269038/46269038-1782771878841-07c66357c37e4.jpg,2026-07-04 02:07:55,7940900,confirmed,https://podcasters.spotify.com/pod/show/king-vito5,1783130875,09465c563b1014f9713533df4efeae3b,6785703243.0,2,0,INDIVIDUAL
Mr. Creeps: Scary Stories & Creepypastas,Mr. Creeps,https://anchor.fm/s/10daac4c8/podcast/rss,"Everybody loves a good scary story, but what if some of those stories turn out to be true? I narrate creepypastas and other horror stories. Perfect for those late nights and rainy days. Sit back and try not to get too scared.",Anchor,en,https://d3t3ozftmdmh3i.cloudfront.net/staging/podcast_uploaded_nologo/45142626/45142626-1767962985560-2300efe162198.jpg,2026-07-04 02:04:41,7940899,confirmed,https://podcasters.spotify.com/pod/show/mr-creeps,1783130681,557171e746d61b3b03f71d379bf69a37,6786270240.0,2,0,INDIVIDUAL
Shooting the Breese: Powered by ASW,Thomas Hakim,https://feeds.acast.com/public/shows/69d03aa1f57702d2d99f94e1,"<p>Shooting the Breese: <em>Powered by ASW</em> is built on straightforward conversations with people who know the industry from the inside out. The conversations focus on what it really takes to build teams, run businesses, and adapt to change in today’s professional landscape.</p><p> </p><p>Each episode captures unscripted sessions where guests share personal experiences, insights, and challenges from their careers. The discussions cover leadership, operations, people management, and how businesses are responding to new expectations and evolving market pressures. There is no gloss and no sales pitch, just honest dialogue.</p><p> </p><p>With the support of AS White Global, conversations touch on global workforce models and how businesses are rethinking productivity and support structures. Daniel’s relaxed approach creates a conversational atmosphere that feels more like a roundtable discussion than a traditional interview.</p><p> </p><p>Shooting the Breese is for professionals who appreciate realism, practical thinking, and hearing how others have navigated similar challenges. Whether you are leading a team or building your next phase of growth, this podcast offers insights grounded in experience.</p><hr><p style='color:grey; font-size:0.75em;'> Hosted on Acast. See <a style='color:grey;' target='_blank' rel='noopener noreferrer' href='https://acast.com/privacy'>acast.com/privacy</a> for more information.</p>",Acast,en,https://assets.pippa.io/shows/69d03aa1f57702d2d99f94e1/1779410991964-1a08bd11-8001-4903-901b-7fce7114eff8.jpeg,2026-07-04 02:01:36,7940898,confirmed,https://shows.acast.com/shooting-the-breese-powered-by-asw,1783130496,aa60a144f864d964cf16193d3389484f,6785342534.0,2,0,INDIVIDUAL
The local quantum conspiracy’s Podcast,localquantumconspiracy,https://feed.podbean.com/localquantumconspiracy/feed.xml,<p>Hello and welcome to the local quantum conspiracy podcast where we cover everything from UAP's to the paranormal.</p>,Podbean,en,https://pbcdn1.podbean.com/imglogo/image-logo/20707838/pdc_logo_1748534962363.jpg,2026-07-04 01:48:10,7940894,confirmed,https://localquantumconspiracy.podbean.com,1783129690,e66e1e403e4c4eb7dc5ff080197c0fe9,1896859100.0,2,0,INDIVIDUAL
Christ Centered Sexuality Podcast,SJ,https://anchor.fm/s/111bf9890/podcast/rss,"The Christ-Centered Sexuality Podcast is a formation-focused, pastoral expression of Christ-Centered Sexuality (CCS). In a cultural moment marked by confusion, fear, and polarization around sex, sexuality, gender, marriage, and singleness, many Christians feel caught between conviction and compassion. This podcast exists to form people within that tension—not inflame it—offering biblical clarity, thoughtful conversation, and pastoral wisdom to help you follow Jesus with courage, humility, and care.
Welcome to the digital living room...pull up a chair. I’m really glad you’re here.",Anchor,en-us,https://d3t3ozftmdmh3i.cloudfront.net/staging/podcast_uploaded_nologo/45827364/45827364-1776812329284-5aebc235a1d21.jpg,2026-07-04 01:47:26,7940893,confirmed,https://podcasters.spotify.com/pod/show/sally-jo1,1783129646,82615abcb398a6988730c7edfb77941e,6786455721.0,2,0,INDIVIDUAL
Titans Latest | Daily Tennessee Titans Podcast,Fan Arch,https://feeds.megaphone.fm/BVLLC9082808867,"<p>Titans Latest is the daily Tennessee Titans podcast from the Fan Arch Network, bringing fans comprehensive coverage of everything happening with the two-tone blue. Whether it's breaking news, roster moves, free agency, draft developments, training camp battles, game previews, postgame reactions, or in-depth analysis, Titans Latest keeps you connected to the stories that matter most.</p>
<p>Each episode delivers timely insights, discussion, and coverage of the biggest headlines surrounding the Titans, while also diving into player performances, coaching decisions, AFC South rivalries, and the team's path toward contention. From offseason speculation to the regular season grind, Titans Latest provides year-round coverage designed for passionate Titans fans who want to stay informed every day.</p>
<p>If you're looking for the latest Tennessee Titans news, analysis, rumors, and opinions all in one place, Titans Latest is your daily destination for everything Titans football.</p>
<p>
</p>",Megaphone,en,"https://megaphone.imgix.net/podcasts/ffe01f14-6426-11f1-b9d5-bf16819f4a12/image/ca69b374e9c081467a0e024de30eb987.png?ixlib=rails-4.3.1&max-w=3000&max-h=3000&fit=crop&auto=format,compress",2026-07-04 01:25:31,7940887,confirmed,https://fanarch.com/pages/titans-latest,1783128331,91361b3aa27cd1bcbe98081ce64c6c62,1896908551.0,2,0,INDIVIDUAL
Beyond the Ordinary,Charlese Ambers,https://rss.buzzsprout.com/2616080.rss,"<p>Beyond the Ordinary is the podcast for people who know they were meant for more.</p><p>More freedom.<br>More purpose.<br>More impact.<br>More adventure.<br>More life.</p><p><br></p><p>Hosted by mental health therapist and entrepreneur Charlese Ambers, Beyond the Ordinary explores the powerful intersection of mental health, entrepreneurship, identity, and human potential.</p><p><br></p><p>Because building an extraordinary life isn't just about strategy.</p><p>It's about overcoming fear.<br>Breaking free from limiting beliefs.<br>Trusting yourself when no one else understands the vision.<br>And developing the emotional resilience to keep going when comfort is calling your name.</p><p><br></p><p>Through honest conversations, inspiring stories, expert interviews, and practical action steps, you'll hear from entrepreneurs, creators, professionals, and everyday people who dared to challenge the status quo and pursue something greater.</p><p>If you've ever felt called to a bigger life but struggled with self-doubt, anxiety, perfectionism, fear of failure, or the opinions of others, you're in the right place.</p>",Buzzsprout,en-us,https://storage.buzzsprout.com/e772atz5ix0io02r0a4ekkbyzdae?.jpg,2026-07-04 01:24:24,7940886,confirmed,,1783128264,df13992ef478ef8e4260842d4afd2009,,4,0,INDIVIDUAL
Inner Lives,Mariana Crestani,https://feeds.transistor.fm/inner-lives,"Inner Lives invites you into the rich inner worlds of modern women. 

Through intimate conversations and reflective storytelling, Mariana Crestani explores identity, ambition, motherhood, relationships, aging, and reinvention. This show offers language for the questions we quietly live with and remind us that there’s no one right way to live a meaningful life.",Transistor,en,https://img.transistorcdn.com/9AOu7w4FRSDq5FD9geOtZC6sTBQ3A98RMgviTLN1B2Q/rs:fill:0:0:1/w:1400/h:1400/q:60/mb:500000/aHR0cHM6Ly9pbWct/dXBsb2FkLXByb2R1/Y3Rpb24udHJhbnNp/c3Rvci5mbS9hMzNh/ODM2NjllNWNmNWQ2/MzJlYWFmNmM1ZTQ1/YjdmMi5wbmc.jpg,2026-07-04 01:18:39,7940883,confirmed,http://Www.innerlivespodcast.com,1783127919,b0c180bef6f703131536083ec71f1945,,4,0,INDIVIDUAL
'LEVEL UP' Podcast,Ross Brown,https://rss.buzzsprout.com/2518570.rss,"<p>The LEVEL UP Podcast</p><p>Hosted by Ross Brown</p><p><br></p><p>This is a show for the disciplined,  not the distracted.</p><p><br></p><p>Each week, we sit down with real people doing real work, entrepreneurs, leaders, athletes, and creators who are levelling up with serious intent in their field.</p><p><br></p><p>We talk money, mindset, failure, and focus.</p><p>No hype. No bullshit. Just honest conversations from people building what actually matters.</p><p><br></p><p>If you’re tired of surface-level success stories and ready for the unfiltered truth behind what it really takes,  this is the podcast for you.</p><p><br></p><p><br></p>",Buzzsprout,en-au,https://storage.buzzsprout.com/c688opgtl6lqal1mg029b47tvnwc?.jpg,2026-07-04 01:17:15,7940882,confirmed,https://www.buzzsprout.com/2518570,1783127835,7bd94ce1bf98735a7c906de44ad9d89e,,4,0,INDIVIDUAL
Mama Juliana Toronto Food Reviews,Mama Juliana,https://anchor.fm/s/110bc12ac/podcast/rss,"Mama Juliana is a Toronto-based food review podcast where two everyday food lovers break down the city’s dining scene through the abuela’s view - honest, detailed, and always real. From food and cocktails to ambiance, service, and the full experience, we dive into it all through fun, energetic conversations.",Anchor,en,https://d3t3ozftmdmh3i.cloudfront.net/staging/podcast_uploaded_nologo/45657283/45657283-1774624376863-4d3d018ea2054.jpg,2026-07-04 01:17:14,7940881,confirmed,https://podcasters.spotify.com/pod/show/amit-sayal,1783127834,bb189a3b8ffd9f74a2e6d496862e34c1,1888528129.0,2,0,INDIVIDUAL
Tiny Big Quiz | The Weekly Quiz Podcast,Tiny Big Quiz - The Pocket Size Trivia Card Game,https://anchor.fm/s/10dd76a78/podcast/rss,"The Tiny Big Quiz Podcast is the fast, fun weekly quiz you can play anywhere.
Every Friday, join host Neil Bentley as he rolls the dice and brings you 10 questions chosen live from the official Tiny Big Quiz app. From history and geography to movies, music, sport, science and everything in between - every episode is different!
Whether you’re on the school run, commuting, walking the dog or looking for a family quiz night in your pocket, you’ve got 30 seconds to answer each question and see how many points you can score.
🔗 www.tinybigquiz.com >> Use Code: POD10 for 10% off",Anchor,en-gb,https://d3t3ozftmdmh3i.cloudfront.net/staging/podcast_uploaded_nologo/45171886/45171886-1782915889563-02c358f74ae5a.jpg,2026-07-04 01:14:39,7940879,confirmed,https://www.tinybigquiz.com,1783127679,fe891255357a5fb064f6bf9e5434f937,6786328245.0,2,0,INDIVIDUAL
Unlocking More,Brittany McWilliams,https://anchor.fm/s/11449888c/podcast/rss,"Your trusted guide to Indianapolis real estate. Brittany McWilliams sits down with local experts and real clients to share the stories and strategies you need to buy, sell, or invest with confidence. Expect practical advice, community insights, and a focus on what matters most to you. Let’s unlock more together in Indy!",Anchor,en-us,https://d3t3ozftmdmh3i.cloudfront.net/staging/podcast_uploaded_nologo/46253307/46253307-1782565607252-ceef86f540242.jpg,2026-07-04 01:09:01,7940878,confirmed,https://podcasters.spotify.com/pod/show/toms-fonseca-and-timothy-93,1783127341,adbf15b6b895058281f9446f67b5566b,6785009685.0,2,0,INDIVIDUAL
Faith Wins,Chad Connelly,https://feeds.libsyn.com/620395/rss,"Faith Wins with Chad Connelly is a podcast centered on faith, leadership, and the role pastors play in shaping communities and culture across America. Hosted by Chad Connelly, the show features conversations with pastors, faith leaders, and influential voices who are leading with conviction, purpose, and a Biblical worldview.
Chad brings decades of leadership experience to the microphone. A Clemson University engineering graduate, former US Army Armor officer, business leader, former South Carolina GOP Chairman, and the Republican National Committee's first-ever National Director of Faith Engagement, Chad has spent years speaking to pastors and faith communities nationwide. Through Faith Wins, he continues his mission to inspire, inform, and equip faith leaders to engage culture and lead boldly in today's world, because when pastors lead, faith wins.",Libsyn,en,https://static.libsyn.com/p/assets/f/9/3/6/f936850b34c1da0c16c3140a3186d450/Chad_Connelly_Faith_Wins_Thumbnail_.jpg,2026-07-04 01:07:50,7940876,confirmed,https://sites.libsyn.com/620395,1783127270,ee5132e9c7b6170230e40a09ae5ac745,1896825866.0,2,0,INDIVIDUAL
The Soft Revolution Podcast,Siri Birk,https://anchor.fm/s/11449f204/podcast/rss,"The Soft Revolution Podcast is a weekly drop in hosted by somatic coach, artist, and entrepreneur Siri Birk.
An exploration on creative expression, emotional liberation, embodied leadership, and living a life rooted in generosity, reciprocity, and reverence for the Earth and the path of choosing authenticity over efficiency, every day. 
Welcome to the Soft Revolution!",Anchor,en,https://d3t3ozftmdmh3i.cloudfront.net/staging/podcast_uploaded_nologo/46253577/46253577-1782569473270-646c69a1a728e.jpg,2026-07-04 01:01:29,7940873,confirmed,https://podcasters.spotify.com/pod/show/sirbyr5,1783126889,dcd79956be5b07b33d92eb1b44f1a300,6787066191.0,2,0,INDIVIDUAL
Murder of Words on AAC,Chelsea Hagen,https://rss.buzzsprout.com/2627391.rss,"<p>Hi, I’m Chelsea Hagen — creator of Noggin Art by Chelsea, host of Murder of Words on AAC, English student, artist, writer, and proud owner of a sexy robot voice.</p><p>I live in Alberta, where I create art with my brain, write too many words for my degree, and use an AAC device with two head switches to communicate. I’m powered by curiosity, dark humour, and the firm belief that crows and sarcasm are both highly underrated.</p><p>Welcome to my little corner of the internet — where art, stories, podcasts, and occasional chaos all live together.</p>",Buzzsprout,en-ca,https://storage.buzzsprout.com/vx8inaorxvnq6zrdh5msd169ynij?.jpg,2026-07-04 01:00:53,7940872,confirmed,https://murderofwordsonaacpodcast.buzzsprout.com,1783126853,5637c0e859156cae30e7a11cb1010d59,,0,0,INDIVIDUAL
The Crevice: The Mystery of a Financier's Fall,,https://www.spreaker.com/show/7152219/episodes/feed,"When Pennington Lawton, a wealthy financier, dies unexpectedly from what seems like a heart attack, his daughter Anita is left in shock. With the revelation that her father was on the brink of bankruptcy, Anita finds herself nearly destitute and desperate for answers. Determined to uncover the truth behind her father's death and the sudden loss of their fortune, she hires renowned detective Henry Blaine. As Blaine delves into the case, he uncovers a web of deceit and hidden motives that leads to unexpected twists and shocking revelations. Will Anita find the closure she seeks, or will the truth prove more dangerous than she ever imagined? 'Crevice' is a gripping detective fiction that explores themes of family loyalty, betrayal, and the lengths one will go to uncover the truth. Join Henry Blaine as he navigates dark secrets and complex relationships in a race against time to bring justice to a family torn apart by tragedy.",Spreaker,en,https://d3wo5wojvuv7l.cloudfront.net/t_rss_itunes_square_1400/images.spreaker.com/original/4409295feef710595858141534f7580c.jpg,2026-07-04 00:59:22,7940871,confirmed,https://www.spreaker.com/podcast/the-crevice-the-mystery-of-a-financier-s-fall--7152219,1783126762,33bccdd81004ed5996213c53170d6299,,4,1,UNKNOWN
Struggle Bus,Struggle Bus,https://anchor.fm/s/1146299bc/podcast/rss,Nick Viagas and Ivy Wolk's podcast,Anchor,en-us,https://d3t3ozftmdmh3i.cloudfront.net/staging/podcast_uploaded_nologo/46269735/46269735-1782786985305-628e38f703366.jpg,2026-07-04 00:59:05,7940870,confirmed,https://podcasters.spotify.com/pod/show/olivia331,1783126745,9959c856ed6c9c4c4fd782243b0fa23a,6786772180.0,2,0,INDIVIDUAL
Tape & Testimony,Joshua Pfortmiller,https://feeds.acast.com/public/shows/6a4853605ef16cb804373480,"<p>Behind every case, there is a record.</p><p><strong>Tape & Testimony</strong> features real police interrogations, interviews, witness statements, and courtroom testimony from some of the most famous and compelling criminal cases. Through official recordings and public record materials, each episode takes you inside the moments where stories change, pressure builds, and the truth begins to surface.</p><hr><p style='color:grey; font-size:0.75em;'> Hosted on Acast. See <a style='color:grey;' target='_blank' rel='noopener noreferrer' href='https://acast.com/privacy'>acast.com/privacy</a> for more information.</p>",Acast,en,https://assets.pippa.io/shows/cover/1783124824880-bff48c1c-0bfa-4345-9e4b-6d6efb06463a.jpeg,2026-07-04 00:49:14,7940866,confirmed,https://feeds.acast.com/public/shows/tape-testomony,1783126154,3a16bca3809ea40fed053cefc3be6117,,0,0,INDIVIDUAL
CTW's Movies that Made Us,Chasing the Whimsy,https://anchor.fm/s/1121f1518/podcast/rss,"Old Man Ben and his friends Lasagna and Hammer as they revisit the movies that shaped them—emotionally, creatively, and sometimes questionably. From the cartoons that sparked their love of animation, to the anime that blew their minds, to the scrappy indie films of the 90s and the comedies that walked the line between absurdity and brilliance, nothing is off the table.
Each episode, they watch, debate, and celebrate the films that left a mark on their lives. Whether you’re here for nostalgia, discovery, or just to hear three friends passionately disagree, pull up a seat. Join the convo.",Anchor,en,https://d3t3ozftmdmh3i.cloudfront.net/staging/podcast_uploaded_nologo/45889942/45889942-1778062392303-d7a8bd5eec85f.jpg,2026-07-04 00:48:49,7940865,confirmed,https://podcasters.spotify.com/pod/show/chasing-the-whimsy3,1783126129,e3c9ecd0a05eac32de7b857da79064f5,1896941541.0,2,0,INDIVIDUAL
All-New Everyday Agenda With LHMusic & Friends,,https://rss.buzzsprout.com/2353557.rss,"It’s all about the everyday things I do in my agenda like Omaha Symphonic Chorus, Wednesday Night Choir Rehearsal at church, Voluntary work at the VA Hospital, go to coffee shops like 13th Street Coffee or Sozo Coffeehouse & so much more on my new podcast every Weekend.",Buzzsprout,en,https://d3wo5wojvuv7l.cloudfront.net/t_rss_itunes_square_1400/images.spreaker.com/original/348770259471611f8a8b3d06fd7d33a2.jpg,2026-07-04 00:43:06,7940861,confirmed,https://lhmusictime6.wixsite.com/everyday-agenda,1783125786,8f6ea2ff36c0b929f101ef75a7772c0e,,4,1,UNKNOWN
The Lanier Collection,Josh Dower,https://anchor.fm/s/113d9eab8/podcast/rss,"Welcome to The Lanier Collection Podcast, your premier source for navigating luxury real estate on North Lake Lanier. Join us as we decode the waterfront market, from dock permits to finding your dream lakeside estate. 
Whether you’re an investor or buying your forever home, we provide the insights needed to master the Georgia lake lifestyle. Don’t settle for less—elevate your search today. 
Explore exclusive property portfolios and expert market advice at https://thelaniercollection.com/",Anchor,en,https://d3t3ozftmdmh3i.cloudfront.net/staging/podcast_uploaded_nologo/46180158/46180158-1781645107915-73efeed0c50f4.jpg,2026-07-04 00:38:56,7940857,confirmed,https://podcasters.spotify.com/pod/show/josh-dower1,1783125536,2208b1718b19154041c4050a50206022,6784458420.0,2,0,INDIVIDUAL
Licensed to Overthink,Brittany Sperry and Becca Smith,https://feeds.libsyn.com/622630/rss,"Welcome to Licensed to Overthink: Anxiety and Other Hobbies—the podcast for people whose brains are always just a little too committed to the assignment.
If you've ever replayed a conversation, overanalyzed a text message, worried about something that hasn't happened yet, or wondered whether everyone else has life figured out, you're our people.
Join us each week as we explore anxiety, mental health, relationships, resilience, and the wonderfully weird ways our minds work. With a blend of professional insight, personal experience, and plenty of humor, we're here to remind you that you're not the only one overthinking it.
And no, that thing you said five years ago probably wasn't weird.",Libsyn,en,https://static.libsyn.com/p/assets/3/1/c/3/31c37e2d6f7389a9d959afa2a1bf1c87/Licensed2overthink_logo_1400.png,2026-07-04 00:35:33,7940856,confirmed,https://sites.libsyn.com/622630,1783125333,23c5c66f65eda8a36bb31a63d30a9c74,6786513233.0,2,0,CORPORATE
Season 2 Episode 4 Tool Time,Matthew Chanler Marc Gaskin,https://feeds.transistor.fm/season-2-episode-4-tool-time,Season 2 Episode 4 Tool Time,Transistor,en,https://img.transistorcdn.com/X1G9TFkibRF5xMrsaH-xgrO_lNvjCvH8rUhmxNVd1_0/rs:fill:0:0:1/w:1400/h:1400/q:60/mb:500000/aHR0cHM6Ly9pbWct/dXBsb2FkLXByb2R1/Y3Rpb24udHJhbnNp/c3Rvci5mbS81NTg5/ZTY3NDA1Yjc4YTEy/Mjc3MDgwMjViNjA5/MzU0OS5wbmc.jpg,2026-07-04 00:35:03,7940855,confirmed,,1783125303,a25d3f3ae4fbafe26dfd8288bfa04772,,4,0,INDIVIDUAL
Challenger Teaches Me: League of Legends Champion Guides,We Teach League,https://anchor.fm/s/113e940e4/podcast/rss,"Challenger Teaches Me is a League of Legends show where a Challenger player teaches host Nathan Mott how to play one champion per episode. We cover the best build and runes, live practice tool mechanics, a deep strategy interview, and a full VOD review of a real Challenger game. We also expose the common mistakes and community myths that keep most players stuck on that champion. Every episode closes with a matchup tier list from hardest to easiest. Brought to you by We Teach League.",Anchor,en,https://d3t3ozftmdmh3i.cloudfront.net/staging/podcast_uploaded_nologo/46190209/46190209-1781759026362-163bcbc540f29.jpg,2026-07-04 00:33:50,7940852,confirmed,https://weteachleague.com/,1783125230,03bb7d9f85b9e6b52650e343cd210fcd,6786893643.0,2,0,INDIVIDUAL
The Uncaged Leader with Lucas Sherraden,Lucas Sherraden,https://feed.podbean.com/theuncagedleaderwithlucassherraden/feed.xml,"<p class=""p1"">Success doesn’t always feel like freedom.</p>
<p class=""p2""></p>
<p class=""p1"">On <b>The Uncaged Leader</b>, leadership coach and speaker Lucas Sherraden helps entrepreneurs, executives, and high-achieving leaders uncover the hidden internal programming driving stress, burnout, conflict, reactivity, and disconnection — even when everything looks successful on the outside.</p>
<p class=""p2""></p>
<p class=""p1"">Most leadership advice teaches people how to perform. Very little teaches leaders how to become free.</p>
<p class=""p1"">Through powerful stories, leadership psychology, practical frameworks, interviews, and honest conversations, Lucas helps leaders recognize their autopilot patterns, increase self-awareness, replace judgment with curiosity, and lead with greater peace, clarity, and purpose.</p>
<p class=""p2""></p>
<p class=""p1"">This podcast is for leaders who:</p>
<ul class=""ul1"">
<li class=""li1"">Feel trapped in pressure, performance, or constant responsibility</li>
<li class=""li1"">Are burned out, emotionally exhausted, or internally misaligned</li>
<li class=""li1"">Want healthier relationships, stronger teams, and meaningful success</li>
<li class=""li1"">Desire conscious leadership instead of reactive leadership</li>
<li class=""li1"">Are ready to break free from the invisible cage of unconscious stories and survival patterns</li>
</ul>
<p class=""p2""></p>
<p class=""p1"">This is not hustle culture, surface-level motivation, or empty inspiration.</p>
<p class=""p1"">This is leadership transformation rooted in awareness, emotional resilience, curiosity-driven leadership, and lasting internal change.</p>
<p class=""p2""></p>
<p class=""p1"">If you’ve built success but still feel heaviness, frustration, anxiety, or disconnection… this show is for you.</p>
<p class=""p1"">Because the greatest limitation in leadership is rarely external.</p>
<p class=""p1"">It’s the invisible cage we never learned to question.</p>",Podbean,en,https://pbcdn1.podbean.com/imglogo/image-logo/22331017/The_Uncaged_Leader_-_Podcast_Art891hj.png,2026-07-04 00:24:51,7940848,confirmed,https://theuncagedleaderwithlucassherraden.podbean.com,1783124691,606e273c35b1d8838a5bb07e24923a78,1896898599.0,2,0,INDIVIDUAL
Duffy Diaries,Travis Michael,https://anchor.fm/s/10cf9b318/podcast/rss,"Duffy Diaries is a lifestyle podcast recorded on and around the water, featuring real conversations about business, dating, travel, and everyday chaos. Hosted by Travis Michael, with guests, stories, and perspectives you won’t hear anywhere else",Anchor,en,https://d3t3ozftmdmh3i.cloudfront.net/staging/podcast_uploaded_nologo/45026582/45026582-1766105524991-fe3b5aaa68fb9.jpg,2026-07-04 00:24:37,7940847,confirmed,https://duffydiaries.com,1783124677,e94309ba407800d0a7845e78847c6565,1862645408.0,2,0,INDIVIDUAL
Carrington’s Call,Carrington Dantzler,https://anchor.fm/s/ecc6d990/podcast/rss,One man’s walk. A brotherhood’s calling. This is where faith meets the fire of reality. I’m not perfect but I know and serve a God who is. Join me on my walk and who knows we can walk together,Anchor,en-us,https://d3t3ozftmdmh3i.cloudfront.net/staging/podcast_uploaded_nologo/39624548/39624548-1779723518346-040070d89ccb.jpg,2026-07-04 00:13:58,7940837,confirmed,https://podcasters.spotify.com/pod/show/carrington-dantzler0,1783124038,f2bb165a9cde5495d7ca423672bdb4db,1896812895.0,2,0,INDIVIDUAL
