title,author,url,description,host_platform,language,image,dateAdded,id,status,link,timeAdded,contentHash,itunesId,source,dead,is_corporate
Holler At Hollingsworth,Michael & Michelle Hollingsworth,https://rss.buzzsprout.com/2454753.rss,"<p>Married couple, Michelle & Michael Hollingsworth, living and working together while building their businesses: Hollingsworth Homes Real Estate and Hollingsworth Homes Construction.</p>",Buzzsprout,en-us,https://storage.buzzsprout.com/86vvnlikm1gl5uhsaz0l3n99pcr3?.jpg,2026-07-17 11:59:08,7959891,confirmed,https://www.hollingsworthhomes.com,1784289548,d7185332e1aa6bffe6f5865dfa4da43e,,4,0,CORPORATE
A Stellar Insight,Ezra,https://anchor.fm/s/f9fa3c38/podcast/rss,"Science And technology, Spirituality And The Universe",Anchor,en,https://d3t3ozftmdmh3i.cloudfront.net/staging/podcast_uploaded_nologo/41839262/41839262-1744841966181-ffc1510a57b7e.jpg,2026-07-17 11:56:38,7959888,confirmed,https://astellarinsight.podbean.com/,1784289398,0d97b62d3364382c4f76624abfc4c72e,,0,0,INDIVIDUAL
My Brothers Boy,Teko And Duece,https://anchor.fm/s/113f43d64/podcast/rss,"Welcome to My Brother’s Boy—the podcast where an uncle and nephew break down sports, music, relationships, internet culture, and the random questions everybody argues about but never has the answers to. From blind rankings and WWYD scenarios to GOAT debates and hot takes, every episode feels like sitting in on a conversation you weren’t supposed to hear.",Anchor,en-us,https://d3t3ozftmdmh3i.cloudfront.net/staging/podcast_uploaded_nologo/46197409/46197409-1781843439591-b2acc49c2a12.jpg,2026-07-17 11:43:56,7959880,confirmed,https://podcasters.spotify.com/pod/show/my-brothers-boy,1784288636,df8a67beb6674c65ef986620f2b32437,6791624213.0,2,0,CORPORATE
Off Tha Record Podcast,Jay Mack,https://anchor.fm/s/10fa754f8/podcast/rss,"Off Tha Record is where real conversations live. We talk life, culture, relationships, music, and everything in between — unfiltered and unapologetic. Nothing is scripted, nothing is sugarcoated. Just honest opinions, different perspectives, and conversations people are already having… just not always out loud.
If it’s trending, controversial, inspiring, or personal — we’re speaking on it. This is the space where culture meets real life.",Anchor,en,https://d3t3ozftmdmh3i.cloudfront.net/staging/podcast_uploaded_nologo/45475918/45475918-1772388544907-b0e0cd15fee57.jpg,2026-07-17 11:40:24,7959875,confirmed,https://podcasters.spotify.com/pod/show/offtharecordpodcast,1784288424,31535d305fad04f68faa1e79e15d2a77,6791165459.0,2,0,INDIVIDUAL
Country Soul with Jamie and Jay,Jamie and Jay Santilli,https://anchor.fm/s/fb2d1558/podcast/rss,"<p>Explore the heart and soul of country music with hosts Jay and Jamie Santilli. <br><br>This podcast brings you authentic conversations with performers, songwriters, and enthusiasts, providing a genuine look into the rich tapestry of the genre. Join us for engaging discussions, fun anecdotes, and a celebration of all things country music. Subscribe now to be part of a community where passion meets authenticity.  <br><br>Tune in and immerse yourself in the genuine spirit of ""Country Soul""!</p>",Anchor,en-au,https://d3t3ozftmdmh3i.cloudfront.net/staging/podcast_uploaded_nologo/42040358/0221a98e0f4e1d31.jpg,2026-07-17 11:35:13,7959872,confirmed,https://www.buzzsprout.com/2234295,1784288113,01ecc457614cd7c06b9e72f339d3c1b5,,4,0,CORPORATE
Milk Toast,KY3,https://anchor.fm/s/10bcc74bc/podcast/rss,"Welcome to the most mediocre morning show you’ve ever seen! Ever wanted an experience that you never asked for? PERFECT!! Welcome to Milk Toast, The morning show you didn’t ask for!!!",Anchor,en,https://d3t3ozftmdmh3i.cloudfront.net/staging/podcast_uploaded_nologo/44829159/44829159-1780899690553-8d34f99d64c57.jpg,2026-07-17 11:31:25,7959869,confirmed,https://podcasters.spotify.com/pod/show/idsalepacl8,1784287885,30f9891fbde01d139a2f114417c80320,1896902972.0,2,0,INDIVIDUAL
9 av and Co,Floriane Claire Coopaname CHINSKY,https://feeds.captivate.fm/9-av/,faire face aux catatrophes,Captivate,en,https://artwork.captivate.fm/26ea9951-d613-4bb5-b629-e21e0fe1559f/9-av-and-co.jpg,2026-07-17 11:26:35,7959864,confirmed,https://9-av.captivate.fm,1784287595,f9c564b4edb37e216dab656d2ba64042,,4,0,INDIVIDUAL
The Multipliers Framework: Are You Growi,Nolan Hout,https://www.spreaker.com/show/7178053/episodes/feed,"Are your leadership practices helping employees reach their full potential—or unintentionally limiting their growth? In this episode, we explore The Multipliers Framework and how leaders can create environments where individuals and teams thrive. Discover the key differences between leaders who amplify talent and those who unintentionally diminish performance, along with practical strategies for building a culture of trust, accountability, and continuous development. The discussion highlights how empowering leadership drives innovation, improves collaboration, strengthens employee engagement, and supports long-term business success. Whether you're a business leader, manager, HR professional, or Learning and Development executive, this episode offers actionable insights to help you unlock the full potential of your workforce. Learn how adopting a multiplier mindset can transform leadership effectiveness and create lasting organizational impact. 🎧 Listen to the full episode:<br /><br /><a href=""https://www.infoprolearning.com/podcast/the-multipliers-framework-are-you-growing-talent-or-shrinking-it/"" target=""_blank"" rel=""noreferrer noopener"">https://www.infoprolearning.com/podcast/the-multipliers-framework-are-you-growing-talent-or-shrinking-it/</a>",Spreaker,en,https://d3wo5wojvuv7l.cloudfront.net/t_rss_itunes_square_1400/images.spreaker.com/original/92a9d082e73ff036769720a28fc2095a.jpg,2026-07-17 11:22:52,7959857,confirmed,https://www.infoprolearning.com/podcast/the-multipliers-framework-are-you-growing-talent-or-shrinking-it/,1784287372,891e98dca910bbfec6f5ca2fc3a762e2,,4,0,INDIVIDUAL
9umba 9umba Moments,Thabiso,https://rss.buzzsprout.com/2630934.rss,"<p>Welcome to the ultimate rhythm journey. Every week, Teza delivers a fresh, uninterrupted mix of the hottest underground sounds, and exclusives . Whether you're hitting the gym, getting ready for the weekend, or just vibing, this is your soundtrack. Subscribe now and let the music play.</p>",Buzzsprout,en-us,https://storage.buzzsprout.com/mupjn7uwqhmlpcptjegim71gtz39?.jpg,2026-07-17 11:22:15,7959856,confirmed,,1784287335,4f268e351137d6e94bbdf1bc22ab2b10,,4,0,INDIVIDUAL
The Yankovictionary,Oscar,https://rss.buzzsprout.com/2630757.rss,"<p>This is a weekly podcast where I randomly select a Weird Al Yankovic song and talk about it. This podcast may have have slightly inappropriate terms, so I would only recommend for people above 9 years old.<br>Enjoy listening, have a nice day and stay weird!</p>",Buzzsprout,en-au,https://storage.buzzsprout.com/l32yihdjl3w8e3946alh3vndm7j0?.jpg,2026-07-17 11:22:11,7959855,confirmed,,1784287331,96395e9780a1100ca488e0d98c85502b,,4,0,INDIVIDUAL
The Holy Ghost Action Campaign Series,Charismatic Evangelistic Ministry,https://anchor.fm/s/114f0b1e8/podcast/rss,"The Holy Ghost Action Campaign Series features powerful messages, worship, and life-changing moments from the annual Holy Ghost Action Campaign hosted by the Charismatic Evangelistic Ministry (CEM) in Accra, Ghana. Led by Rev. Steve Mensah and Rev. Eastwood Anaba, this revival is centered on prayer, the Word, worship, and the transforming power of the Holy Spirit. Be inspired, strengthened, and equipped to pursue God's presence and live a Spirit-filled life.",Anchor,en,https://d3t3ozftmdmh3i.cloudfront.net/staging/podcast_uploaded_nologo/46362858/46362858-1784100011402-e0ca7ef555ed5.jpg,2026-07-17 11:21:09,7959853,confirmed,https://podcasters.spotify.com/pod/show/nappy95,1784287269,bb8e730318e9023722c09ce9cd9c262e,6791112377.0,2,0,CORPORATE
Life Had Other Ideas,Phil Beastall,https://anchor.fm/s/efdcfe84/podcast/rss,"Life Had Other Ideas is a podcast exploring how ordinary people adapt when life doesn’t go to plan. Through honest, thoughtful conversations, guests share the experiences that shaped them, the challenges they faced, the lessons they learned, and the perspectives they’ve gained along the way. Every story is different, but each offers a glimpse into what it means to navigate the twists and turns of life.",Anchor,en-gb,https://d3t3ozftmdmh3i.cloudfront.net/staging/podcast_uploaded_nologo/40142377/40142377-1780430754064-5cb0c16d838ed.jpg,2026-07-17 11:18:36,7959851,confirmed,https://podcasters.spotify.com/pod/show/philbeastall,1784287116,cdb1c1b6c857c34916b4edd1769c0412,6785598228.0,2,0,INDIVIDUAL
DFW Blogger,John Fite,https://rss.buzzsprout.com/2630882.rss,"<p> </p><p>DFWBlogger is your inside guide to everything happening across the Dallas–Fort Worth Metroplex, from local history and hidden gems to breaking news, attractions, events, and colorful Texas stories. Through articles, podcasts, and videos, DFWBlogger keeps North Texans informed, entertained, and connected to the people, places, and stories that make DFW unique.</p>",Buzzsprout,en-us,https://storage.buzzsprout.com/z5mz42tashelz7ltcr7fiqluygmy?.jpg,2026-07-17 11:07:45,7959846,confirmed,https://dfwblogger.buzzsprout.com,1784286465,8374aff2d8e521028b9a7ad9f5a5b68a,,4,0,INDIVIDUAL
Medical Practice Growth,John V,https://anchor.fm/s/114d92c08/podcast/rss,"The show for interventional pain practices that want more consults and procedures on the schedule. I'm John Verdyan. I run paid patient acquisition for insurance-based clinics every single day: real budgets, real consults, real procedures booked. Here I break down what fills procedure days: ads built for pain patients, intake that screens out med-seekers, follow-up that carries patients through both diagnostic blocks, and reporting your practice can bill against. SCS, RFA, Intracept, Vertiflex, SI fusion. One problem per episode, 20 to 30 minutes. For pain practice owners and administrators.",Anchor,en,https://d3t3ozftmdmh3i.cloudfront.net/staging/podcast_uploaded_nologo/46347442/46347442-1783896352301-7c41d6927c11e.jpg,2026-07-17 11:00:09,7959839,confirmed,https://podcasters.spotify.com/pod/show/john-v0,1784286009,97e998703b73e9abd08ac0e67b653766,6790212936.0,2,0,INDIVIDUAL
Midwest Bettys,Midwest Bettys,https://rss.buzzsprout.com/2013071.rss,Two midwest barrel racers decided to start a podcast to talk about topics related to the horse industry with hopes to help beginner barrel racers and others struggling with finding their way in the horse industry.,Buzzsprout,en-us,https://storage.buzzsprout.com/t3q0a6dccb2xi3gsgamxmr7zu5dq?.jpg,2026-07-17 10:59:29,7959837,confirmed,https://express.adobe.com/page/PDFCblDWbOwcs/,1784285969,6bc7ef2f7f436b5905c429220389392d,,4,0,INDIVIDUAL
Culture of Paint,Drew Toynbee,https://feeds.captivate.fm/culture-of-paint/,Culture of Paint is a hobby podcast for miniature enthusiasts that focuses on painting. Hosted by award winning painters Henry Steele and Andy Wardle,Captivate,en,https://artwork.captivate.fm/96f22bcd-c3f5-4c9d-a534-4466ce706ade/Culture-of-Paint-Logo-1400x1400.jpg,2026-07-17 10:56:43,7959833,confirmed,https://culture-of-paint.captivate.fm,1784285803,0f181218003f7778d3d91e01a1dbbd7b,,4,0,INDIVIDUAL
I'd Love to Chat... with The Luvely Rae,The Luvely Rae,https://rss.buzzsprout.com/2046256.rss,"<p>Welcome, let's have a chat. If you've ever had a chance to chat with The Luvely Rae at one of her New York City shows, then you may recall that she is always more than happy to discuss the little things, and as always to hear your thoughts. In this podcast The Luvely Rae (a rather lovely intellectual ecdysiast) invites you stay awhile for a brief conversation on the cultures and cultural changes. The thought provoking topics are meant to be conversation starters, and are provided akin to the popular weather girls of 1955 and the stimulating interludes of Gypsy Rose Lee. If there's a topic you'd like to chat about, feel free connect.</p>",Buzzsprout,en-us,https://img.transistorcdn.com/FJpuY_l1Is7wUkCJ_sFO3cIyHArcYfm7YswfsAbT1os/rs:fill:0:0:1/w:1400/h:1400/q:60/mb:500000/aHR0cHM6Ly9pbWct/dXBsb2FkLXByb2R1/Y3Rpb24udHJhbnNp/c3Rvci5mbS9kZGU4/Y2NkZmZhNWIxMTI5/NzJmMjk2Y2VkNmM3/NWZjMy5qcGVn.jpg,2026-07-17 10:53:19,7959832,confirmed,https://idlovetochat.buzzsprout.com,1784285599,ba17120b9065ce8a1fb435968560ec56,,4,0,CORPORATE
Beau on Biography,Sarah Beaupre,https://anchor.fm/s/113b0bcec/podcast/rss,"Every remarkable life has a story worth telling. Join host Sarah Beaupre as she explores the lives of artists, writers, musicians, world leaders, scientists, saints, and other fascinating people whose stories shaped our world. Through thoughtful storytelling and carefully researched narratives, Beau on Biography goes beyond the headlines to discover the human beings behind history—revealing the moments, relationships, and choices that continue to inspire us today. History gives us names, stories give us people.",Anchor,en-us,https://d3t3ozftmdmh3i.cloudfront.net/staging/podcast_uploaded_nologo/46153171/46153171-1784121636021-cd4679489d9d.jpg,2026-07-17 10:44:56,7959828,confirmed,https://podcasters.spotify.com/pod/show/sarah-beaupre77,1784285096,4ee06d022c1d9f8bfa63f72fb9f23d8c,6791189010.0,2,0,INDIVIDUAL
The Mindset Generation,Adela Warkentin,https://anchor.fm/s/1147d6328/podcast/rss,"The world knows what they have achieved. This is who they really are.
Adela Warkentin, a sought-after mindset and executive coach, sits down with athletes, entrepreneurs, scientists, and thought leaders for conversations that reach past the résumé and into the person. Guests have included Bob Roth, CEO of the David Lynch Foundation, and Super Bowl champion Robert Turbin. Each episode moves beyond what they've achieved to explore who they are: the values that shaped them, the meaning behind what they built, and where they stand in life today. Together we explore human beyond achievement.",Anchor,en,https://d3t3ozftmdmh3i.cloudfront.net/staging/podcast_uploaded_nologo/46287290/46287290-1783046222928-b91d45a76d7fd.jpg,2026-07-17 10:36:12,7959814,confirmed,https://podcasters.spotify.com/pod/show/adela0,1784284572,962787a74be5613dde25aeb9c464ee18,6790969321.0,2,0,INDIVIDUAL
En ruta. Un viaje con quienes van de viaje.,La Radio Tomada,https://feeds.acast.com/public/shows/6a4d92c6ad78abcff1e9e02a,"Una iniciativa de la Unidad de Comunicaciones de Organización Internacional para las Migraciones en El Salvador, destinada a sensibilizar e informar sobre cuestiones migratorias. El pódcast busca desmitificar la migración, rompiendo con las narrativas simplistas y estigmatizantes en el discurso público y mediático.<hr><p style='color:grey; font-size:0.75em;'> Hosted on Acast. See <a style='color:grey;' target='_blank' rel='noopener noreferrer' href='https://acast.com/privacy'>acast.com/privacy</a> for more information.</p>",Acast,en,https://assets.pippa.io/shows/6a4d92c6ad78abcff1e9e02a/show-cover.jpg,2026-07-17 10:31:08,7959810,confirmed,https://www.ivoox.com/podcast-en-ruta-un-viaje-quienes-van-de_sq_f12613446_1.html,1784284268,40ac7db32330632448b407e36f9c7bc5,6788567103.0,2,0,CORPORATE
Warren County Sports Authority Show,Jeffery Simmons,https://anchor.fm/s/1121ae3a8/podcast/rss,"Join Jeff Simmons, Chris Sullens and Trevor Evans as they talk Warren County sports, life and everything else!",Anchor,en,https://d3t3ozftmdmh3i.cloudfront.net/staging/podcast_uploaded_nologo/45887194/68c50b0653cf0981.jpg,2026-07-17 10:19:55,7959800,confirmed,https://WCSportsAuthority.podbean.com,1784283595,f464c4dbc4a69f16a6c75aea784f02d2,1895961242.0,2,0,INDIVIDUAL
Balancing Unhinged,Amber H. Shah,https://anchor.fm/s/1015be7b0/podcast/rss,"Welcome to Balancing Unhinged with Amber Shah, the Shah of Saint Augustine.
Amber is a mother of two, Licensed Florida Realtor®, Registered Sivananda Yoga Teacher, Reiki Healer, NASM Certified Nutrition Coach, Personal Trainer, Group Exercise Instructor, author of Yoga in Sales, world traveler, trophy wife, and proudly unhinged elder millennial navigating life in the 21st century.
This podcast explores the intersection of real estate, wellness, motherhood, personal growth, spirituality, business, community, and everyday chaos. Join Amber now!",Anchor,en-us,https://d3t3ozftmdmh3i.cloudfront.net/staging/podcast_uploaded_nologo/43077676/43077676-1739855638780-bd1bb135d857a.jpg,2026-07-17 10:18:10,7959797,confirmed,https://www.ambershah.online,1784283490,d9e5d647c9b1aab8a6f8103875c76785,6788075601.0,2,0,INDIVIDUAL
rebekah's Journey,rebekah's Journey,https://www.spreaker.com/show/7186116/episodes/feed,"She left everything she knew—her family, her home, her future—to follow a divine calling she could not fully see. Rebekah's journey is one of faith, trust, and the courage to say ""yes"" when the path ahead was uncertain. Chosen to become the wife of Isaac and the mother of nations, her story reveals how God weaves ordinary lives into extraordinary purposes. From a simple act of kindness at a well to becoming a matriarch of Israel, Rebekah's steps were ordered by heaven. This episode explores her legacy of faith, her pivotal role in biblical history, and the power of choosing God's plan over comfort. Faith, divine appointment, biblical women, God's guidance, and the journey of obedience.",Spreaker,en,https://d3wo5wojvuv7l.cloudfront.net/t_rss_itunes_square_1400/images.spreaker.com/original/02a3538240f9c6d4332ba8ab404a1708.jpg,2026-07-17 10:14:37,7959795,confirmed,https://www.spreaker.com/podcast/rebekah-s-journey--7186116,1784283277,9d2bb1c7f41dd166ff5364d614b6eebc,,4,0,INDIVIDUAL
The Tech Side of Life,Soul Driven Studios,https://anchor.fm/s/113b9cc74/podcast/rss,"The Tech Side of Life is the podcast where technology meets humanity. Hosted by Akil Johnson and Jermaine Cobbs, we explore AI, emerging tech, productivity, creativity, communication, and digital culture through the lens of everyday life. Instead of chasing hype, we ask a simple question: does it actually make life better? Through insightful conversations, humor, and real-world stories, we examine how technology shapes the way we live, work, create, and connect. Technology gives us the topic. Humanity gives us the meaning.",Anchor,en,https://d3t3ozftmdmh3i.cloudfront.net/staging/podcast_uploaded_nologo/46159109/46159109-1781403191053-dba6d2414e5e5.jpg,2026-07-17 10:10:52,7959791,confirmed,https://podcasters.spotify.com/pod/show/soul-driven-studios,1784283052,ac8d4029045860aa373b83de69a4a74f,6791648056.0,2,0,INDIVIDUAL
The Archive,Sarah Ryan Davis and Dr. Pia Taylor,https://anchor.fm/s/1139923e8/podcast/rss,"The Archive is a modern gallery where stories become memory stones. Conversations, testimonies, and real talk — all pointing back to Jesus. Because what the Lord has done is worth remembering.",Anchor,en,https://d3t3ozftmdmh3i.cloudfront.net/staging/podcast_uploaded_nologo/46137706/46137706-1784133519936-4939ecefe0184.jpg,2026-07-17 10:07:48,7959786,confirmed,https://podcasters.spotify.com/pod/show/the-archivexpodcast,1784282868,0398bb90f8c662d93fa8c0b57fd3aa38,1896908479.0,2,0,CORPORATE
The Brick Wall,Media Thesis,https://anchor.fm/s/114390f5c/podcast/rss,"The Brick Wall is the completely unscripted, poorly rehearsed and barely produced podcast of Media Thesis, a performance marketing agency that does media a whole lot better than they do content.
Hosted by Chris Sullivan and Bauer Fichter, each episode features candid conversations, sometimes with actual industry leaders, and the people building what’s next in marketing, media, AI, and business growth. The Brick Wall breaks through the real stories behind modern business success - the wins, the pivots, and the strategies that actually moved the needle.",Anchor,en,https://d3t3ozftmdmh3i.cloudfront.net/staging/podcast_uploaded_nologo/46242511/46242511-1782434064803-f0aa851c570cd.jpg,2026-07-17 09:45:49,7959767,confirmed,https://podcasters.spotify.com/pod/show/media-thesis,1784281549,cbf695b2a1007de36b065aab8ed5fe50,6785905325.0,2,0,CORPORATE
ZAIDYN Insights,ZAIDYN by ZS,https://rss.buzzsprout.com/2630920.rss,"<p><b>ZAIDYN Insights</b> is a podcast exploring how AI, data and connected intelligence are transforming life sciences. Through conversations with ZS experts, industry leaders, clients and guest voices, each episode shares practical insights on commercial strategy, medical affairs, clinical development, patient engagement and the evolving role of AI in driving smarter decisions. Presented by ZAIDYN, the life sciences intelligence platform from ZS. </p>",Buzzsprout,en-us,https://storage.buzzsprout.com/upbqlcn4zmylnectugiyq0cwdcwk?.jpg,2026-07-17 09:40:40,7959763,confirmed,,1784281240,e817a057a6a013c99f4ca11e7ad55d71,,4,0,INDIVIDUAL
testaa,kara,https://www.spreaker.com/show/6045877/episodes/feed,tessssssssss,Spreaker,en,https://d3wo5wojvuv7l.cloudfront.net/images.spreaker.com/nuvolari-assets/blue_square_mic.jpg,2026-07-17 09:35:53,7959758,confirmed,https://www.spreaker.com/podcast/testaa--6045877,1784280953,068937fc64c0e956abceb9f87ee15b14,,4,0,INDIVIDUAL
Rising Action,Ryan Teigen,https://www.spreaker.com/show/6005178/episodes/feed,"The Rising Action Podcast is a story of human limits. On this podcast, we talk to experts in adventure and extreme sports about their stories, and how to push the human limits. Get connected with our social media links for GoWFO below.   www.gowfo.com",Spreaker,en,https://d3wo5wojvuv7l.cloudfront.net/t_rss_itunes_square_1400/images.spreaker.com/original/384ec52957514ed6696c36f456e93002.jpg,2026-07-17 09:35:24,7959757,confirmed,https://www.spreaker.com/show/rising-action,1784280924,dd2bee8a9c8e155ed6d1ac066d2bf5ca,,4,0,INDIVIDUAL
En sintonía con los 80s y 90s,supernova correo,https://www.spreaker.com/show/5880387/episodes/feed,Comentario de la musica de los 80s y 90s,Spreaker,en,https://d3wo5wojvuv7l.cloudfront.net/t_rss_itunes_square_1400/images.spreaker.com/original/d097ab047f9361577c2b61a481d9d524.jpg,2026-07-17 09:35:15,7959756,confirmed,https://www.spreaker.com/podcast/en-sintonia-con-los-80s-y-90s--5880387,1784280915,e3c5dd8159b08a0717bcf6ed6dabeb6a,,4,0,INDIVIDUAL
R.P. Talks Podcast,Zafer Karaaslan,https://www.spreaker.com/show/5919392/episodes/feed,It's a place where I talk about red pill and everything else.,Spreaker,en,https://d3wo5wojvuv7l.cloudfront.net/t_rss_itunes_square_1400/images.spreaker.com/original/b400cae58622f69710e703b55f503b40.jpg,2026-07-17 09:34:50,7959753,confirmed,https://www.spreaker.com/podcast/r-p-talks-podcast--5919392,1784280890,564291dd2a8cb3f8083991721702c5b2,,4,0,INDIVIDUAL
The Radical Texan,Jackson Chisholm,https://www.spreaker.com/show/5854317/episodes/feed,"Welcome to The Radical Texan, where today we talk about a message from ERCOT, and what this means for Texans.",Spreaker,en,https://d3wo5wojvuv7l.cloudfront.net/t_rss_itunes_square_1400/images.spreaker.com/original/f5d60d273da1cf2484c96ab1e387abe5.jpg,2026-07-17 09:34:34,7959752,confirmed,https://www.spreaker.com/podcast/the-radical-texan--5854317,1784280874,23865b760f9ad6228ba47e4219a5d1eb,,4,0,INDIVIDUAL
Canadian Birth Journeys - Birth Stories From Across Canada,Sara Mason,https://anchor.fm/s/10fe18aec/podcast/rss,A space for mothers to share their journeys to motherhood from pregnancy through birth to the postpartum experience.,Anchor,en-ca,https://d3t3ozftmdmh3i.cloudfront.net/staging/podcast_uploaded_nologo/45514067/45514067-1782152525039-bf6787b87a775.jpg,2026-07-17 09:24:35,7959746,confirmed,https://podcasters.spotify.com/pod/show/sarafissel,1784280275,7fa92c6fa919c0ed262d26dc58898ca2,6783913846.0,2,0,INDIVIDUAL
What's in a Name?,WRKdefined Podcast Network,https://rss.buzzsprout.com/2353523.rss,<p>Ever wondered if there was any meaning in your name? My podcast explores all things onomatology... the study of names!</p>,Buzzsprout,en-us,"https://megaphone.imgix.net/podcasts/1d9a2ad2-7c6d-11f1-adbc-ab63cf34dd74/image/e28cdf6737fecb13a243d92a596dc97e.png?ixlib=rails-4.3.1&max-w=3000&max-h=3000&fit=crop&auto=format,compress",2026-07-17 09:13:07,7959740,confirmed,https://wrkdefined.com/podcast/whats-in-a-name,1784279587,7e5299b114e6184007c6f16d7525a615,,4,0,CORPORATE
The Nagano Pulse,Alain R.,https://anchor.fm/s/113765048/podcast/rss,"Your essential monthly briefing from the heart of the Japanese Alps. The Nagano Pulse brings you the latest local news, community stories, and regional updates from across Nagano Prefecture—from the bustling streets of Nagano City to the quiet peaks of Hakuba and the valley of Ina. Whether you’re a lifelong resident, an expat, or just love the prefecture, tune in every month for sharp insights, upcoming local events, and the stories shaping life in the roof of Japan.",Anchor,en,https://d3t3ozftmdmh3i.cloudfront.net/staging/podcast_uploaded_nologo/46114882/46114882-1780817733858-779bb5c560ffc.jpg,2026-07-17 09:08:43,7959738,confirmed,https://podcasters.spotify.com/pod/show/alain-riedacker9,1784279323,0f04d4d4a50844ca936b3b1efaea53ec,6781546009.0,2,0,INDIVIDUAL
