title,author,url,description,host_platform,language,image,dateAdded,id,status,link,timeAdded,contentHash,itunesId,source,dead,is_corporate
The Petra Show,Petra Velzeboer,https://anchor.fm/s/1122626dc/podcast/rss,"Petra Velzeboer is a psychotherapist, author, keynote speaker and Entrepreneur. 
Her clients include global organisations across law, finance, tech and healthcare. 
She created The Petra Show to share the unfiltered conversations, ideas and insights that have shaped how she thinks about high performance, resilience, business and mental health - challenging listeners to take radical accountability for their lives and impact.",Anchor,en,https://d3t3ozftmdmh3i.cloudfront.net/staging/podcast_uploaded_nologo/45894575/45894575-1777711314867-2fd037ecd177d.jpg,2026-07-22 19:21:11,7966140,confirmed,https://www.petravelzeboer.com/,1784748071,b869821a7edbdfd5074b66df1d4f3851,1896104696.0,2,0,INDIVIDUAL
Fragments,Colin Mason,https://rss.buzzsprout.com/2632047.rss,"<p>Try to realise it’s all within yourself, no one else can make you change.<br>And to see you’re really only very small. And life flows on within you and without you.</p><p>When you’ve seen beyond yourself, then you may find peace of mind is waiting there. And the time will come when you see we’re all one. And life flows on within you and without you . . . . . .</p>",Buzzsprout,en-gb,https://storage.buzzsprout.com/dkqb10idv57asrolfgmkm0p4yl3o?.jpg,2026-07-22 19:20:20,7966137,confirmed,,1784748020,44baf37d0a29fbbfa9cbca102be8a82f,,4,0,INDIVIDUAL
The 602,Sarah and Maddie,https://rss.buzzsprout.com/2614750.rss,"<p>A podcast about Evanston: family life, schools, local gems, and what everyone's talking about. Good faith community conversations for all of us. </p>",Buzzsprout,en-us,https://storage.buzzsprout.com/4vczzc9dtf3k2xdj5gtxk6f9kzej?.jpg,2026-07-22 19:10:34,7966130,confirmed,,1784747434,f7adada3225868043acf6b16340a6bab,,0,0,CORPORATE
The Playdate Podcast by Ubongo,Ubongo,https://anchor.fm/s/110b8ed34/podcast/rss,"The Playdate is a parenting podcast for modern African caregivers raising confident, curious, and emotionally intelligent kids. Each episode blends real parent stories, expert insights, and practical tools on child development, learning through play, and social-emotional growth. From tantrums to independence, we help you navigate parenting with confidence. Join a growing community of parents learning, laughing, and raising the next generation together.",Anchor,en,https://d3t3ozftmdmh3i.cloudfront.net/staging/podcast_uploaded_nologo/45655221/45655221-1783981053172-d024da5cb82c6.jpg,2026-07-22 19:09:28,7966129,confirmed,https://the-playdate-by-ubongo.base44.app,1784747368,6f1bfe90b4952ae209debfb3a4e0ab99,6790592728.0,2,0,INDIVIDUAL
Chasing Wisdom Podcast,Rodney Lauriston,https://feeds.transistor.fm/chasing-wisdom-podcast,"Chasing Wisdom is real talk on money, faith, and the climb. Hosted by Rodney Lauriston, each episode breaks down credit repair, building wealth, and staying grounded in God while chasing the bag. No fluff — just lessons learned the hard way and wisdom worth passing on.",Transistor,en-us,https://img.transistorcdn.com/bRrxNvBxDB7i5f3DYSYVS86GV0orMZfLtXujSczMMmU/rs:fill:0:0:1/w:1400/h:1400/q:60/mb:500000/aHR0cHM6Ly9pbWct/dXBsb2FkLXByb2R1/Y3Rpb24udHJhbnNp/c3Rvci5mbS9lODU3/ZjU0NGVmZTUxYjhk/ODNiNDk0NGRhNmYz/NGQ0MC5qcGc.jpg,2026-07-22 19:09:01,7966128,confirmed,https://sites.libsyn.com/625290,1784747341,fbb1419ca87c91d63960ea3eb8ad8881,,4,0,INDIVIDUAL
That’s Delivered Podcast,Trucking Ray,https://rss.buzzsprout.com/2317422.rss,"<p>Welcome to “That’s Delivered Podcast” (TDP) your ultimate destination for all things trucking and beyond! Here, we take you behind the wheel and dive deep into the world of trucking, delivering stories, insights, and experiences designed to inspire, educate, and entertain.</p><p><br /></p><p>Our podcast isn’t just about transportation; it’s about reliability, accomplishment, and fulfillment. “That’s Delivered Podcast” reflects the sense of completion that comes with meeting promises and exceeding expectations, whether on the road or in life.</p><p><br /></p><p>Whether you’re a seasoned trucker, a logistics enthusiast, or just curious about the backbone of our economy, this is the place for you. We’ll explore life on the road, uncover how technology is reshaping the industry, and break down the latest regulations impacting drivers and businesses alike.</p><p><br /></p><p>So buckle up, hit the road with us, and join a community that understands the journey is just as important as the destination. From personal stories to industry insights, “That’s Delivered Podcast” brings the best of trucking straight to your ears, promising every mile together will be worth the ride!</p>",Buzzsprout,en,https://hosting-media.riverside.com/media/imports/podcasts/21b8dc11-021c-48e1-80ce-373b44a57fce/2pwryot9i2s3yxz6h4uv0hk6ojai.jpg,2026-07-22 19:02:00,7966124,confirmed,https://www.thatsdelivered.com,1784746920,ee512608f750d7e299161d4dff9a3496,,4,0,INDIVIDUAL
Upwell,Only One,https://rss.buzzsprout.com/2067172.rss,"<p>Upwell, a podcast from Only One featuring weekly interviews with entrepreneurs, advocates, and leaders working to protect and restore the ocean and the planet. See the full show notes at www.only.one/upwell</p>",Buzzsprout,en-us,https://storage.buzzsprout.com/1jfyottipn65rlxa4zxe5suu6qyo?.jpg,2026-07-22 18:54:38,7966122,confirmed,http://www.only.one/upwell,1784746478,e0b70ed3835cdbd3591fc017ef8baf75,,4,0,INDIVIDUAL
YSPACE,Thorsten Hock,https://feeds.captivate.fm/yspace/,"Dr. Ava Yoon, CEO at YSPACE, is talking about YSPACE and LOOP",Captivate,en,https://artwork.captivate.fm/0c61bae7-c362-4350-8f32-3cc6aed2178e/DrAvaYoon-1400-1400.jpg,2026-07-22 18:54:36,7966121,confirmed,https://yspace.captivate.fm,1784746476,1a565eafe5cc7a535d5aa261a5038494,,4,0,INDIVIDUAL
PrepareCast,PREPARE Magazine,https://feeds.transistor.fm/preparecast,"PrepareCast is the practical preparedness podcast from PREPARE Magazine.

Each episode helps ordinary people make clearer decisions before, during, and after disruptions—without fearmongering, survivalist theater, or generic checklists.

PrepareCast Brief delivers focused guidance and practical actions you can use today. PrepareCast Deep Dive examines hidden dependencies, competing decisions, realistic alternatives, and the steps that help people move from uncertainty toward personal agency.

Practical preparedness for uncertain times.

Learn more at PrepareMagazine.com.",Transistor,en,https://img.transistorcdn.com/9eXDLmY9egf48nmoSSk3WKCEidsUbRTK6COnhAPEx9w/rs:fill:0:0:1/w:1400/h:1400/q:60/mb:500000/aHR0cHM6Ly9pbWct/dXBsb2FkLXByb2R1/Y3Rpb24udHJhbnNp/c3Rvci5mbS9iYTU4/ZTc0ZWM0OTNjYzIx/OThjYWY1YmEwMmJm/MThhZi5wbmc.jpg,2026-07-22 18:51:44,7966119,confirmed,https://preparecast.com,1784746304,1855eb0d164dc5e269bbb631de7812b9,,4,0,INDIVIDUAL
Figuring It Out in my Fifties,Keith D,https://rss.buzzsprout.com/2632043.rss,<p>Just a guy in his 50s telling stories of life and love. Hopefully give some insights on things to do and NOT to do based on my own experiences. </p>,Buzzsprout,en-us,https://storage.buzzsprout.com/mv4onme1ykapatje8wx76tii751h?.jpg,2026-07-22 18:51:31,7966116,confirmed,,1784746291,915ab0781f57a849bb1da523c8e1cac5,,0,0,INDIVIDUAL
The Hard Calls,Rebecca Feder,https://feeds.transistor.fm/the-hard-calls,"Hi, I'm Rebecca Feder from Princeton HR Insight. I spend my weeks helping CEOs and HR leaders make the people decisions that are hard to get right. This is The Hard Calls, where I'm using AI to turn what I'm seeing in the field into a short conversation you can listen to between meetings.",Transistor,en,https://img.transistorcdn.com/e3KJFbdf99nNQ0bWROhUIOezBgf9SBVgyerbif7dguo/rs:fill:0:0:1/w:1400/h:1400/q:60/mb:500000/aHR0cHM6Ly9pbWct/dXBsb2FkLXByb2R1/Y3Rpb24udHJhbnNp/c3Rvci5mbS8zMzEy/YmI1MWVlMjFhODQ5/M2ZjMGU1N2M5ZTAx/NzVkMS5wbmc.jpg,2026-07-22 18:42:32,7966111,confirmed,,1784745752,5fd24460626fafa73a3e31f4e8b96db7,,4,0,INDIVIDUAL
The Scaling Myth,David Smailes,https://anchor.fm/s/1125a3d3c/podcast/rss,"The day you hit your biggest revenue month should feel like a victory.
But if you are like the founders I talk to, you didn’t blow out any candles. Instead, you looked at your ballooning payroll, the cracks in your culture, and your own exhausted reflection, and you realized….You cannot physically work any harder than this.
You did exactly what you were supposed to do. You tried to scale. 
74% of high-growth business fail right here because they scaled too soon or out of sequence. 
This is The Scaling Myth. 
We’ll demystify scaling and show you how to scale your business without you.",Anchor,en,https://d3t3ozftmdmh3i.cloudfront.net/staging/podcast_uploaded_nologo/45928711/45928711-1778191409827-b4f63449d0f47.jpg,2026-07-22 18:42:02,7966110,confirmed,https://podcasters.spotify.com/pod/show/davidsmailes-us,1784745722,c7d19941f7d9ca6fb5d231523e4ad061,1896607387.0,2,0,INDIVIDUAL
Ad Law Tool Kit Show,Venable LLP,https://feeds.transistor.fm/ad-law-tool-kit-show,"If your organization is counting on you to identify potentially problematic advertising and marketing practices, or avoid them altogether, you’ve come to the right place. Welcome to Venable’s Ad Law Tool Kit Show. Join partners <a href=""https://www.venable.com/professionals/g/leonard-l-gordon"" rel=""noopener noreferrer"" target=""_blank"">Len Gordon</a> and <a href=""https://www.venable.com/professionals/r/shahin-o-rothermel"" rel=""noopener noreferrer"" target=""_blank"">Shahin Rothermel</a> of our award-winning <a href=""https://www.venable.com/services/industries/advertising-and-marketing"" rel=""noopener noreferrer"" target=""_blank"">advertising and marketing law team</a> as they examine the increasingly complex regulatory landscape. Each week, they’ll dive into a new issue and help build your advertising law tool kit.<hr><p style='color:grey; font-size:0.75em;'> Hosted on Acast. See <a style='color:grey;' target='_blank' rel='noopener noreferrer' href='https://acast.com/privacy'>acast.com/privacy</a> for more information.</p>",Transistor,en,https://img.transistorcdn.com/oeQt1YJKUaunLedXonePwf5xU6xl23mF-F7sMOzLwvU/rs:fill:0:0:1/w:1400/h:1400/q:60/mb:500000/aHR0cHM6Ly9pbWct/dXBsb2FkLXByb2R1/Y3Rpb24udHJhbnNp/c3Rvci5mbS80YTZm/MjMzZjE1NmI5ZjRk/OWVjM2RmMDM2NWM2/Zjg2Ni5qcGVn.jpg,2026-07-22 18:39:47,7966106,confirmed,https://venable.com/toolkitshow,1784745587,ca725b2396a2f30d7dffa211d6a9309f,,4,0,INDIVIDUAL
Nutmeg Original Music Podcast,Nutmeg Original Music Series,https://rss.buzzsprout.com/2632048.rss,"<p>The Nutmeg Original Music Series is a twice-monthly, curated showcase for songwriters performing in Connecticut. The Nutmeg Original Music Podcast features  upcoming performers talking about songwriting, influences and a specific song they will perform at their performance, followed by their preferred expression of that song. You can learn more about Nutmeg on Instagram:  @nutmegoriginalmusicseries</p>",Buzzsprout,en-us,https://storage.buzzsprout.com/r7oa5k7oax0mvdds6xaj2nyqzhle?.jpg,2026-07-22 18:35:02,7966102,confirmed,,1784745302,433a1a2d87dce6be4e7569de506b7174,,4,0,INDIVIDUAL
The Atmospheric Intelligence™ Podcast with Dr. Tapeka Fennell-Francis,Dr. Tapeka Fennell-Francis,https://anchor.fm/s/114bb4a08/podcast/rss,"Welcome to The Atmospheric Intelligence™ Podcast with Dr. Tapeka Fennell-Francis, a pioneering exploration into the next evolution of natural medicine, human awareness, and intentional living. Through conversations that inspire curiosity, reflection, and discovery, The Atmospheric Intelligence™ Podcast takes listeners on a journey beyond traditional wellness - exploring the hidden patterns, natural intelligence, and interconnected systems that shape the human experience. Join Dr. Tapeka Fennell-Francis as she explores a new frontier in natural medicine - where science meets wonder!",Anchor,en,https://d3t3ozftmdmh3i.cloudfront.net/staging/podcast_uploaded_nologo/46327858/46327858-1784041733011-da7b054290871.jpg,2026-07-22 18:27:07,7966097,confirmed,https://podcasters.spotify.com/pod/show/dr-tapeka-fennell-francis9,1784744827,565688de143c1ec45c4dd3a5426a3557,6791710457.0,2,0,INDIVIDUAL
Track Heads,Gregory Kyle Schmidt,https://rss.buzzsprout.com/2632049.rss,"Podcast about Track & Field, sports, weightlifting and everything we are passionate about.",Buzzsprout,en-us,https://storage.buzzsprout.com/cvyilr1axad0wl9kye42ug0hu5ac?.jpg,2026-07-22 18:24:55,7966094,confirmed,https://podcasters.spotify.com/pod,1784744695,611e2ef74a006021e09067a2ec9fb00d,,4,0,INDIVIDUAL
McGill Baptist Church,McGill Baptist Church,https://anchor.fm/s/115001304/podcast/rss,"Listen to sermons from McGill Baptist Church in Concord, North Carolina. Learn more at https://www.mcgillbaptist.com/",Anchor,en-us,https://d3t3ozftmdmh3i.cloudfront.net/staging/podcast_uploaded_nologo/46372937/46372937-1784233826120-cdf48e681776e.jpg,2026-07-22 18:22:19,7966089,confirmed,https://podcasters.spotify.com/pod/show/mcgill-baptist,1784744539,171e253d67ad75660d89ff88083e3b52,6791728611.0,2,0,CORPORATE
Vet School Unfiltered,Bryson Durst,https://rss.buzzsprout.com/2632045.rss,"<p>Welcome to Vet School Unfiltered, a podcast for aspiring veterinarians at every stage of the journey. Hosted by an Animal Science student pursuing exotic animal medicine, each episode explores the road to vet school through honest conversations, expert interviews, and practical advice. From gaining veterinary experience and building a competitive application to exploring career paths and life in veterinary medicine, this podcast is here to educate, inspire, and help you take the next step toward earning your DVM.</p><p><br></p>",Buzzsprout,en-us,https://storage.buzzsprout.com/ail57ebmm3j50612jijt1euw0y4k?.jpg,2026-07-22 18:22:03,7966088,confirmed,,1784744523,76de6d7a28f574574b57ba149f24f118,,4,0,INDIVIDUAL
Become Magnetic,Sheyma,https://rss.buzzsprout.com/2632038.rss,"<p>This isn't another podcast about growth hacks and posting schedules. This is where we talk about becoming the woman people can't stop watching, the one whose brand feels so aligned with who she actually is that opportunities stop feeling like something she chases and start feeling like something that finds her.</p><p><br></p><p>Each episode breaks down what it actually takes to build a MAGNETIC PERSONAL BRAND: the identity shifts, the belief changes, the content and feminine sales strategy, but always through the lens of who you're becoming, not just what you're posting. </p><p>We talk personal branding, sales that doesn't feel like begging, content that attracts your dream audience & clients  without you having to convince anyone of anything, and the mindset work most people skip because it's less ""sexy"" than a content calendar.</p><p><br></p><p>If you're a female coach or entrepreneur who's tired of playing small, tired of sounding like everyone else, and ready to build a brand — and a business — that's undeniably, magnetically <em>you</em>, this is your space.</p>",Buzzsprout,en-us,https://storage.buzzsprout.com/grfh10m216scyvzm0hycczxlinzn?.jpg,2026-07-22 18:19:37,7966085,confirmed,,1784744377,e0e6db45293620bb9143b34f851c5db4,,4,0,INDIVIDUAL
Her Health Ally,Grace St Pierre,https://feed.podbean.com/HerHealthAlly/feed.xml,"<p>Have you ever felt like you know something is wrong, but you just don't know what?</p>
<p>You feel on edge, maybe lingering symptoms bother you or someone you love. Fatigue, brain fog, low energy, forgetfulness...or maybe more physical symptoms such as heart racing, stomach upset, bloating, irregular cycles, hair or skin changes or pain. Or maybe its your child, with vague and persistent symptoms or behavior changes like irritability, melt-downs more often, waking up at night, or concerns like leg pain, headaches or belly pain. </p>
<p>You FINALLY go to the doctor... (because let's face it, none of us want to deal with the 'brush off') and the labs come back ""normal"" and there's no plan. Or you get the ""anxiety"" talk from your provider... and offered band aid medications with no real plan and no follow up. </p>
<p></p>
<p>You deserve to be heard. </p>
<p>You deserve a Health Ally. </p>
<p></p>
<p>Welcome, to Her Health Ally. I'm Grace, your hostess- an integrative family and lifestyle medicine nurse practitioner and mom of two. I've repeatedly seen the failings of the healthcare system- in myself, my children, my spouse, my family, my friends... I can't be silent. The best way I know to help- is to share, to educate, to empower you- to be the best advocate for yourself, your family you can be.  </p>
<p>You can ask questions without judgement. Your story is unique, it's yours alone. But you aren't alone any longer. I believe you. And now, I'm in your corner. </p>
<p>No more isolation; no more feeling like you're the only one. Autoimmune disease, celiac, infertility, cancer, nutritional deficiencies, brain injuries, weight gain, early menopause, high blood pressure... I know the weight of the diagnoses.</p>
<p>I know what western medicine says, but I also know that there's more. Functional medicine, spiritual practices, acupuncture, acupressure, old wives tales with no studies to back them up because there's no profit in a simple cure.... There's more we can learn, more testing available that helps us understand, helps us know how to heal and be whole. To help our families be whole; body, mind and spirit. </p>
<p></p>
<p>At Her Health Ally, you'll find hope, community, and direction. </p>
<p></p>
<p>So, find and refill your water bottle, or warm up your coffee, and let's chat. Hope, community, direction. Let's go. </p>",Podbean,en,https://pbcdn1.podbean.com/imglogo/image-logo/21389775/_Podcast_Cover_Audio_2500_x_2500_px_1800_x_1800_px_6y24a.jpg,2026-07-22 18:14:01,7966078,confirmed,https://HerHealthAlly.podbean.com,1784744041,f3873e8e6bc0026b40a533932fb04dd8,1896938054.0,2,0,INDIVIDUAL
The Creative Pawdcast,Dragos Pepina,https://feed.podbean.com/dragospepinaart/feed.xml,"Welcome to The Creative Pawdcast! I’m Dragos Pepina, a pet portrait artist sharing the real ups and downs of life in the studio.<br />This isn’t just about finished portraits — it’s about the long nights, the small victories, and the lessons I’ve learned from drawing animals day after day. From the joy of capturing a pet’s soul to the challenges of commissions, creative blocks, and running an art practice, I’ll take you behind the scenes of what it really means to make a living with animal art.<br />If you love pets, pencils, and the journey of being an artist, you’ll feel right at home here.",Podbean,en-us,https://pbcdn1.podbean.com/imglogo/image-logo/21541201/The_Creative_Pawdcastaqlaa.png,2026-07-22 18:13:30,7966077,confirmed,https://dragospepinaart.podbean.com,1784744010,4247335d19bbd1b883519a4d287b8825,1848321442.0,2,0,INDIVIDUAL
The Current: Eastern North Carolina,thecurrentenctv,https://feed.podbean.com/thecurrentenctv/feed.xml,"<p class=""PDq2pG_selectionAnchorContainer""><strong>The Current</strong> is a weekly podcast breaking down the local government, development, real estate, business, and public policy decisions shaping <strong>Greenville, North Carolina</strong> and <strong>Eastern North Carolina</strong>.<span class=""PDq2pG_selectionAnchor""></span></p>
<p>The news reports the facts, we explain the how & why. </p>
<p>Each episode takes a deep dive into the policies, procedures, zoning cases, development projects, City Council decisions, planning issues, and economic trends impacting our communities. Through thorough research and straightforward explanations, we translate complex government processes and technical documents into language that's easy to understand.</p>
<p>Whether you're a homeowner, business owner, real estate professional, developer, investor, or simply someone who wants to understand what's happening in your community, <strong>The Current</strong> provides the context behind the headlines so you can make informed decisions.</p>
<p>Because understanding how local government works shouldn't require a law degree.</p>
<p></p>
<p>#greenvillenc #easternnc #enctv</p>",Podbean,en,https://pbcdn1.podbean.com/imglogo/image-logo/22495989/thecurrent.jpg,2026-07-22 18:11:29,7966075,confirmed,https://thecurrentenctv.podbean.com,1784743889,c9de22ceb45fa5a90afdfd0a9b019562,6792402703.0,2,0,INDIVIDUAL
Atlas Sync,Atlas School,https://feeds.redcircle.com/e731b517-eed9-46ce-9f3c-9ffa141c5cfe,"Atlas Sync is a podcast devoted to amplifying the voices, journeys, and breakthroughs shaping Tulsa’s tech workforce. Through direct conversations with Atlas School students and staff and interviews with local companies and industry leaders, Atlas Sync is building the story of Tulsa’s technological future.
Contact us at podcasts@atlasschool.com
Music by Natan Molibog ( https://pixabay.com/users/absolutesound-54929726/?utm_campaign=music&utm_content=563830&utm_medium=referral&utm_source=link-attribution ) from Pixabay ( https://pixabay.com/music//?utm_campaign=music&utm_content=563830&utm_medium=referral&utm_source=link-attribution )",Spotify for Podcasters,en-US,https://media.redcircle.com/images/2026/7/22/17/81e90bdd-e876-46d8-8589-ed6470d8703a_atlas-sync-cover.jpg,2026-07-22 18:11:10,7966074,confirmed,https://redcircle.com/shows/atlas-sync,1784743870,9fd46dcf34fbb511d67f9004ad5b06e5,,4,0,CORPORATE
Stop Explaining Your Emotions,Gabriela Coviello,https://www.spreaker.com/show/7197534/episodes/feed,Stop explaining yourself to everyone. They don’t deserve to know what you feel after they put you through pain all over again.,Spreaker,en,https://d3wo5wojvuv7l.cloudfront.net/images.spreaker.com/nuvolari-assets/black_square_mic.jpg,2026-07-22 18:08:10,7966073,confirmed,https://www.spreaker.com/podcast/stop-explaining-your-emotions--7197534,1784743690,6e1f3ee1d15b6ad21945c39758f00725,,4,0,INDIVIDUAL
Golden Apple (Tech),Stehpen,https://www.spreaker.com/show/7197532/episodes/feed,"Golden Apple (Tech) explores the world of innovation, smart devices, artificial intelligence, cybersecurity, software development, and the technologies shaping our future. Whether you're a tech enthusiast, entrepreneur, student, or simply curious about the latest digital trends, this podcast delivers clear insights into groundbreaking inventions, product launches, industry news, and practical tips for navigating today's connected world. From smartphones and cloud computing to robotics, blockchain, and emerging AI tools, each episode breaks down complex topics into engaging conversations that are easy to understand. Join us as we uncover the ideas, companies, and technologies driving the next generation of innovation and helping you stay ahead in the fast-moving world of tech.",Spreaker,en,https://d3wo5wojvuv7l.cloudfront.net/t_rss_itunes_square_1400/images.spreaker.com/original/d6cabc23a13810f30dcd8d3480d64997.jpg,2026-07-22 18:06:21,7966071,confirmed,https://www.spreaker.com/podcast/golden-apple-tech--7197532,1784743581,f49654a71b5e1662bfde5da29ab7058d,,4,0,INDIVIDUAL
Nothing Ever Happens,Eemaan Qadri,https://rss.buzzsprout.com/2632040.rss,"<p>A weekly podcast where friends dive into the biggest stories in entertainment, sports, technology, and culture through candid conversations and unfiltered opinions.</p>",Buzzsprout,en-us,https://storage.buzzsprout.com/58gvo4mrjkgt7v2drz02hyhm84ag?.jpg,2026-07-22 18:04:19,7966067,confirmed,,1784743459,7d5892027a3ed6f7f6d26936f0ed4b53,,4,0,INDIVIDUAL
Paylentra.COM: Bu+y Verified Relay Accounts: Multi-Account US Corporate Banking and Financial Automation,Paylentra.COM: Bu+y Verified Relay Accounts: Multi-Account US Corporate Banking and Financial Automation,https://rss.buzzsprout.com/2632041.rss,"<h1>Buy Verified Relay Accounts: The Ultimate Blueprint for Multi-Account US Corporate Banking and Financial Automation</h1><p><b>https://paylentra.com/product/get-verified-business-paypal-accounts/</b></p><p><b>Web:</b></p><p><b>https://paylentra.com</b></p><p><b>WhatsApp:</b></p><p><a href=""https://wa.me/12089034496""><b>https://wa.me/12089034496</b></a></p><p><b>Telegram:</b></p><p><a href=""https://t.me/paylentra""><b>https://t.me/paylentra</b></a></p><p><b>Email:</b></p><p><b>paylentra@outlook.com</b></p><p><b>Telegram Support:</b></p><p><a href=""https://t.me/+12089034496""><b>https://t.me/+12089034496</b></a></p><p><b>Signal: +1 (208) 903-4496</b></p><p><b>Meta Title:</b> Buy Verified Relay Accounts | 100% KYB Passed & Secure</p><p><b>Meta Description:</b> Looking to buy a verified Relay LLC account? Discover our expert guide on multi-account US corporate banking, bypassing strict KYB hurdles, and seamless business payouts.</p><p>1. Introduction: The Need for Unrestricted US Financial Infrastructure</p><p>If you are operating a growing digital business, managing cash flow is just as important as generating it. Whether you are scaling a multi-brand dropshipping operation, running a digital marketing agency, or managing a portfolio of SaaS products, a single, basic bank account is no longer enough. You need enterprise-grade financial infrastructure to categorize spending, issue dedicated employee cards, and seamlessly integrate with your accounting software.</p><p><br></p>",Buzzsprout,en-us,https://storage.buzzsprout.com/347pm8ibh6cz07yu6jd4p7ie5t9q?.jpg,2026-07-22 18:02:54,7966065,confirmed,,1784743374,2751ad35add059b3db0f3eff7cd0e96f,,0,0,CORPORATE
