title,author,url,description,host_platform,language,image,dateAdded,id,status,link,timeAdded,contentHash,itunesId,source,dead,is_corporate
"Lillian Morris, and Other Stories",,https://www.spreaker.com/show/7151350/episodes/feed,"The nights were real Californian: calm, warm, starry; the fire burned cheerily, and in its gleam I saw the gigantic, but shapely and noble form of the old pioneer warrior. Raising his eyes to the stars, he sought to recall past events, cherished names, and dear faces, the very remembrance of which brought a mild sadness to his features. Of these narratives I give one just as I heard it, thinking that the reader will listen to it with as much interest as I did. - Summary from the Preface",Spreaker,en,https://d3wo5wojvuv7l.cloudfront.net/t_rss_itunes_square_1400/images.spreaker.com/original/9803f67bd2400391000b0d1fc2050cda.jpg,2026-07-03 17:26:42,7940422,confirmed,https://www.spreaker.com/podcast/lillian-morris-and-other-stories--7151350,1783099602,f5821049c28b004825d208377be33a4c,,4,1,UNKNOWN
Korean Folk Tales,,https://www.spreaker.com/show/7151354/episodes/feed,"""To any one who would like to look somewhat into the inner soul of the Oriental, and see the peculiar spiritual existences among which he lives, the following stories will serve as true interpreters, born as they are of the three great religions of the Far East, Taoism, Buddhism and Confucianism."" Manuscripts by two of Korea's (possibly) most famous authors, dating from the seventeenth and early eighteenth centuries were uncovered in the early years of the twentieth century. Translation revealed stories that are not for the faint-hearted: gruesome, harsh, unlovely, depicting scenes of the day, as well as the hope for better things. - Summary by Lynne Thompson",Spreaker,en,https://d3wo5wojvuv7l.cloudfront.net/t_rss_itunes_square_1400/images.spreaker.com/original/da4e6427c8bc932d89fe7dfc92367d25.jpg,2026-07-03 17:26:41,7940421,confirmed,https://www.spreaker.com/podcast/korean-folk-tales--7151354,1783099601,146640378d12df69aecab457fba97f50,,4,1,UNKNOWN
EMS Unfiltered,ateupmedic3033,https://anchor.fm/s/11399c0f0/podcast/rss,"EMS Unfiltered is the podcast where nothing is off-limits. Hosted by veteran paramedic, critical care specialist, educator, and author Kelly Grayson alongside EMS educator and volunteer EMS advocate Nancy Magee, the show dives headfirst into the conversations EMS usually avoids in public. Clinical controversies, leadership failures, mental health, workplace culture, education, politics, and the uncomfortable truths of modern emergency medicine are discussed with honesty, experience, humor, and absolutely no filter.",Anchor,en-us,https://d3t3ozftmdmh3i.cloudfront.net/staging/podcast_uploaded_nologo/46138108/46138108-1781133706444-63d372e68e69f.jpg,2026-07-03 17:26:24,7940420,confirmed,https://podcasters.spotify.com/pod/show/ateupmedic3033,1783099584,03e79f30c574fae062fc6565ff860933,,0,0,INDIVIDUAL
Stories of Ships and the Sea,,https://www.spreaker.com/show/7151358/episodes/feed,5 Exciting short stories by one of Americas best story tellers (Summary by William Tomcho),Spreaker,en,https://d3wo5wojvuv7l.cloudfront.net/t_rss_itunes_square_1400/images.spreaker.com/original/98c22982c0e549d7f5dfbfe759cd3f3e.jpg,2026-07-03 17:26:24,7940419,confirmed,https://www.spreaker.com/podcast/stories-of-ships-and-the-sea--7151358,1783099584,574e408d341554aa75a3aee11cfc1a18,,4,1,UNKNOWN
Love of Life and Other Stories,,https://www.spreaker.com/show/7151357/episodes/feed,"""Love Of Life"" (1906) is a collection of stories set in the Yukon of men, women and animals fighting for survival over the elements and over others. Greed, love, revenge -- all that is bad and good in humanity. (Summary by TriciaG)",Spreaker,en,https://d3wo5wojvuv7l.cloudfront.net/t_rss_itunes_square_1400/images.spreaker.com/original/c483a90ab1afd40661d195cf8dd78a6b.jpg,2026-07-03 17:26:21,7940418,confirmed,https://www.spreaker.com/podcast/love-of-life-and-other-stories--7151357,1783099581,1a71a44edf496db32e8b1cf0ac6a5009,,4,1,UNKNOWN
Dutch Courage and Other Stories,,https://www.spreaker.com/show/7151356/episodes/feed,"Jack London was quoted as saying, ""I've never written a line that I'd be ashamed for my young daughters to read, and I never shall write such a line!"" After his death in 1916, his wife Charmian assembled a collection of stories, most of which he had written for young readers, but at least one of which was for more mature readers, ""Whose Business is to Live."" Like most of London's work, his short stories could be read by young readers and then again when they were older with mature minds. These stories draw from London's own extensive experience in the world and demonstrate the dictum that ""good writing is good writing"" no matter for whom it was written. - Summary by Don W. Jenkins",Spreaker,en,https://d3wo5wojvuv7l.cloudfront.net/t_rss_itunes_square_1400/images.spreaker.com/original/b7bf5159b0d501246598544f03b207a1.jpg,2026-07-03 17:26:18,7940417,confirmed,https://www.spreaker.com/podcast/dutch-courage-and-other-stories--7151356,1783099578,1f5f7f21d3768ebbbcc21d5b346eaff8,,4,1,UNKNOWN
Ghetto Comedies,,https://www.spreaker.com/show/7151355/episodes/feed,"A series of tales, poignant as well as comic, set in the Jewish East End of London by the writer known as the ""Dickens of the ghetto"" - Summary by Anthony Ogus",Spreaker,en,https://d3wo5wojvuv7l.cloudfront.net/t_rss_itunes_square_1400/images.spreaker.com/original/1075272e22125556bee25013887dce0b.jpg,2026-07-03 17:26:09,7940416,confirmed,https://www.spreaker.com/podcast/ghetto-comedies--7151355,1783099569,bdb33b91cf8558c815dfbc3674db8503,,4,1,UNKNOWN
"Astounding Stories 02, February 1930",,https://www.spreaker.com/show/7151353/episodes/feed,"This is the second issue of the classic science fiction Astounding Magazine. It contains the finale of The Beetle Horde by Victor Rousseau, as well as stories by Harl Vincent, Charles Willard Diffin, Hugh B. Cave, Sophie Wenzel Ellis, Sterner St. Paul, Anthony Pelcher and Captain S. P. Meek. (Summary by Alan Winterrowd)",Spreaker,en,https://d3wo5wojvuv7l.cloudfront.net/t_rss_itunes_square_1400/images.spreaker.com/original/946c8eee56f3a9a47a817b55dfe72695.jpg,2026-07-03 17:25:44,7940415,confirmed,https://www.spreaker.com/podcast/astounding-stories-02-february-1930--7151353,1783099544,04533c912173207bbd98709cd9b7dde5,,4,1,UNKNOWN
Encantadas or Enchanted Isles,,https://www.spreaker.com/show/7151351/episodes/feed,"The Encantadas or Enchanted Isles is a novella by American author Herman Melville. First published in Putnam's Magazine in 1854, it consists of ten philosophical ""Sketches"" on the Encantadas, or Galápagos Islands. It was collected in The Piazza Tales in 1856. The Encantadas was to become the most critically successful of that collection. All of the stories are replete with symbolism reinforcing the cruelty of life on the Encantadas. (Introduction excerpted from Wikipedia)",Spreaker,en,https://d3wo5wojvuv7l.cloudfront.net/t_rss_itunes_square_1400/images.spreaker.com/original/5a5c5b7c4f5ac772950121ada8392635.jpg,2026-07-03 17:25:28,7940414,confirmed,https://www.spreaker.com/podcast/encantadas-or-enchanted-isles--7151351,1783099528,abb8d3e65e323cc580fdab90ebc063ca,,4,1,UNKNOWN
White Nights & Other Stories,,https://www.spreaker.com/show/7151323/episodes/feed,"White Nights and Other Stories by Fyodor Dostoyevsky is a compilation published in 1918 by The MacMillan Company, NY (USA) and Heinemann (UK). It contains these 7 works: - White Nights - Notes from the Underground - A Faint Heart - A Christmas Tree and a Wedding - Polzunkov - A Little Hero - Mr. Prohartchin",Spreaker,en,https://d3wo5wojvuv7l.cloudfront.net/t_rss_itunes_square_1400/images.spreaker.com/original/14c127f61a17abbb7bc778a6b36c1b81.jpg,2026-07-03 17:25:13,7940413,confirmed,https://www.spreaker.com/podcast/white-nights-other-stories--7151323,1783099513,b3085cb45393bb8ff5ef0ecf9fbd661d,,4,1,UNKNOWN
Trolley Folly,,https://www.spreaker.com/show/7151349/episodes/feed,"This collection of eleven short stories is packed with Henry Wallace Phillips' offbeat humor. You will find a trolley car driver, bored with his route, who decides to drive around town instead. There are a couple of men unfamiliar with the basic properties of a canoe. And watch out for the curse of the chewing gum. Fun to read. Fun to record ( Tom Penn)",Spreaker,en,https://d3wo5wojvuv7l.cloudfront.net/t_rss_itunes_square_1400/images.spreaker.com/original/be7b71eb3dcbe6065a02df7ce5ce3b01.jpg,2026-07-03 17:25:13,7940412,confirmed,https://www.spreaker.com/podcast/trolley-folly--7151349,1783099513,c738069d95e8c8bd6e450cbb2bdf78cb,,4,1,UNKNOWN
Dramatic Selections from Henry Lawson's Short Stories,,https://www.spreaker.com/show/7151347/episodes/feed,"01. That Pretty Girl in the ArmyThe Salvation Army is having a hard time of things in the rough Outback town of Bourke. That is, until Sister Hannah arrives... - Summary by Son of the Exiles Coordinated by: Son of the Exiles Sister Hannah: Devorah Allen Jack Moonlight: Tomas Peter Billy Woods: Jim Locke Jake Boreham: Larry Wilson Reformed Drunkard: Wayne Cooke Bob Brothers: Algy Pug Mitchell: Alan Mapstone Donald Macdonald: Michele Eaton One-Eyed Bogan: lorda Female Testifier: Lauren-Emma Blake Blunderer: Therese Lindholm Black Testifier: Wayne Cooke Heckler: ToddHW Narrator: KHand 02. The Hairy ManIt was the day after Australia's Anniversary Day and all the patriots wanted to do was nurse their hangovers out in the scrub of the isolated western spur of the Blue Mountains. But following close on the heels of their hair-of-the-dog comes The Hairy Man, Australia's own version of Bigfoot. - Summary by Son of the ExilesCoordinated by: Son of the Exiles Jack Jones: Alan Mapstone Andy Page: Larry Wilson Dave Regan: lorda Jim Bentley: ToddHW Mahoney: TJ Burns Foley: Algy Pug Narrator: Son of the Exiles 03. Macquarie's MateEven ""the veriest wreck in the drink-fiend's clutch"" won't stand idly by and hear his mate slagged off. - Summary by Son of the Exiles Coordinated by: Son of the Exiles Awful Example: Alan Mapstone Box-o’-Tricks: ToddHW Barcoo: Algy Pug “Sally” Thompson: Michele Eaton Stiffner the Shanty-Keeper: April6090 Macquarie: lorda Somebody: Andrew Gaunce Narrator: Son of the Exiles 04. His Country After All""Lives there a man with soul so dead..."" - Summary taken from textCoordinated by: Son of the Exiles Australian-born American: Wayne Cooke New Zealand bagman: Jim Locke Coach Driver: ToddHW Posh-sounding British voice: Alan Mapstone Australian rabbit-trapper: Algy Pug Narrator: KHand",Spreaker,en,https://d3wo5wojvuv7l.cloudfront.net/t_rss_itunes_square_1400/images.spreaker.com/original/f5da631f57babae5c0df1f6f4bfcb686.jpg,2026-07-03 17:25:09,7940411,confirmed,https://www.spreaker.com/podcast/dramatic-selections-from-henry-lawson-s-short-stories--7151347,1783099509,79834889559fdfc9ba967af2de59171a,,4,1,UNKNOWN
Spirit of Christmas,,https://www.spreaker.com/show/7151348/episodes/feed,"A short Christmas book by American author, educator, and clergyman Henry Van Dyke, including a short story, two essays, and two prayers for the season. (summary by Jan MacGillivray)",Spreaker,en,https://d3wo5wojvuv7l.cloudfront.net/t_rss_itunes_square_1400/images.spreaker.com/original/78ac6ea539d7b71b487e47dfe6d7048f.jpg,2026-07-03 17:25:09,7940410,confirmed,https://www.spreaker.com/podcast/spirit-of-christmas--7151348,1783099509,51b89353e9f0289c264dc077a26c96e5,,4,1,UNKNOWN
Collaboration,,https://www.spreaker.com/show/7151346/episodes/feed,It is Paris sometime after the Franco-Prussian War (1870--Germany won--the French Second Republic collapsed--France embittered). A French poet and a German composer come to admire one another's work and decide to collaborate on an opera. There are costs to pay. ( david wales),Spreaker,en,https://d3wo5wojvuv7l.cloudfront.net/t_rss_itunes_square_1400/images.spreaker.com/original/d6998dbb6eb2e022a143284f18ecb01e.jpg,2026-07-03 17:25:04,7940409,confirmed,https://www.spreaker.com/podcast/collaboration--7151346,1783099504,b102c3cacfb4af9db2fe9632e44d01f0,,4,1,UNKNOWN
International Short Stories Volume 3: French Stories,,https://www.spreaker.com/show/7151317/episodes/feed,"The third book of a three volume anthology of international short stories, we now turn to French stories. Authors include Honoré de Balzac, Voltaire, Guy de Maupassant, Victor Hugo and more. Compiled and translated by Francis J. Reynolds. - Summary by Lynne Thompson",Spreaker,en,https://d3wo5wojvuv7l.cloudfront.net/t_rss_itunes_square_1400/images.spreaker.com/original/ca6ef8a47f15061d314627456aa1a95d.jpg,2026-07-03 17:24:45,7940408,confirmed,https://www.spreaker.com/podcast/international-short-stories-volume-3-french-stories--7151317,1783099485,310154eb21703503ea1cddeb984a3a18,,4,1,UNKNOWN
Tales Of The Trail; Short Stories Of Western Life,,https://www.spreaker.com/show/7151344/episodes/feed,"This 1898 collection of thirteen previously published articles exhibits the acute perception of one of the most popular writers of the late 19th-early 20th centuries. “These ""Tales of the Trail"" are based upon actual facts which came under the personal observation of the author… and will form another interesting series of stories of that era of great adventures, when the country west of the Missouri was unknown except to the trappers, hunters, and army officers.” Henry Inman (1837 – 1899) was an American soldier, frontiersman, and author. He served in the military during the Indian campaigns and the American Civil War, having earned distinction for gallantry on the battlefield. He was commissioned lieutenant general during the Indian wars. He settled in Kansas and worked as a journalist and author of short stories and books of the plains and western frontier. - Summary by Wikipedia, Book Preface, David Wales",Spreaker,en,https://d3wo5wojvuv7l.cloudfront.net/t_rss_itunes_square_1400/images.spreaker.com/original/7ffd0ed2e0027f291588652ae05beb38.jpg,2026-07-03 17:24:39,7940407,confirmed,https://www.spreaker.com/podcast/tales-of-the-trail-short-stories-of-western-life--7151344,1783099479,6db9b40f8258b5ab01845c08715a877b,,4,1,UNKNOWN
Repairman,,https://www.spreaker.com/show/7151343/episodes/feed,"This is a collection of 3 of Harry Harrison marvelous early stories that were published in Galaxy, Analog and Fantastic Universe. The Repairman (1958) is a straight fun SF story of a man getting a job done. It is most typical of his later style in series like the Stainless Steel Rat; Toy Shop (1962), a short piece exploring bureaucratic blindness and one ingenious way around it and The Velvet Glove (1956), my favorite for its writing style, fun perspective, sly social commentary on the scene in 1956 and just plain delightful imagination. And he manages to pack excitement and mystery in at the same time.",Spreaker,en,https://d3wo5wojvuv7l.cloudfront.net/t_rss_itunes_square_1400/images.spreaker.com/original/b09fbbb2f3a1224e5d459cda18715373.jpg,2026-07-03 17:24:34,7940406,confirmed,https://www.spreaker.com/podcast/repairman--7151343,1783099474,0dcb60cdab0e5202a9045fc0d93a4ac8,,4,1,UNKNOWN
Sam Lawson's Oldtown Fireside Stories,,https://www.spreaker.com/show/7151342/episodes/feed,"A sequel to Oldtown Folks, featuring some of the same characters, these are 15 charming short stories told by ole' Sam Lawson to entertain Horace and Bill, two impressionable, curious and clever young boys of Oldtown (a fictional 1850's New England village), during evenings gathered around the hearth, or roaming with Sam around the countryside. Stowe faithfully and masterfully captures many of the colloquial expressions, superstitions, beliefs, customs and habits of the period that have almost completely faded from modern American culture, as well as conveying many truths about the human condition that haven't changed a bit. ~ Summary by soloist Michele Fry",Spreaker,en,https://d3wo5wojvuv7l.cloudfront.net/t_rss_itunes_square_1400/images.spreaker.com/original/3640829c738df1a024826d0d432de3c8.jpg,2026-07-03 17:24:24,7940405,confirmed,https://www.spreaker.com/podcast/sam-lawson-s-oldtown-fireside-stories--7151342,1783099464,5327485027574b0c5838daa552e2cda9,,4,1,UNKNOWN
May Flower and Miscellaneous Writings,,https://www.spreaker.com/show/7151341/episodes/feed,"Included herein are 35 charming short stories or humorous sketches, some written as exercises for the literary Semi-Colon Club of Cincinnati which Stowe belonged to for years, others published in magazines of the time, and 7 religious poems. Stowe honed her expressive skills on many of these before writing her first serious novel, Uncle Tom's Cabin, and 30 other books that followed. They showcase her considerable skill even as a young writer, and she made good money doing it, often supporting her family. This collection, named after a flower native to the east coast, likely the Anemone hepatica, or 'May flower', should not to be confused with another collection by Stowe, The Mayflower, which provides sketches of several descendants of the Pilgrims. - Summary by Michele Fry",Spreaker,en,https://d3wo5wojvuv7l.cloudfront.net/t_rss_itunes_square_1400/images.spreaker.com/original/378389d5db14967ca1fa59b36eb79f10.jpg,2026-07-03 17:24:15,7940404,confirmed,https://www.spreaker.com/podcast/may-flower-and-miscellaneous-writings--7151341,1783099455,caefa97172f48c1db04c033b8a7f7131,,4,1,UNKNOWN
Collected Public Domain Works of H. P. Lovecraft,,https://www.spreaker.com/show/7151340/episodes/feed,H. P. Lovecraft’s name is synonymous with horror fiction. His major inspiration and invention was cosmic horror: the idea that life is incomprehensible to human minds and that the universe is fundamentally alien. This collection contains 24 Lovecraft works that are in the public domain. You'll find more versions of these stories throughout LibriVox's short story collections and short horror story collections. (adapted from Wikipedia),Spreaker,en,https://d3wo5wojvuv7l.cloudfront.net/t_rss_itunes_square_1400/images.spreaker.com/original/710d808f54fd490e3af41ce9148fe2ec.jpg,2026-07-03 17:23:57,7940401,confirmed,https://www.spreaker.com/podcast/collected-public-domain-works-of-h-p-lovecraft--7151340,1783099437,438ab3db9444873e6d07b718b5dcc71f,,4,1,UNKNOWN
Five Sci-Fi Short Stories by H. Beam Piper,,https://www.spreaker.com/show/7151339/episodes/feed,Five short stories by classic science fiction writer H. Beam Piper.,Spreaker,en,https://d3wo5wojvuv7l.cloudfront.net/t_rss_itunes_square_1400/images.spreaker.com/original/83f7c48b8bf2a8607777ab3980ce80d2.jpg,2026-07-03 17:23:41,7940400,confirmed,https://www.spreaker.com/podcast/five-sci-fi-short-stories-by-h-beam-piper--7151339,1783099421,28c5ecb65bfaa5e8a22ddf512c385b1e,,4,1,UNKNOWN
Police Operation,,https://www.spreaker.com/show/7151338/episodes/feed,"H. Beam Piper (1904–1964) was an American science fiction author. He wrote many short stories and several novels. He is best known for his extensive Terro-Human Future History series of stories and a shorter series of ""Paratime"" alternate history tales. (Summary from Wikipedia)",Spreaker,en,https://d3wo5wojvuv7l.cloudfront.net/t_rss_itunes_square_1400/images.spreaker.com/original/9b8bfe6da7c3739b022c5a4780a88647.jpg,2026-07-03 17:23:40,7940399,confirmed,https://www.spreaker.com/podcast/police-operation--7151338,1783099420,8f59ac1dcc360c3a0ace71b63ebc323a,,4,1,UNKNOWN
Story of the Greeks,,https://www.spreaker.com/show/7151337/episodes/feed,"This book is a collection of stories and histories about the Ancient Greeks, including many of their famous myths! - Summary by Ann Boulais",Spreaker,en,https://d3wo5wojvuv7l.cloudfront.net/t_rss_itunes_square_1400/images.spreaker.com/original/fb8eacc47297ce5c604e1229b46f99e5.jpg,2026-07-03 17:23:30,7940398,confirmed,https://www.spreaker.com/podcast/story-of-the-greeks--7151337,1783099410,1e3b41ff0197ebb8a6be7f22057f111d,,4,1,UNKNOWN
Decameron,,https://www.spreaker.com/show/7151335/episodes/feed,"The Decameron (subtitle: Prencipe Galeotto) is a collection of 100 novellas by Italian author Giovanni Boccaccio, probably begun in 1350 and finished in 1353. It is a medieval allegorical work best known for its bawdy tales of love, appearing in all its possibilities from the erotic to the tragic. Many notable writers such as Shakespeare and Chaucer are said to have borrowed from The Decameron. (from Wikipedia)",Spreaker,en,https://d3wo5wojvuv7l.cloudfront.net/t_rss_itunes_square_1400/images.spreaker.com/original/828d1361c2fcdea1e6bca535b088e55b.jpg,2026-07-03 17:23:03,7940397,confirmed,https://www.spreaker.com/podcast/decameron--7151335,1783099383,e570ae5d8376fba8a1d770e45e146791,,4,1,UNKNOWN
Interventions,,https://www.spreaker.com/show/7151333/episodes/feed,"A collection of short stories of social commentary, tales of love, mystery, and loss. Many of the stories revolve around children, women, and relationships with friends of varying classes, often in odd, unusual, or difficult circumstances in life. (Introduction by Psudonae Vox)",Spreaker,en,https://d3wo5wojvuv7l.cloudfront.net/t_rss_itunes_square_1400/images.spreaker.com/original/d4de71cb02c31e657cbf42407dda1b58.jpg,2026-07-03 17:22:38,7940396,confirmed,https://www.spreaker.com/podcast/interventions--7151333,1783099358,67d7aad6e852aab90415f1aed919b69e,,4,1,UNKNOWN
White Elephant And Other Tales from Old India Retold,,https://www.spreaker.com/show/7151332/episodes/feed,This book is a collection of short stories from India. - Summary by sid,Spreaker,en,https://d3wo5wojvuv7l.cloudfront.net/t_rss_itunes_square_1400/images.spreaker.com/original/c5d81a18e8ab5e9cda7673beff6216a7.jpg,2026-07-03 17:22:06,7940395,confirmed,https://www.spreaker.com/podcast/white-elephant-and-other-tales-from-old-india-retold--7151332,1783099326,093abff00627115f64188058bf04cb45,,4,1,UNKNOWN
Cruel Painter,,https://www.spreaker.com/show/7151331/episodes/feed,"This is the story of a daring college student's quest to win the icy heart of a beautiful girl. Unfortunately, the girl is the daughter of a cunning and sadistic master artist, who takes the student as an apprentice with the express intent of torturing the youth with his own hopeless love. The story is set in late 16 century Prague, amid mysterious happenings and the terrifying rumors of a vampire on the loose. ( Summary by Ned Troxel )",Spreaker,en,https://d3wo5wojvuv7l.cloudfront.net/t_rss_itunes_square_1400/images.spreaker.com/original/7bdb0682a8875b969e9b694ff8521ada.jpg,2026-07-03 17:22:02,7940394,confirmed,https://www.spreaker.com/podcast/cruel-painter--7151331,1783099322,44a6d9fd319d166869bc113fc35353f4,,4,1,UNKNOWN
Far Above Rubies,,https://www.spreaker.com/show/7151330/episodes/feed,"Proverbs 31:10-11 says, ""Who can find a virtuous woman? for her price is far above rubies. The heart of her husband doth safely trust in her, so that he shall have no need of spoil."" (KJV) With this in mind, George MacDonald gives us the short story of a young and aspiring Scottish poet named Hector. - Summary by HannahMary",Spreaker,en,https://d3wo5wojvuv7l.cloudfront.net/t_rss_itunes_square_1400/images.spreaker.com/original/a89c4b7f4cb9b2fb209e95184083ff19.jpg,2026-07-03 17:22:01,7940393,confirmed,https://www.spreaker.com/podcast/far-above-rubies--7151330,1783099321,4564d380fb48f4997195952d71cbcc99,,4,1,UNKNOWN
Brother Jacob,,https://www.spreaker.com/show/7151329/episodes/feed,"Brother Jacob is a short story by George Eliot, in which she explores the relationship between the selfish, self-centered and ambitious David Faux and his idiot brother, Jacob. - Summary by Lynne Thompson",Spreaker,en,https://d3wo5wojvuv7l.cloudfront.net/t_rss_itunes_square_1400/images.spreaker.com/original/867748be7b82d235e5d3f30ed828760d.jpg,2026-07-03 17:21:58,7940392,confirmed,https://www.spreaker.com/podcast/brother-jacob--7151329,1783099318,60361415e17bc4f73d938ae0170a5a93,,4,1,UNKNOWN
Graustark,,https://www.spreaker.com/show/7151328/episodes/feed,"The Graustark novels are stories of court intrigue, royal disguise, and romance similar to Anthony Hope's 1894 novel, The Prisoner of Zenda, and its sequels. They were popular best-sellers at the time they were published and the original editions are still readily available in used book shops. The novels gave their name to a fictional genre called Graustarkian: this genre contains tales of romance and intrigue usually featuring titled characters in small, fictional, Central European countries. During the 1870's, Graustark's ruler, Prince Ganlook, was killed in a war with neighboring Axphain. As part of the ensuing peace treaty, Graustark agreed to pay a large indemnity to Axphain, to be due, with interest, in fifteen years. (Summary from Wikipedia)",Spreaker,en,https://d3wo5wojvuv7l.cloudfront.net/t_rss_itunes_square_1400/images.spreaker.com/original/1a0709795ef08b181455d7fc1469ac84.jpg,2026-07-03 17:21:52,7940391,confirmed,https://www.spreaker.com/podcast/graustark--7151328,1783099312,8f8431168503594a719f0fe8ce812ee7,,4,1,UNKNOWN
Trees of Pride,,https://www.spreaker.com/show/7151327/episodes/feed,"Three trees, known as the Peacock trees, are blamed by the peasants for the fever that has killed many. Squire Vane scoffs at this legend as superstition. To prove them wrong, once and for all, he takes a bet to spend the night in the trees. In the morning he has vanished. Is he dead, and if so who has killed him? The poet? The lawyer? The woodsman? The trees? (Summary by Maria Therese)",Spreaker,en,https://d3wo5wojvuv7l.cloudfront.net/t_rss_itunes_square_1400/images.spreaker.com/original/028007a6ab0fa298df89b81925aed08f.jpg,2026-07-03 17:21:33,7940390,confirmed,https://www.spreaker.com/podcast/trees-of-pride--7151327,1783099293,170736cfceda6db066b7912b68b7603b,,4,1,UNKNOWN
