title,author,url,description,host_platform,language,image,dateAdded,id,status,link,timeAdded,contentHash,itunesId,source,dead,is_corporate
Know Your Game podcast,by USIndoor,https://anchor.fm/s/113e1d228/podcast/rss,"Welcome to the Know Your Game Podcast from the US Indoor Sports Association where we discuss ideas, experiences, products and services that can help your indoor sports business thrive! Be sure to like and subscribe if this is your business (or would like it to be) and join us as we learn! 
Memberships at USIndoor are on sale for your first 90 days for just $1, just head to usindoor.com to learn more! 
Be sure to check out our podcast series and if you'd like to take part in a future episode, you can reach out to James Hargrove, Communications Director at james@usindoor.com.",Anchor,en-us,https://d3t3ozftmdmh3i.cloudfront.net/staging/podcast_uploaded_nologo/46185338/46185338-1781713097264-ef0de95aca406.jpg,2026-07-16 02:43:50,7958318,confirmed,https://podcasters.spotify.com/pod/show/know-your-game,1784169830,871ee387cd0bdecfd3904d23af0ef335,1896937499.0,2,0,INDIVIDUAL
Understanding life,Charla,https://www.spreaker.com/show/7183627/episodes/feed,About uplifting  goals staying positive,Spreaker,en,https://d3wo5wojvuv7l.cloudfront.net/t_rss_itunes_square_1400/images.spreaker.com/original/4c0173c904afa936079c602ee49cf8ba.jpg,2026-07-16 02:42:45,7958317,confirmed,https://www.spreaker.com/podcast/understanding-life--7183627,1784169765,1e5cfe8c7f9ed0c33e1b160e52280664,,4,0,INDIVIDUAL
Plotopsy: Dissecting Stories,Allie James,https://anchor.fm/s/114d8c358/podcast/rss,"Every story has an anatomy. On Plotopsy, Allie James sits down with authors to dissect the stories behind their books. Through thoughtful conversations about inspiration, worldbuilding, characters, themes, and the writing process, each episode explores what makes a story work. Featuring traditionally published and indie authors across a wide range of genres.",Anchor,en,https://d3t3ozftmdmh3i.cloudfront.net/staging/podcast_uploaded_nologo/46347174/46347174-1783892926424-25c0ce2ccfecb.jpg,2026-07-16 02:36:30,7958315,confirmed,https://podcasters.spotify.com/pod/show/allie-james5,1784169390,dce958d34ce7bda083d0d364ee9beed0,6790254030.0,2,0,INDIVIDUAL
電子タバコは何歳から吸える？法律とマナー、健康リスクを徹底解説,lin lin,https://feeds.redcircle.com/05ad1510-7dcb-4f8d-a0f9-b01b539313f9,"「成人年齢が18歳に引き下げられたけれど、電子タバコは何歳からOKなの？」という疑問を抱く方は少なくありません。特に最近は、スタイリッシュなデザインや多彩なフレーバーの登場により、若い世代の間でもVAPE（ベイプ）への関心が高まっています。今回は、2026年現在の最新状況に基づき、電子タバコの利用年齢や法的な位置付けについて詳しく解説します。
まず、基本的な定義として、 電子タバコとは？ ( https://blog.kyotovape.com/vape-beginner-guide/ ) という点を確認しておきましょう。これはタバコ葉を燃焼させるのではなく、食品添加物などにも使われる成分と香料を混ぜた「リキッド」を電気で加熱し、その蒸気を吸い込むデバイスを指します。一方、アイコス（IQOS）などの「加熱式タバコ」はタバコ葉を使用するため、法律上は20歳未満の喫煙が厳格に禁止されています。
では、ニコチンを含まない電子タバコ（VAPE）はどうでしょうか。法的な解釈では、ニコチンなしのリキッドはタバコ製品に分類されないため、 電子タバコ 未成年者喫煙禁止法 ( https://blog.kyotovape.com/vape-underage-law-risk/ ) （現在の二十歳未満ノ喫煙ノ禁止ニ関スル法律）の直接的な対象外となる場合があります。しかし、ここが重要なポイントですが、日本国内の主要メーカーや販売店、コンビニ各社では、青少年の健康保護と喫煙習慣の誘発防止を目的として、独自の「自主規制」を敷いています。そのため、実店舗やオンラインショップの多くでは、購入時に20歳以上であることを確認する年齢認証が必須となっています。
利用を検討する際に避けて通れないのが、「 電子タバコ 害はあるのか ( https://blog.kyotovape.com/vape-health-risks/ ) 」という問題です。ニコチンやタールが含まれていないとはいえ、蒸気を直接肺に吸い込む行為が身体に与える長期的な影響については、現在も世界中で研究が進められている段階です。特に成長期にある若年層にとっては、呼吸器への刺激や未知の成分による健康リスクが懸念されるため、安易な使用は推奨されません。
こうした複雑な年齢制限の背景や、正しいデバイスの選び方、そして2026年の最新トレンド情報を網羅的に発信しているのが、 KYOTO VAPE 電子タバコ 最新情報ガイド ( https://blog.kyotovape.com/ ) です。
結論として、電子タバコは「法的なグレーゾーンはあるものの、20歳になってから楽しむもの」というのが社会的な共通認識であり、マナーです。自分自身の健康を守り、ルールを守ってスマートにVAPEライフをスタートさせるための準備を整えましょう。",Spotify for Podcasters,en-US,https://media.redcircle.com/images/2026/5/28/9/b45aacf6-1453-43e4-8d79-8b6798e9ce22_1b4c8766-c170-4aa6-ac88-ae3d83184af9.jpg,2026-07-16 02:28:44,7958307,confirmed,https://redcircle.com/shows/vape0528,1784168924,53456e12b623218e817ac3b42dddd335,,4,0,INDIVIDUAL
Terra Incognita,Paolo Ottaviani,https://anchor.fm/s/1062ab5a0/podcast/rss,"Terra Incognita explores the untold stories of tech and innovation across emerging markets.
Each episode takes you on a journey through six countries that are rewriting the rules of innovation, far from the usual Silicon Valley spotlight. We tell the stories of the people, the numbers, and the ideas building the future where most people are not looking.
For investors, founders, policy professionals, and anyone curious about what comes next. The companion Substack gives you the full picture, with data and deep dives.",Anchor,en-us,https://d3t3ozftmdmh3i.cloudfront.net/staging/podcast_uploaded_nologo/43884296/43884296-1780265849935-d754d710005f6.jpg,2026-07-16 02:11:47,7958294,confirmed,https://podcasters.spotify.com/pod/show/bushido6,1784167907,7d15577e2e70f0553dd6340f8086109c,1896891164.0,2,0,INDIVIDUAL
Schmidt to Cintas,Jene Galvin,https://anchor.fm/s/10f83c380/podcast/rss,"Welcome to Schmidt to Cintas, conversations about Xavier University's rich basketball success, hosted by two guys who've been there from 1961 to today Jene Galvin and Leo Bradley.",Anchor,en,https://d3t3ozftmdmh3i.cloudfront.net/staging/podcast_uploaded_nologo/45452608/45452608-1772067503220-6d549a4f6675.jpg,2026-07-16 02:07:29,7958288,confirmed,https://podcasters.spotify.com/pod/show/ambient-studios0,1784167649,2e07840c462d821955b714e6767d70e4,1896875140.0,2,0,INDIVIDUAL
The Alvarez Hypothesis,Javier Alvarez,https://rss.buzzsprout.com/2630638.rss,"<p><b>What if the greatest experiment you’ll ever run is your own life?</b></p><p><br></p><p><em>The Alvarez Hypothesis</em> explores one central question:</p><p><br></p><p><b>What happens when ordinary people fully commit to living according to God’s design?</b></p><p><br></p><p>Hosted by Javier, this podcast dives into the intersection of faith, family, leadership, business, discipleship, and everyday life. Each episode examines biblical principles, practical wisdom, and personal experiences that challenge listeners to reject passive living and intentionally build a life that glorifies Christ.</p><p><br></p><p>This isn’t about chasing comfort, success, or status.</p><p><br></p><p>It’s about forging character, leading your family well, pursuing excellence in your work, building meaningful relationships, and leaving a legacy that points others to Jesus.</p><p><br></p><p>Whether you’re a husband, wife, parent, entrepreneur, young professional, or someone simply seeking a deeper purpose, you’ll find conversations that encourage you to think critically, live courageously, and follow Christ faithfully.</p><p><br></p><p>Together, we’ll test one hypothesis:</p><p><br></p><p><b>A life surrendered to God is the strongest foundation for a meaningful life, a thriving family, and an enduring legacy.</b></p><p><br></p><p><b>Faith. Family. Fellowship. Legacy.</b></p><p><br></p><p>Welcome to <em>The Alvarez Hypothesis.</em></p>",Buzzsprout,en-us,https://storage.buzzsprout.com/27xywthlgwqurkhgf3l59tgrgcei?.jpg,2026-07-16 01:59:04,7958277,confirmed,,1784167144,041f7062a9e5da209ea84f7c2fb386cc,,4,0,INDIVIDUAL
The Family Biz Show,Michael Palumbos,https://rss.libsyn.com/shows/276707/destinations/2118167.xml,"Join host Michael Palumbos and new guests every episode as they talk about everything from navigating family business transitions, wealth transition, business growth strategies, family conflict, leadership and team development and more. 
Don't forget to share your favorite episodes with others. Tag us with #thefamilybizshow!
If you're a family business or a family business consultant and want to be on the show, share your story and help other family businesses, send us an email to producer@thefamilybizshow.com or visit us at The Family Biz Show | Family Business Podcast With Michael Palumbos (familywealthandlegacy.com) to fill out our web form! 
Securities and investment advisory services offered through Osaic Wealth, Inc. member FINRA/SIPC. Osaic Wealth is separately owned and other entities and/or marketing names, products or services referenced here are independent of Osaic Wealth.",Libsyn,en,https://static.libsyn.com/p/assets/3/7/a/e/37ae86cb6f3653ce/The-Family-Biz-Show-green-border.jpg,2026-07-16 01:58:14,7958276,confirmed,https://www.familybusinessflywheel.com/podcast,1784167094,a99d0708ded7182ecc3f96f0b1632116,1758402732.0,2,0,INDIVIDUAL
Humans are Forever with Dr. Ravi Gundlapalli,Dr. Ravi Gundlapalli,https://feeds.libsyn.com/625395/rss,"Hosted by entrepreneur, innovator, and technology visionary Dr. Ravi Gundlapalli, each episode brings together leading thinkers, scientists, entrepreneurs, educators, and changemakers to examine the evolving relationship between human intelligence and machine intelligence. Through compelling conversations and real-world stories, the show explores how AI is transforming the way we work, create, learn, heal, and connect while asking what will always remain uniquely human.
Join Dr. Ravi Gundlapalli as he explores the future of human intelligence, one conversation at a time, and discovers why, no matter how advanced technology becomes, Humans are Forever.",Libsyn,en,https://static.libsyn.com/p/assets/a/4/4/c/a44cd3ba9a0cf6aa16c3140a3186d450/Humans_are_Forever_3000x3000_4_5MB.png,2026-07-16 01:57:16,7958275,confirmed,https://sites.libsyn.com/625395,1784167036,7440e044e2738f9850b643412b318c75,6790813374.0,2,0,INDIVIDUAL
Special Education News and Noteworthy,Inclusive Educational Practices,https://anchor.fm/s/f7eda8d0/podcast/rss,"Special Education News & Noteworthy is a weekly podcast that breaks down what’s happening in the world of special education—across policy, funding, legal decisions, and community impact. Hosted by Paige Fitzgerald and Kate Magaldi, founders of Inclusive Educational Practices, each episode makes national headlines accessible and actionable for parents, educators, advocates, and anyone who cares about inclusive education.",Anchor,en,https://d3t3ozftmdmh3i.cloudfront.net/staging/podcast_uploaded_nologo/41495476/41495476-1779209590746-eab6391b9ca4f.jpg,2026-07-16 01:55:03,7958271,confirmed,https://podcasters.spotify.com/pod/show/paige-maria8,1784166903,b553178c0ca3703880ffc0ac6881f720,6790574389.0,2,0,INDIVIDUAL
The FAFO Podcast,FAFO Podcast,https://www.spreaker.com/show/7183608/episodes/feed,"FAFO Podcast  Facts. Truth. No BS.  This isn’t a safe space—it’s a real space. The FAFO Podcast is where uncomfortable truths get said out loud, weak excuses get exposed, and reality hits exactly the way it’s supposed to.  We talk about life, culture, failure, accountability, and the consequences nobody wants to admit exist. No scripts. No filters. No hand-holding.  If you’re looking for validation, keep scrolling. If you’re ready for the truth—welcome in.  You f*** around… you find out.<br /><br />Become a supporter of this podcast: <a href=""https://www.spreaker.com/podcast/the-fafo-podcast--7183608/support?utm_source=rss&utm_medium=rss&utm_campaign=rss"">https://www.spreaker.com/podcast/the-fafo-podcast--7183608/support</a>.",Spreaker,en,https://d3wo5wojvuv7l.cloudfront.net/t_rss_itunes_square_1400/images.spreaker.com/original/942b66865258e88f734efbf112e8807c.jpg,2026-07-16 01:51:40,7958265,confirmed,https://www.spreaker.com/podcast/the-fafo-podcast--7183608,1784166700,df279380266b6ee6b74e4ed63c2a96b4,,4,0,INDIVIDUAL
OSHOISOME,sarthak bhagat,https://www.spreaker.com/show/7182815/episodes/feed,"<i><b>Welcome to ""OSHOISOME"".</b></i><br /><br /><i><b>Here, we share the wisdom and unique vision of life that Osho brought to the world—not through closed beliefs, but through open eyes, awareness, and understanding. </b></i><br /><br /><i><b>Join us on a journey of self-discovery, mindfulness, and deeper insights into life. Explore Osho's teachings, timeless truths, and perspectives that encourage us to live consciously, question freely, and see the world with clarity. </b></i><br /><br /><i><b>Open your eyes. Open your mind. Discover yourself.</b></i><br /><br />Become a supporter of this podcast: <a href=""https://www.spreaker.com/podcast/oshoisome--7182815/support?utm_source=rss&utm_medium=rss&utm_campaign=rss"">https://www.spreaker.com/podcast/oshoisome--7182815/support</a>.",Spreaker,en,https://d3wo5wojvuv7l.cloudfront.net/t_rss_itunes_square_1400/images.spreaker.com/original/e0c14f30ef2435a77c1096eb3b6148b0.jpg,2026-07-16 01:40:29,7958255,confirmed,https://www.spreaker.com/podcast/oshoisome--7182815,1784166029,11bfedf7b915f619f37cea7cb85ae4c2,,4,0,INDIVIDUAL
The WELL at College & Dickson Podcast,The WELL at College and Dickson,https://anchor.fm/s/107eb25a0/podcast/rss,"Previously titled: FBCFAYCOLLEGE Podcast
Conversations with Josh and Alison to help students know, trust, love, worship, follow, and obey Jesus more.",Anchor,en,https://d3t3ozftmdmh3i.cloudfront.net/staging/podcast_uploaded_nologo/44178184/44178184-1783970646182-f2f2ce3e40374.jpg,2026-07-16 01:33:43,7958247,confirmed,https://podcasters.spotify.com/pod/show/fbc-fay-college1,1784165623,cd8608a3ee4ab73e791f62afb18cb743,6790541906.0,2,0,CORPORATE
Wait… What was I gonna say? with Sarah,sarahwillmon,https://anchor.fm/s/103866f10/podcast/rss,"“wait…what was I gonna say? with sarah” is for anyone whose brain has 37 tabs open and at least one is playing music. Hosted by Sarah: your chaotic, overthinking, oversharing new bestie—this podcast is full of unfiltered rambles, pop culture drama, vivid (and sometimes unhinged) dreams, personal stories, and random tangents that make you forget what you were even talking about. It’s funny, it’s real, it’s messy—grab a snack, get cozy, and let’s spiral.",Anchor,en-us,https://d3t3ozftmdmh3i.cloudfront.net/staging/podcast_uploaded_nologo/43441092/43441092-1783991910309-a1ab8acd52a57.jpg,2026-07-16 01:33:31,7958246,confirmed,https://podcasters.spotify.com/pod/show/sarahwillmon,1784165611,4df1830f035c7f1613eb8d64736427e4,6790933763.0,2,0,INDIVIDUAL
Life in Fife,Time Capsule Productions,https://feeds.redcircle.com/191875c1-72f4-4391-b659-b6d983eace93,"Life in Fife is an online archive and podcast documenting Fife and all its people from ex-miners to artists and everything in between.
Fife has so much to offer and there are so many great stories in this Kingdom that have never been told, until now. These are businesses, charities, creatives, community groups, and individuals with a story to tell.
Each episode is like a mini documentary creatively produced with the interviews and archive content that have been edited into shorter, enjoyable and easy-to-listen-to episodes.
I’ll record local anniversaries, discussions about former industries and local creatives, musicians and artists. I'll be talking to local businesses, from someone's side hustle to high street names. As well as shining a light on the charities and community groups helping Fife's people in the background. Everyone has stories and unique skills that are valuable to share.
Preventing the loss of local knowledge, highlighting groups that people can get help from or volunteer with and connecting local communities.",Spotify for Podcasters,en-GB,https://media.redcircle.com/images/2026/7/3/17/2d4929e7-fa62-4139-9f6b-ad2850abba9f_life_in_fife__1400_x_1400_px_.jpg,2026-07-16 01:25:00,7958242,confirmed,https://redcircle.com/shows/life-in-fife,1784165100,b00c3918cc9bf12252e97f5f788097ef,6789136345.0,2,0,CORPORATE
The Unexplained Archives,The Arcane Storyteller,https://anchor.fm/s/1149ad2b4/podcast/rss,"Deep dive into the mysteries that shaped our world.
Government secrets. Military anomalies. The places, events, and moments that official history won't fully explain. From Area 51 to classified 
weapons programs, from UFO sightings to unexplained phenomena — we 
explore what we know, what we don't know, and what the gaps between 
them reveal.
We don't claim to have all the answers. We examine documented evidence. 
We explore declassified documents. We separate fact from speculation.
What we find is often more complex than either the official narrative 
or the conspiracy theories suggest.",Anchor,en,https://d3t3ozftmdmh3i.cloudfront.net/staging/podcast_uploaded_nologo/46306581/46306581-1783960120418-ff3a946e2bb88.jpg,2026-07-16 01:21:24,7958235,confirmed,https://podcasters.spotify.com/pod/show/the-unexplained-archives,1784164884,c57b2f35c940f672c6f8c07e9a2bae19,6790316196.0,2,0,CORPORATE
Yoga with Ramoni Podcast,Yoga with Ramoni,https://anchor.fm/s/11388d358/podcast/rss,"Yoga is more than what happens on the mat. The Yoga With Ramoni Podcast takes the practice deeper — into relationships, emotions, patterns, and real life. Hosted by yoga innovator and wellness educator Ramoni Overton, each episode connects ancient yoga philosophy to the things you're actually going through.",Anchor,en,https://d3t3ozftmdmh3i.cloudfront.net/staging/podcast_uploaded_nologo/46127014/46127014-1783139961189-39f87a0394cf3.jpg,2026-07-16 01:21:12,7958234,confirmed,https://podcasters.spotify.com/pod/show/ramoni,1784164872,01286e0d5e1f132308220ce1be9831d1,6790172207.0,2,0,CORPORATE
Issues & Challenges In Sterile Processing a Podcast Conversation,Jason Marosi,https://anchor.fm/s/114c4961c/podcast/rss,"A podcast conversation about the problems SPD professionals face every day: Instrument reprocessing, sterilization standards, staffing pressure, leadership challenges, workflow breakdowns, infection prevention, and patient safety.",Anchor,en,https://d3t3ozftmdmh3i.cloudfront.net/staging/podcast_uploaded_nologo/46333951/46333951-1783695939036-b58b169abcbda.jpg,2026-07-16 01:17:33,7958229,confirmed,https://podcasters.spotify.com/pod/show/jason-marosi5,1784164653,fd3e547a1335f73a3b2c183879b18f3c,6789688519.0,2,0,INDIVIDUAL
Soul Stories with R.R. Shakti,"R.R. Shakti, PhD",https://feeds.transistor.fm/soul-stories-with-r-r-shakti,"Stories, teachings and reflections from the world of Applied Mythology. R.R. Shakti explores the symbols, archetypes and timeless questions that shape a creative life.",Transistor,en,https://img.transistorcdn.com/XILwt2PVwvHEMp4MkGCWYfYvm5Pe3LxOwvIijmFciqA/rs:fill:0:0:1/w:1400/h:1400/q:60/mb:500000/aHR0cHM6Ly9pbWct/dXBsb2FkLXByb2R1/Y3Rpb24udHJhbnNp/c3Rvci5mbS9kMjE3/MmEwYTAwZmVlZDU2/MWQ1MDA2MjY0OTUy/MGQ3NC5qcGVn.jpg,2026-07-16 01:13:42,7958225,confirmed,https://rrshakti.com,1784164422,0947b14be68953f1838fdec5c202b8b5,,4,0,INDIVIDUAL
Let’s Talk Truths,Morgan and Marley,https://rss.buzzsprout.com/2630642.rss,"Calling all tweens and teens! Led by BFFs Morgan and Marley, this podcast talks about everything from school to self care. Listen in to hear two girls’ real experiences and thoughts, as well as tips and tricks.
Contact us at LetsTalkTruths863@outlook.com",Buzzsprout,en-us,https://storage.buzzsprout.com/ei7rcvkoiv96duy12zwtmymsa31m?.jpg,2026-07-16 01:08:03,7958219,confirmed,https://podcasters.spotify.com/pod/show/morgan--marley,1784164083,74190fd5ecbfb8624383bf3137aac4ee,,4,0,CORPORATE
Book Keeper,Longview,https://feeds.megaphone.fm/bookkeeper,"<p>Megan Phelps-Roper was raised inside one of the most infamous religious communities in America. More than a decade after she left, and now a mother herself, she's returning to the Bible — not to reclaim belief, but to ask a harder question: What’s worth keeping?</p>",Megaphone,en,"https://megaphone.imgix.net/podcasts/daf2c184-7cb8-11f1-8880-ebe78dda8309/image/61e93396a8f59ecd134888c12be961f8.png?ixlib=rails-4.3.1&max-w=3000&max-h=3000&fit=crop&auto=format,compress",2026-07-16 01:03:31,7958214,confirmed,https://www.longview.report/bookkeeper,1784163811,6b2cd5b8cd70245e67971b44f57b4189,6790978542.0,2,0,INDIVIDUAL
Leaving Well: nonprofit leadership guidance for workplace exits and transitions,Naomi Hattaway,https://rss.libsyn.com/shows/480894/destinations/4090722.xml,"This is Leaving Well, where we talk about the reality that People Leave™️ in nonprofits and the social impact sector. Through this podcast, you will receive expert insights on leadership exits and transitions, the benefits of interim leadership, and sustainable succession planning in nonprofits. Listen to learn transition strategies for executive director, CEO, and board of directors leadership during resignations, terminations, and unfortunate circumstances such as death.",Libsyn,en,https://static.libsyn.com/p/assets/e/c/1/7/ec17984b6a94b38ad959afa2a1bf1c87/Naomi_S4_Podcast_1400_x_1400_px.png,2026-07-16 00:59:37,7958208,confirmed,https://www.naomihattaway.com,1784163577,1ef2c3d47a18d7afe034110facff21cc,1703497649.0,2,0,INDIVIDUAL
Spine Time,Nebraska Spine + Pain Center,https://anchor.fm/s/1127fa0b8/podcast/rss,"Your back does a lot for you. It's about time you returned the favor. Spine Time brings physicians, surgeons, physical therapists, and healthcare professionals together for honest conversations about one of the most misunderstood parts of the human body: your back and neck. We bust common myths, answer the questions patients are too nervous to ask in the exam room, and talk about what staying healthy looks like right here in Nebraska.",Anchor,en,https://d3t3ozftmdmh3i.cloudfront.net/staging/podcast_uploaded_nologo/45953214/45953214-1778534028602-191b8cbd57e31.jpg,2026-07-16 00:48:13,7958201,confirmed,https://nespine.com/,1784162893,09c4961631fa9f43c226247856426ebf,6786424701.0,2,0,CORPORATE
MOVIAA,Jean Lordeus,https://anchor.fm/s/26326f4c/podcast/rss,"MOVIAA = Men Of Valor In Action Always
The MOVIAA Podcast's goal is to enliven thought-provoking topics and Anecdotes that have fallen by the wayside due to life's busyness. 
The aim is to help someone regain consciousness once more and live. 
MOVIAA will cover a gamut of social issues, Spiritual Revival, Financial Literacy, Self-Worth Awareness, and Uplifting and Promoting young men to their rightful place in this society.",Anchor,en-us,https://d3t3ozftmdmh3i.cloudfront.net/production/podcast_uploaded/6308395/6308395-1612893471291-41aee86ff5bae.jpg,2026-07-16 00:32:04,7958191,confirmed,www.moviaas.com,1784161924,5b52fae393acd02722d6b8507032c122,1555730002.0,2,0,INDIVIDUAL
The Hallowed Raven,Hallowed Raven LLC,https://rss.buzzsprout.com/2625528.rss,"<p>The Wounded Spark Saga is an upcoming gritty, gothic-horror actual play podcast of D&D</p>",Buzzsprout,en-us,https://storage.buzzsprout.com/j6o6x4mi8fw69qjf1vw0auc3i8y5?.jpg,2026-07-16 00:31:39,7958190,confirmed,,1784161899,240a3d4fbccbae95defd0b39d5436521,,4,0,CORPORATE
Built To Win - a SigEp Podcast,Sigma Phi Epsilon Fraternity (SigEp),https://anchor.fm/s/114e37924/podcast/rss,"Winning conversations with the men who built their success the right way.
Built to Win, hosted by Seth Irby, sits down with Sigma Phi Epsilon's most accomplished alumni — Fortune 500 CEOs, industry pioneers, and world-renowned physicians — for the real stories and real playbooks behind elite success.
Guests include Bob Eckert (former CEO of Mattel and Kraft Foods), Terry Lundgren (former Chairman & CEO of Macy's), Jeff Henley (Vice Chairman of Oracle), Dr. Jay Harness (internationally recognized breast cancer surgeon), and more.",Anchor,en,https://d3t3ozftmdmh3i.cloudfront.net/staging/podcast_uploaded_nologo/46354193/46354193-1783984384395-583a8266c0e4d.jpg,2026-07-16 00:22:57,7958181,confirmed,https://podcasters.spotify.com/pod/show/sigma-phi-epsilon,1784161377,25f14e610d0cebdd059daca0f4314d01,6790928153.0,2,0,INDIVIDUAL
The Banner with Avery Elise,Avery Elise,https://anchor.fm/s/11433ac74/podcast/rss,"In a world that wants to label you, lift up your banner that tells everyone you have already won the battles you're facing because of Jesus Christ! This podcast gives you big sis advice in hopes to take you from vision to victory. This is ""The Banner with Avery Elise.""",Anchor,en-us,https://d3t3ozftmdmh3i.cloudfront.net/staging/podcast_uploaded_nologo/46238981/46238981-1782374141094-2550e17fcded3.jpg,2026-07-16 00:22:47,7958180,confirmed,https://podcasters.spotify.com/pod/show/the-banner-with-avery-eli5,1784161367,f744144fa83b02fc95e1b193a86d16d3,6790940810.0,2,0,INDIVIDUAL
