title,author,url,description,host_platform,language,image,dateAdded,id,status,link,timeAdded,contentHash,itunesId,source,dead,is_corporate
Bible (ABU) 19: Psalms by American Bible Union,,https://www.spreaker.com/show/7153549/episodes/feed,"This 1871 revision of The Psalms by the American Bible Union is based on the ""Common Version,"" another name for the 1833 revision of the King James Version of The Bible by Noah Webster. (Summary by Mark Penfold)",Spreaker,en,https://d3wo5wojvuv7l.cloudfront.net/t_rss_itunes_square_1400/images.spreaker.com/original/08a8ab9938bdbe379960ee9ea5f866eb.jpg,2026-07-04 20:28:25,7941543,confirmed,https://www.spreaker.com/podcast/bible-abu-19-psalms-by-american-bible-union--7153549,1783196905,b1444a870f43fce977847061deb63704,,4,1,UNKNOWN
Viseo Daily Topics,Ezra Mathebula,https://anchor.fm/s/114496ba4/podcast/rss,Publishing About Different Category Content,Anchor,en,https://d3t3ozftmdmh3i.cloudfront.net/staging/podcast_uploaded_nologo/46253233/46253233-1782564488810-11479641c8631.jpg,2026-07-04 20:27:18,7941542,confirmed,https://podcasters.spotify.com/pod/show/ezeri-mathebula5,1783196838,cc288d0aa8910018e94b8a6d9b7eb8e0,6785196317.0,2,0,INDIVIDUAL
Scary True Dogman Stories,Sezgin,https://www.spreaker.com/show/7151996/episodes/feed,"Deep in the woods, something is watching. It walks on two legs. It has the head of a wolf. And the people who saw it will never be the same. Welcome to Scary True Dogman Stories — a chilling collection of real, firsthand encounters with the creature known as the Dogman.<br /><br /><br /><br /><br /><br />These aren't just campfire tales. These are true Dogman sightings shared by hunters, hikers, truckers, and everyday people who came face to face with something that shouldn't exist. From dark forests to lonely back roads, each story will make you question what's really out there in the dark.<br /><br /><br /><br /><br /><br />In every episode you'll find:<br /><br /><br /><br /><br /><br />Real, terrifying Dogman encounters<br /><br /><br /><br /><br /><br />Bone-chilling cryptid stories told in atmospheric detail<br /><br /><br /><br /><br /><br />Perfect horror listening for late nights, long drives & the brave-at-heart<br /><br /><br /><br /><br /><br />If you love true scary stories, cryptid encounters, Bigfoot and Dogman sightings, paranormal podcasts, and horror stories that keep you up at night, this is the show for you.<br /><br /><br /><br /><br /><br />Turn off the lights, put on your headphones, and listen… if you dare.<br /><br /><br /><br /><br /><br />Subscribe now so you never miss a new Dogman story — new terrifying true encounters every week.<br /><br /><br /><br /><br /><br />#Dogman #TrueScaryStories #Cryptid #HorrorPodcast #Paranormal #ScaryStories #DogmanEncounters #Werewolf #Bigfoot #TrueHorror<br /><br /><br /><br /><br /><br />",Spreaker,en,https://d3wo5wojvuv7l.cloudfront.net/t_rss_itunes_square_1400/images.spreaker.com/original/206f7bd14cf01843fe5dde63f659e67b.jpg,2026-07-04 20:20:27,7941540,confirmed,https://www.spreaker.com/podcast/scary-true-dogman-stories--7151996,1783196427,2745dc7c78b500768425124153d9edd2,,4,0,INDIVIDUAL
Old Time Radio,,https://feed.podbean.com/oldtimeradiopodcast/feed.xml,"<p class=""PDq2pG_selectionAnchorContainer""><strong>Old Time Radio</strong> brings back classic old time radio shows from the golden age of radio, featuring vintage radio dramas, mysteries, detective stories, westerns, comedy, science fiction, suspense, adventure, old Hollywood voices, and historic broadcasts from the era before television.<span class=""PDq2pG_selectionAnchor""></span></p>
<p>Each episode features carefully selected classic radio episodes for listeners who love old time radio, vintage storytelling, nostalgic entertainment, classic radio theater, retro audio drama, golden age radio shows, and timeless audio performances. Whether you are discovering old time radio shows for the first time or returning to favorite broadcasts from the past, this podcast is an easy place to find mystery radio programs, detective radio dramas, western radio adventures, old comedy shows, science fiction radio stories, suspense thrillers, and unforgettable broadcasts from another era.</p>
<p>Step back into the world of radio before television, when voices, music, sound effects, and imagination created entire worlds for millions of listeners. <strong>Old Time Radio</strong> preserves and shares the shows that defined generations of entertainment, bringing the atmosphere, charm, and storytelling power of vintage radio back to life.</p>",Podbean,en,https://pbcdn1.podbean.com/imglogo/image-logo/22469942/OTRR_25_7ulnu.jpg,2026-07-04 20:17:21,7941537,confirmed,https://oldtimeradiopodcast.podbean.com,1783196241,de38e435aeccb2360f27e34f9f8984ad,6787192871.0,0,1,UNKNOWN
Bib Ballads by Ring Lardner (1885 - 1933),,https://www.spreaker.com/show/7153543/episodes/feed,"Ring Lardner is a typical parent when his first child is born, full of wonder and the rest of the usual emotions as he watches his little son grow. He wrote a series of 29 short poems on various facets of parenthood. (Summary by Jack Thro)",Spreaker,en,https://d3wo5wojvuv7l.cloudfront.net/t_rss_itunes_square_1400/images.spreaker.com/original/992d85cb26bdb1b93f8a4dd931dd9b7e.jpg,2026-07-04 20:05:54,7941532,confirmed,https://www.spreaker.com/podcast/bib-ballads-by-ring-lardner-1885-1933--7153543,1783195554,ea6059a3f507df07ff94e1034b3c25fe,,4,1,UNKNOWN
Bhagavad Gita by Unknown,,https://www.spreaker.com/show/7153541/episodes/feed,"The content of the text is a conversation between Krishna and Arjuna taking place on the battlefield of Kurukshetra just prior to the start of a climactic war. Responding to Arjuna's confusion and moral dilemma, Krishna explains to Arjuna his duties as a warrior and Prince and elaborates on a number of different Yogic and Vedantic philosophies, with examples and analogies. This has led to the Gita often being described as a concise guide to Hindu philosophy and also as a practical, self-contained guide to life. During the discourse, Krishna reveals his identity as the Supreme Being Himself (Bhagavan), blessing Arjuna with an awe-inspiring glimpse of His divine absolute form. (Wikipedia)",Spreaker,en,https://d3wo5wojvuv7l.cloudfront.net/t_rss_itunes_square_1400/images.spreaker.com/original/76a6e44b4db9cd72baa8643ec261748e.jpg,2026-07-04 20:03:45,7941530,confirmed,https://www.spreaker.com/podcast/bhagavad-gita-by-unknown--7153541,1783195425,f0fc41e239d963cc3038daf33bb7404f,,4,1,UNKNOWN
Initiated by GOD,Hardly Initiated Network,https://feeds.redcircle.com/16846d64-2b4a-493c-bcdc-7f5a69651cb8,"> 
> Initiated By God isn't a show. It's an assignment.
> 
> Hosted by Jessica Laine MacDonald, Initiated By God is a faith-forward
> interview series for people who've heard God call them to something — and
> are trying to find the courage to say yes. After a life-altering accident
> and a miraculous recovery, Jessica surrendered her platform to God and
> stepped into a new season of obedience. This show is what came out of it.
> 
> Each episode, Jessica sits down with pastors, leaders, entrepreneurs, and
> everyday believers for raw, unfiltered conversations about calling,
> spiritual warfare, healing, transition, and what it actually costs to obey
> God when nobody around you understands. No veneer of perfection. No
> church-flyer answers. Just real testimony from people who've been broken,
> rebuilt, and sent. If you're stepping into a new assignment, running from
> one, or sitting in a season you didn't choose — this show was initiated by
> God for you.
> 
> New episodes weekly. Stay initiated.",Spotify for Podcasters,en-US,https://media.redcircle.com/images/2026/7/2/11/62dbc9ee-464e-4619-a483-57556c8b3ff6_cover_final.jpg,2026-07-04 19:57:55,7941525,confirmed,https://redcircle.com/shows/initiated-by-god,1783195075,4eb96a2c2429834473ae83c2929c02a3,6786696693.0,2,0,CORPORATE
Eat This Book,John Nemmers and Jon Pagel,https://rss.buzzsprout.com/2323688.rss,<p>Diving deeper into the Word and exploring what it means to bring Eden to Des Moines and further. We will be meditating and discussing together in further detail the preaching text from Sunday mornings.</p>,Buzzsprout,en-us,https://storage.buzzsprout.com/tbcf9m2kszu0r1zdpsaciotra8dw?.jpg,2026-07-04 19:57:14,7941524,confirmed,,1783195034,6b978c4c8a646065d8e1272ee2186f50,,4,0,CORPORATE
Confessions of a Divorce Assassin,Legal Talk Network,https://feeds.megaphone.fm/LTN5924002387,"<p>Confessions of a Divorce Assassin pulls back the curtain on divorce. The stories no one talks about and the decisions that change everything. Hosted by CEO of US Legal Groups, David Crum, Esq., the podcast features real divorce stories alongside conversations with attorneys who aren’t afraid to share their perspective on what actually happens inside a case. From legal strategy to client dynamics and the human cost of divorce, each episode delivers insight, honesty, and perspective for both the public and the attorneys who serve them.</p>",Megaphone,en,"https://megaphone.imgix.net/podcasts/c13d384a-70b1-11f1-867c-cfe6133480f9/image/21ef0ad38402039b7c2a9fb4285caf8c.png?ixlib=rails-4.3.1&max-w=3000&max-h=3000&fit=crop&auto=format,compress",2026-07-04 19:52:12,7941522,confirmed,https://legaltalknetwork.com/confessions-of-a-divorce-assassin,1783194732,31c9d55b317949b42d2b2cd0bb40edee,6785912907.0,2,0,CORPORATE
National Weather Service - NORTHERN INLAND ST JOHNS COUNTY FLORIDA FORECAST - by WARN,Weather Alert Radio Network,https://www.omnycontent.com/d/playlist/8fc2c4ad-bb66-4b15-bc51-a97800079141/49c62366-8c3d-4718-8e75-b47800fd71d0/b270291d-eac4-4e9b-819a-b47800ffbcc7/podcast.rss,"The National Weather Service forecast for Northern Inland St. John's County Florida forecast from the Weather Alert Radio Network
FLZ433
https://forecast.weather.gov/MapClick.php?zoneid=FLZ433",Megaphone,en-US,https://www.omnycontent.com/d/playlist/8fc2c4ad-bb66-4b15-bc51-a97800079141/49c62366-8c3d-4718-8e75-b47800fd71d0/b270291d-eac4-4e9b-819a-b47800ffbcc7/image.jpg?t=1782747131&size=Large,2026-07-04 19:43:12,7941519,confirmed,https://www.weatheralertradionetwork.org/,1783194192,9700aa74665d722a5cad829a22881cac,6785638290.0,2,0,CORPORATE
The Audacity,"Zana Pali, Nadi Radhakrishna & Duda Nusevic",https://feeds.megaphone.fm/PCS5078140196,"<p>THE AUDACITY is the new podcast set to shake up conversations around modern life, relationships, human behaviour, ambition and the things everyone thinks - but not everyone is willing to say out loud.</p>
<p><br></p>
<p>Hosted by property developer and former lawyer Zana Pali, lawyer and policy expert Duda Nusevic, and psychiatrist and soon-to-be published author Nadi Radhakrishna, The Audacity brings together three women with completely different backgrounds, personalities and ways of seeing the world - creating a dynamic where nothing is rehearsed, nothing is filtered and absolutely nothing is off limits.</p>
<p><br></p>
<p>Expect sharp opinions, uncomfortable truths, hilarious stories, relationship debates, dating disasters, social dynamics, friendship drama and those moments where everyone listening thinks: “I cannot believe someone actually said that.”</p>
<p><br></p>
<p>At its core, The Audacity explores the strange, funny and sometimes unbelievable realities of modern life - because whether it’s relationships, friendships, family dynamics, dating, social media, ambition or human behaviour, one thing remains constant:</p>
<p>People have audacity. And this podcast plans on talking about it.</p>",Megaphone,en,"https://megaphone.imgix.net/podcasts/f092abe0-7537-11f1-b11d-d3b7c8543abb/image/9347682e3e117fd0a3c6c55a1d4f0a79.png?ixlib=rails-4.3.1&max-w=3000&max-h=3000&fit=crop&auto=format,compress",2026-07-04 19:39:14,7941515,confirmed,,1783193954,d8103097a09a7b127954b7422d8e769d,6786271283.0,2,0,CORPORATE
Calling Forth the Creative Muse: A Story-Based Sleep Meditation Podcast,Nancy Fulton,https://feeds.transistor.fm/calling-forth-the-creative-muse-a-story-based-sleep-meditation-podcast,"Welcome to Calling Forth the Creative Muse, a guided imagery and self-hypnosis podcast created for writers, artists, filmmakers, designers, performers, entrepreneurs, and all creative people who are ready to rest, dream, and create with greater ease.

Each episode is designed to help you quiet your busy creative mind, release the pressure to produce, and reconnect with the deep well of imagination within you. Through soothing guided imagery, sleep meditation, self-hypnosis, and poetic storytelling, you’ll be invited to relax your body, calm your thoughts, and drift into a state where inspiration can rise naturally.

Whether you are seeking help falling asleep, overcoming creative blocks, finding fresh ideas, or waking up feeling refreshed, renewed, and ready to bring something meaningful into the world, this podcast was created for you.

So settle in, close your eyes, and let yourself rest. Your creative mind does not need to struggle tonight. It only needs to listen, soften, dream, and remember its role in reimagining the world.",Transistor,en,https://img.transistorcdn.com/5QvcU89PZVkMUKAOsRCAZBvheplV60sCumvqBL04vAU/rs:fill:0:0:1/w:1400/h:1400/q:60/mb:500000/aHR0cHM6Ly9pbWct/dXBsb2FkLXByb2R1/Y3Rpb24udHJhbnNp/c3Rvci5mbS9lNjU1/ZjZlZDQxZWMyMWRl/Njc5ZmJkMTBhMmVh/ZWIyNy5qcGc.jpg,2026-07-04 19:34:37,7941512,confirmed,https://www.audioiron.com,1783193677,c2957b648c53a212f80216a648904a45,,4,0,INDIVIDUAL
If We Can Keep It with Aaron Evans,Aaron Evans,https://rss.buzzsprout.com/2628338.rss,"<p>In 1787, Ben Franklin walked out of the Constitutional Convention on the last day. A woman named Elizabeth Powel stopped him and asked what they'd built in there. He said, ""A republic, if you can keep it."" This commemorative podcast celebrates some of the most perilous steps along the 250 year journey in the creation of a new nation.</p><p><br></p><p>I'm Aaron Evans. I run a PR firm and a strategic comms consultancy, and I've spent my career watching people try to build things that outlast them - companies, campaigns, coalitions, movements. Almost every story I care about in American history comes down to the same question Franklin was answering on the courthouse steps: is this republic worth the work it takes to hold it together, and are we the generation that's going to do the work?</p><p><br></p><p>Each episode is one story. Short. Focused. No panel, no politics-of-the-week, no shouting. I take one moment - Valley Forge in the snow, three guys in a room writing the Federalist Papers under a pen name, a Jewish broker on Front Street bankrolling Washington's army, the first peaceful handoff of power in 1800, Lincoln in 1858, Eisenhower's farewell, the Watergate tapes, the contested elections of 2000 and 2020 - and I pull it apart. What actually happened. Who did the hard work. What it cost them. And what it means for the people who are trying to build and lead something today.</p><p><br></p><p>This isn't a history lecture. It's a working conversation for the people I know are listening: business owners writing paychecks, executives running teams, officeholders trying to serve, and citizens who still believe the American experiment is worth defending.</p><p><br></p><p>New episodes weekly. If it hits, share it with someone who's building something that matters.</p><p><br></p><p>A republic. If we can keep it.</p>",Buzzsprout,en-us,https://storage.buzzsprout.com/3uo5qozfad772qrwnb4r7z0j62h0?.jpg,2026-07-04 19:23:07,7941509,confirmed,https://www.ifwecankeepitpodcast.com,1783192987,d5bd9062d0a32589186f125884b1083c,,0,0,INDIVIDUAL
Beyond These Voices by Mary Elizabeth Braddon (1835 - 1915),,https://www.spreaker.com/show/7153530/episodes/feed,"This novel tells the fictional life story of Veera Davis. The daughter of a poet and a poor noble woman, who is left in the care of her grandmother to a lonely and monotonous childhood, she has to make her way up in the world. But everything has a price. She tries to follow the conventions of the society which shunned her when she was poor. The novel explores themes such as love, money and loss. Don't worry, there is also a good murder mystery. Summary by Stav Nisser.",Spreaker,en,https://d3wo5wojvuv7l.cloudfront.net/t_rss_itunes_square_1400/images.spreaker.com/original/58ad7b175ca0c13d71ab3033129875c9.jpg,2026-07-04 19:14:50,7941507,confirmed,https://www.spreaker.com/podcast/beyond-these-voices-by-mary-elizabeth-braddon-1835-1915--7153530,1783192490,0ceb0e46f7604262f33cec81b6d5274d,,4,1,UNKNOWN
NEXT LEVEL YOU Podcast,mdabdulmalekkhan2023,https://feed.podbean.com/mdabdulmalekkhan2023/feed.xml,"<p class=""PDq2pG_selectionAnchorContainer""><strong>Welcome to NEXT LEVEL YOU Podcast – where growth begins, success is built, and your best life starts today.</strong><span class=""PDq2pG_selectionAnchor""></span></p>
<p>At <strong>NEXT LEVEL YOU Podcast</strong>, we believe that every person has unlimited potential waiting to be unlocked. Our mission is to inspire, educate, and empower you with powerful insights that help you become the best version of yourself.</p>
<p>Whether you're looking for <strong>motivation</strong>, <strong>self-improvement</strong>, <strong>success strategies</strong>, <strong>personal development</strong>, <strong>mindset transformation</strong>, <strong>productivity tips</strong>, <strong>leadership skills</strong>, <strong>career growth</strong>, <strong>AI insights</strong>, or <strong>life-changing habits</strong>, you've come to the right place.</p>",Podbean,en,https://pbcdn1.podbean.com/imglogo/image-logo/22463011/next_level_youaflqw.jpg,2026-07-04 19:10:52,7941505,confirmed,https://mdabdulmalekkhan2023.podbean.com,1783192252,bfcf19b45adeca6f02a2ac76d8344f43,6786414044.0,2,0,INDIVIDUAL
Breakout W/ Steve (old episodes),Steve Mosher,https://anchor.fm/s/11452f8f4/podcast/rss,Some older episodes of Breakout W/ Steve that are no longer up for streaming I wanted to repost for everyone to enjoy!,Anchor,en-us,https://d3t3ozftmdmh3i.cloudfront.net/staging/podcast_uploaded_nologo/46259493/46259493-1782658009079-eed1cd1617fd8.jpg,2026-07-04 19:09:41,7941504,confirmed,https://podcasters.spotify.com/pod/show/steve-mosher4,1783192181,3a0605f76f76252103d3179880e78990,6786753811.0,2,0,INDIVIDUAL
Beyond the Vanishing Point by Ray Cummings (1907 - 1957),,https://www.spreaker.com/show/7153529/episodes/feed,"When George Randolph first caught sight of Orena, he was astounded by its gleaming perfection. Here were hills and valleys, lakes and streams, glowing with the light of the most precious of metals. And, more astonishing than that, it was a world of miniature perfection—an infinitely tiny universe within a golden atom!<br /><br />But for Randolph it was also a world aglow with danger. Somewhere in its tiny vastness were the friends he had to rescue. Captives of a madman, they had been reduced to native Orena size; to return to Earth they needed the growth capsules Randolph was bringing them. It was up to Randolph to find them—and quickly—for the longer they stayed tiny, the closer they came to passing BEYOND THE VANISHING POINT! - Summary by Raymond King Cummings",Spreaker,en,https://d3wo5wojvuv7l.cloudfront.net/t_rss_itunes_square_1400/images.spreaker.com/original/67077453b427d27e1580fe9ae1b35f5b.jpg,2026-07-04 19:09:21,7941503,confirmed,https://www.spreaker.com/podcast/beyond-the-vanishing-point-by-ray-cummings-1907-1957--7153529,1783192161,cf58434e613d66d770bbb67ff0e5dd8d,,4,1,UNKNOWN
Beyond the Stars by Charles Hanson Towne (1877 - 1949),,https://www.spreaker.com/show/7153528/episodes/feed,"Charles Hanson Towne was a well known editor, author and poet. He was a popular New York celebrity who was considered by many as being the quintessential New Yorker. Besides being the editor at such magazines as Smart Set, Delineator, McClure’s, Designer, and Harper’s Bazaar, Towne also taught poetry at Columbia University. His most notable student was author  J.D. Salinger.  At the age of 63, Town joined the company of the Broadway hit, <i>Life with Father</i>, and at 68 wrote his autobiography, <i>So Far, So Good</i>. - Summary by Nemo",Spreaker,en,https://d3wo5wojvuv7l.cloudfront.net/t_rss_itunes_square_1400/images.spreaker.com/original/15266161a56f6df9849d1fe9ed71c6ec.jpg,2026-07-04 19:06:27,7941502,confirmed,https://www.spreaker.com/podcast/beyond-the-stars-by-charles-hanson-towne-1877-1949--7153528,1783191987,9b8d3bbb42d0b9ddb6480851b5d3d46e,,4,1,UNKNOWN
"Beyond the Rocks, A Love Story by Elinor Glyn (1864 - 1943)",,https://www.spreaker.com/show/7153527/episodes/feed,"Forced into marriage to a man who is older and wealthier, young Theodora Fitzgerald contemplates her fate in love, until she meets and falls in love with another. - Summary by Amy Deuchler",Spreaker,en,https://d3wo5wojvuv7l.cloudfront.net/t_rss_itunes_square_1400/images.spreaker.com/original/a948c08242be42fae8749d878b336742.jpg,2026-07-04 19:05:37,7941501,confirmed,https://www.spreaker.com/podcast/beyond-the-rocks-a-love-story-by-elinor-glyn-1864-1943--7153527,1783191937,076d4306aa1542e322f8742d97d5bba8,,4,1,UNKNOWN
Enjoying God Always,Sound Surgery,https://anchor.fm/s/1146d1810/podcast/rss,"Enjoying God Every Day is a faith-filled podcast inspired by Peter Jeffery’s powerful book Enjoy God Always.Each episode unpacks biblical truths, practical insights, and encouraging reflections to help you grow in faith, strengthen your spiritual life, and experience real peace in everyday living. Whether you're new to Christianity or looking to deepen your walk with God, Enjoying God Always will guide you toward a more joyful and Christ-centered life.",Anchor,en,https://d3t3ozftmdmh3i.cloudfront.net/staging/podcast_uploaded_nologo/46276612/46276612-1782905281750-644687cca756e.jpg,2026-07-04 18:54:03,7941489,confirmed,https://podcasters.spotify.com/pod/show/gemma-griffiths5,1783191243,c4c5d44b24c5ef32afd5ab20803823b9,6786755913.0,2,0,INDIVIDUAL
The Car Story Vault,The Car Story Vault,https://feeds.acast.com/public/shows/6a49075f2d7a15a979fbcd45,"<p>Welcome to The Car Story Vault, your premium destination for cinematic audio documentaries dedicated to the legends of automotive history. We unlock the fascinating stories behind the world's most iconic luxury and performance machines, no matter the era.</p><p>Every episode is a meticulously crafted journey designed to put you right in the driver's seat. Experience the roar of engines pushing hundreds of kilometres per hour, the bitter rivalries that defined generations, and the brilliant visionaries who built enduring legends out of steel, oil, and ambition. Whether you are a lifelong gearhead, a history enthusiast, or simply a lover of a great story, the Vault is open. Join us on an immersive ride through the ultimate archives of automotive heritage.</p><hr><p style='color:grey; font-size:0.75em;'> Hosted on Acast. See <a style='color:grey;' target='_blank' rel='noopener noreferrer' href='https://acast.com/privacy'>acast.com/privacy</a> for more information.</p>",Acast,en,https://assets.pippa.io/shows/cover/1783170847732-37566c83-4b5a-491b-a758-c6b2311c4ac6.jpeg,2026-07-04 18:53:45,7941488,confirmed,https://feeds.acast.com/public/shows/the-car-story-vault,1783191225,25b6d331e86b4d272a30bbfa7649dc4c,,0,0,CORPORATE
Beyond the Horizon by Eugene O'Neill (1888 - 1953),,https://www.spreaker.com/show/7153522/episodes/feed,"Beyond the Horizon is a 1920 play written by American playwright Eugene O'Neill. It was O'Neill's first full-length work, and the winner of the 1920 Pulitzer Prize for Drama. The play focuses on the portrait of a family, and particularly two brothers Andrew and Robert. In the first act of the play, Robert is about to go off to sea with their uncle Dick, a sea captain while Andrew looks forward to marrying his sweetheart Ruth and working on the family farm as he starts a family. (Summary by Wikipedia)<br /><br />Cast<br />James Mayo: <a href=""http://librivox.org/reader/6482"" target=""_blank"" rel=""noreferrer noopener"">Delmar H. Dolbier</a><br />Kate Mayo: <a href=""http://librivox.org/reader/4744"" target=""_blank"" rel=""noreferrer noopener"">Amy L. Gramour</a><br />Captain Dick Scott: <a href=""http://librivox.org/reader/4705"" target=""_blank"" rel=""noreferrer noopener"">Algy Pug</a><br />Andrew Mayo: <a href=""http://librivox.org/reader/5141"" target=""_blank"" rel=""noreferrer noopener"">David Goldfarb</a><br />Robert Mayo: <a href=""http://librivox.org/reader/1492"" target=""_blank"" rel=""noreferrer noopener"">mb</a><br />Ruth Atkins: <a href=""http://librivox.org/reader/1259"" target=""_blank"" rel=""noreferrer noopener"">Elizabeth Klett</a><br />Mrs. Atkins: <a href=""http://librivox.org/reader/3536"" target=""_blank"" rel=""noreferrer noopener"">Arielle Lipshaw</a><br />Mary: <a href=""http://librivox.org/reader/4009"" target=""_blank"" rel=""noreferrer noopener"">Diana Majlinger</a><br />Doctor Fawcett: <a href=""http://librivox.org/reader/3664"" target=""_blank"" rel=""noreferrer noopener"">Barry Eads</a><br />Narrator/Ben: <a href=""http://librivox.org/reader/6754"" target=""_blank"" rel=""noreferrer noopener"">Todd</a><br /><br />Audio edited by Elizabeth Klett",Spreaker,en,https://d3wo5wojvuv7l.cloudfront.net/t_rss_itunes_square_1400/images.spreaker.com/original/485a0878e4cb46b7752702c4ea7adba6.jpg,2026-07-04 18:53:37,7941487,confirmed,https://www.spreaker.com/podcast/beyond-the-horizon-by-eugene-o-neill-1888-1953--7153522,1783191217,200ed81c5a2558072f3c3f699ebec731,,4,1,UNKNOWN
