title,author,url,description,host_platform,language,image,dateAdded,id,status,link,timeAdded,contentHash,itunesId,source,dead,is_corporate
Queering Compliance,Jennifer Gaskin,https://feeds.libsyn.com/622015/rss,"Every queer person has a story. So does every compliance professional. Here, those two stories meet. Hosted by Jennifer Gaskin, editorial director of Corporate Compliance Insights, this podcast sits down with out LGBTQIA+ people working in compliance, ethics, risk, legal, governance and related fields to talk about the personal and professional journeys that brought them here — the challenges, the triumphs, the funny moments and the ones that still sting years or even decades later.
In a post-DEI world that would have queer people head back to the closet and stay there, there's never been a more important time to tell these stories. The arts, education, even sports — queer voices and queer stories are commonplace. In the corporate world — well, not so much. Queering Compliance is here to change that. Because joy is medicine. And so is being seen.
About the Host
Jennifer L. Gaskin is Editorial Director of Corporate Compliance Insights, joining the CCI team in 2021. In her professional role, she covers the intersection of corporate culture, ethics and the people who navigate both. She is also an out lesbian who watched the corporate DEI tide roll in and is watching it roll back out again. Before landing at CCI, Jennifer spent more than a decade in community journalism, serving in a variety of roles, from sports reporter to managing editor.
Read Jennifer's writing at CCI: https://www.corporatecomplianceinsights.com/author/jennifer-gaskin/
Visit her on LinkedIn: https://www.linkedin.com/in/jengaskin/
Interested in being a guest on the show?
Drop us a line: podcasts@corporatecomplianceinsights.com",Libsyn,en,https://static.libsyn.com/p/assets/0/f/6/c/0f6c6e227a1246cad959afa2a1bf1c87/Show_Cover_Art_1.jpg,2026-07-22 15:26:09,7965940,confirmed,https://www.corporatecomplianceinsights.com/queering-compliance/,1784733969,c245cc9b25d66ec767f9be4c86e8c3da,6783870785.0,2,0,INDIVIDUAL
See You at the Movies,See You at the Movies,https://anchor.fm/s/1135392ec/podcast/rss,Highly unserious commentary on movies everyone else in the world as seen...except us. Hosted by Mason & Matilda,Anchor,en,https://d3t3ozftmdmh3i.cloudfront.net/staging/podcast_uploaded_nologo/46092115/46092115-1780516027943-94fd93d88bf2c.jpg,2026-07-22 15:25:50,7965939,confirmed,https://podcasters.spotify.com/pod/show/see-you-at-the-movies,1784733950,450c08e1ce493573a9c4ad05592df5c0,6792945640.0,2,0,INDIVIDUAL
The Holy Trinity Church Round Table,HTC Downtown,https://anchor.fm/s/114fe1a54/podcast/rss,"The Holy Trinity Church Roundtable is a weekly 20-minute conversation featuring our pastors and ministry leaders as they discuss current events, cultural issues, theological questions, and the life of our church. By opening the conversations that regularly happen around our leadership table, we hope to invite our congregation to think, learn, and engage alongside us. Together, we'll explore why we do what we do and how the gospel shapes life in our city and our world.",Anchor,en,https://d3t3ozftmdmh3i.cloudfront.net/staging/podcast_uploaded_nologo/46371645/46371645-1784220872467-0abe8d792d29c.jpg,2026-07-22 15:25:03,7965938,confirmed,https://podcasters.spotify.com/pod/show/htc-downtown1,1784733903,1e4a647ca860f85d641b41bfe8ae6670,6792855827.0,2,0,INDIVIDUAL
AudioVerseArchives,AudioVerse,https://anchor.fm/s/1142e8488/podcast/rss,"audioversearchives@gmail.com
https://locals.com/audioversearchives/feed
Whether you’re into sci-fi, fantasy, action, or deep character-driven narratives, we’ve got something for you. With high-quality narration, immersive soundscapes, and a focus on delivering the best listening experience, Audioverse Archives is perfect for long road trips, late-night sessions, or anyone who loves losing themselves in a great story. Audiobooks for webnovels",Anchor,en,https://d3t3ozftmdmh3i.cloudfront.net/staging/podcast_uploaded_nologo/46235602/46235602-1783660506441-ab4c74a59fd51.jpg,2026-07-22 15:24:17,7965936,confirmed,https://podcasters.spotify.com/pod/show/audioversearchives,1784733857,37173a2188225aa1792ebf9c13ea2399,6788579606.0,2,0,INDIVIDUAL
alpha,Dr. Catharine Young,https://rss.buzzsprout.com/2610681.rss,"<p>Named for the beginning, the first, alpha elevates the voices of women in STEM: science, technology, engineering, mathematics, and the fields shaping what comes next.<br><br>From early-career scientists and engineers to founders, researchers, and policy leaders, alpha features women who are asking harder questions, sharing what they’ve learned, and clearing the path for those who follow.<br><br>Each episode goes beyond the achievement and into the story behind it: the choices, risks, failures, breakthroughs, and moments of becoming that shape a career at the edge of discovery.<br><br>This podcast is for the firsts. The onlys. The originals. And the women rising next.<br><br>Welcome to alpha.</p>",Buzzsprout,en-us,https://storage.buzzsprout.com/2hlkvyru6u5m03dxl1m3dmpy2hdk?.jpg,2026-07-22 15:20:29,7965934,confirmed,,1784733629,762172542e590646cec638228ff0b855,,0,0,INDIVIDUAL
Grace Beyond Sunday: A Cozy Bible Study,Jessica Martinez,https://anchor.fm/s/114e9bb7c/podcast/rss,"Each week, we'll open God's Word together and walk through Scripture, discovering more about God's heart along the way. We'll reflect on practical ways to apply what we learn, spend time in prayer, and end each episode with a worship song to carry with you throughout the week.
My prayer is that this podcast encourages you to know God more deeply, grow in your relationship with Him, and continue seeking Him beyond Sunday.
So grab your Bible, settle in, and let's discover more of God's heart together.",Anchor,en-us,https://d3t3ozftmdmh3i.cloudfront.net/staging/podcast_uploaded_nologo/46358295/46358295-1784042033391-8b16484048cab.jpg,2026-07-22 15:20:27,7965933,confirmed,https://podcasters.spotify.com/pod/show/grace-beyond-sunday-a-coz,1784733627,8e7c588bf4edccb6068a11d2694fa1f6,6790818096.0,2,0,INDIVIDUAL
Authentically You,Ronda Davis,https://feeds.libsyn.com/624945/rss,"Authentically You is a podcast for anyone who has spent their life being strong for everyone else and is ready to reconnect with who they truly are.
Hosted by therapist and speaker Ronda Davis, each episode explores trauma, grief, healing, relationships, boundaries, and the patterns that shape our lives. Through personal stories, clinical insight, and practical tools, you'll gain a deeper understanding of yourself and learn how to move from surviving to truly living.
Because healing isn't about becoming someone new—it's about remembering who you've been all along.",Libsyn,en,https://static.libsyn.com/p/assets/0/5/0/c/050c89402102c38116c3140a3186d450/Podcast_Art.png,2026-07-22 15:11:03,7965927,confirmed,https://sites.libsyn.com/624945,1784733063,788fdb2ba731411190aacfbd54ff2b9f,6792006449.0,2,0,INDIVIDUAL
Understanding the ADHD Child,Tanya,https://rss.buzzsprout.com/2632000.rss,"<p> Helping parents understand ADHD through child development, emotional intelligence and neuroscience. Exploring why children think, feel and behave the way they do—one question at a time. </p>",Buzzsprout,en-us,https://storage.buzzsprout.com/ph5o6grov95dkxt5dw0kh1fgaewy?.jpg,2026-07-22 15:01:51,7965920,confirmed,,1784732511,9f1ca934fa866d182f34d4fb31200ba3,,4,0,INDIVIDUAL
Reality Recap With Queen E,Eulaine Ndhlovu,https://anchor.fm/s/115235468/podcast/rss,Welcome to Reality Recap! Here you can find all the gossip about my favorite reality TV stars and celebrities every week. Make sure you subscribe to you never miss out on the TEA!,Anchor,en,https://d3t3ozftmdmh3i.cloudfront.net/staging/podcast_uploaded_nologo/46396042/46396042-1784586039660-f46043d8ae968.jpg,2026-07-22 15:00:46,7965919,confirmed,https://podcasters.spotify.com/pod/show/eulaine-ndhlovu3,1784732446,2588e9e5d79b4d69abd5b54f1effa522,6793189449.0,2,0,INDIVIDUAL
Why I started this podcast,Jameelah,https://www.spreaker.com/show/7197265/episodes/feed,"Welcome to the very first episode of Somewhere Between.<br /> This is the beginning of a journey filled with honest conversations, curious questions, personal reflections, and the little thoughts that don't always have a place elsewhere.<br /> In this episode, I introduce the podcast, share why I decided to start it, and talk about what you can expect in the episodes to come.<br /> Wherever you're listening from, thank you for being here. I hope you'll join me as we explore life, one thought at a time.",Spreaker,en,https://d3wo5wojvuv7l.cloudfront.net/t_rss_itunes_square_1400/images.spreaker.com/original/ec13480b36d5eab50011df64e4a9b78b.jpg,2026-07-22 14:55:44,7965911,confirmed,https://www.spreaker.com/podcast/why-i-started-this-podcast--7197265,1784732144,f22f55477ad4f188645eb9a37d8e7e83,,4,0,INDIVIDUAL
Cinder Wealth Advisors - Matt Losanno,mattlosanno,https://anchor.fm/s/114819628/podcast/rss,"Cinder Wealth Advisors | Business Exit Strategy | Tax Planning for Business Owners
This channel provides educational content on:
Exit Planning & Business Succession
Cash Balance Plans & Retirement Strategies
Estate Planning & Wealth Transfer
Business Continuity & Buy-Sell Agreements
QSBS & Entity Structuring
Coordinated Financial Planning
IMPORTANT DISCLOSURES:
The content on this channel is for educational and informational purposes only and does not constitute financial, tax, or legal advice.",Anchor,en-us,https://d3t3ozftmdmh3i.cloudfront.net/staging/podcast_uploaded_nologo/46290042/46290042-1783091582240-2dcbdefeb727d.jpg,2026-07-22 14:52:11,7965907,confirmed,https://podcasters.spotify.com/pod/show/jeff-v-evans806,1784731931,2755429c6de3b8ee3badd48834281fb3,6790458726.0,2,0,INDIVIDUAL
Aging with Intention,Nicole Dawson,https://anchor.fm/s/11511743c/podcast/rss,"Aging offers the opportunity to continue learning, growing, contributing, and discovering what's possible. That's what it means to age with intention. Hosted by Dr. Nicole Dawson, a clinician, researcher, and educator, Aging with Intention features thoughtful conversations with leading experts who translate the latest evidence into practical strategies. Whether you're aging yourself, caring for someone you love, or supporting older adults professionally, each episode helps you age toward your highest potential while embracing greater health, purpose, possibility, and connection.",Anchor,en-us,https://d3t3ozftmdmh3i.cloudfront.net/staging/podcast_uploaded_nologo/46384327/46384327-1784405375671-825604911eda9.jpg,2026-07-22 14:50:25,7965906,confirmed,https://podcasters.spotify.com/pod/show/nicole-dawson3,1784731825,1a40fb94f17989579ade58d9051b4cb5,,0,0,INDIVIDUAL
The RPG Backlog,ProfPlaysGames,https://rss.libsyn.com/shows/524688/destinations/4509593.xml,"ProfPlaysGames (from the Prof and Dev Plays Games podcast) has a huge backlog of RPGs that he'd love to play through, and he has friends he'd like to play them with. So he smashed those two lovely things into an RPG-playing, RPG-talking podcast! Here you'll find regularly published episodes, diving deep into the RPGs of yore.",Libsyn,en-us,https://static.libsyn.com/p/assets/9/6/f/7/96f79f467a7df3fad959afa2a1bf1c87/RPG_Backlog_NEW.jpg,2026-07-22 14:49:20,7965904,confirmed,https://sites.libsyn.com/524688,1784731760,bb2e66cf789d652b93abf5a9223f74fc,1788128234.0,2,0,INDIVIDUAL
The Path Beyond Binge Eating,"Molly Dyer | Licensed Therapist, Certified Eating Disorder Specialist, Binge Eating Recovery Coach",https://rss.buzzsprout.com/2626386.rss,"<p>Binge eating has a way of making you feel like the problem — like if you just had more discipline, more willpower, more resolve, you'd finally get this under control. But binge eating isn't a willpower problem, and you were never the problem to begin with.</p><p><br></p><p>The Path Beyond Binge Eating is for women 30 and older who are ready to identify, interrupt, and replace binge eating, restriction, chronic dieting, and emotional eating — and start creating a relationship with food and body something that actually lasts.</p><p><br></p><p>Each week, Licensed Therapist, Certified Eating Disorder Specialist, and Binge Eating Recovery Coach Molly Dyer will invite you on a path through the practical steps of moving beyond binge eating and toward a consistent, sustainable relationship with food, your body, and yourself. </p><p><br></p><p>Informed by 12 years of clinical experience and a Polyvagal lens, this show is not therapy — it is informational and educational, for women who are done waiting to lose weight or change their body to start living. This is where binge eating stops running the show and you start finding your way back to yourself.</p><p><br></p><p>New episodes every Wednesday. Follow the show and learn more about Molly, and how you can find support at www.MollyDyer.com</p><p><br><br><br><br><br><br><b><br><br><br><br><br></b><br></p>",Buzzsprout,en-us,https://storage.buzzsprout.com/f6ozt5budw3c9kpxh0s7wlnwnn2o?.jpg,2026-07-22 14:46:02,7965900,confirmed,https://thepathbeyondbingeeating.buzzsprout.com/,1784731562,a895c86eb43bf2614750d3ae3477d9cc,,4,0,CORPORATE
The Art of Being a Therapist,Ashley Charbonneau & Morgen Villegas,https://feeds.redcircle.com/be5fa8f1-b734-47c7-9df0-65e4415cf52c,"This podcast is for therapists, helping professionals, and anyone curious about the human experience in the therapy room. We'll explore the realities of clinical work, professional growth, self-reflection, and the art of showing up authentically for others. Whether you’re a seasoned clinician, a student, or simply passionate about mental health, we can't wait to share these conversations with you.
*Disclaimer:* This podcast is for educational and informational purposes only. It is not a substitute for therapy, clinical supervision, consultation, medical advice, or other professional services. We are not your therapists, supervisors or consultants and listening to this podcast does not establish a therapeutic, supervisory, or consultative relationship. Always use your own professional judgment and seek appropriate support for your specific clinical or personal needs.",Spotify for Podcasters,en-US,https://media.redcircle.com/images/2026/7/1/17/398197b7-6c55-4a06-bda4-9c0ba9cd0f5a_the_art_of_being_a_therapist.jpg,2026-07-22 14:29:30,7965889,confirmed,https://redcircle.com/shows/the-art-of-being-a-therapist,1784730570,1294f51b38a2a02ffcbf13d80b3944a3,6786551882.0,2,0,CORPORATE
Side Quests,Andrew Ross,https://anchor.fm/s/1004c3d98/podcast/rss,"Side Quests is a podcast to journey through topics, taking the side quests in conversation, because all of the side quests make up the whole journey. Through exploration, to discover and learn more about God, life, and how all of it ties together. Like pulling on a loose string on a sweater only to see the sweater sinch in unlikely places, we are finding how all of it is interconnected. Join us on the journey as we dive into life with friends, old and new to discover together the beauty of journeying with Jesus and each other.",Anchor,en-us,https://d3t3ozftmdmh3i.cloudfront.net/staging/podcast_uploaded_nologo/42899638/42899638-1783907905998-367878981be96.jpg,2026-07-22 14:24:13,7965885,confirmed,https://podcasters.spotify.com/pod/show/andrew-ross85,1784730253,de71f7f10ecd7b37bf71d555b21585fe,6792362557.0,2,0,CORPORATE
Oracle Fusion Unplugged,Arun Raj,https://anchor.fm/s/10aa37fa4/podcast/rss,"Join us on Oracle Fusion Unplugged, where we dive into the latest trends and insights in Oracle Cloud, OCI, Analytics, Oracle Fusion, Apex and everything Oracle Cloud related.",Anchor,en,https://d3t3ozftmdmh3i.cloudfront.net/staging/podcast_uploaded_nologo/44634545/44634545-1760919069841-5157c570b0af7.jpg,2026-07-22 14:23:11,7965883,confirmed,https://podcasters.spotify.com/pod/show/arun-raj776,1784730191,7cf7504208eea53dedd7f9cb20c286b3,1896728644.0,2,0,INDIVIDUAL
Sazón and Sentimientos,Sazón and Sentimientos,https://anchor.fm/s/1107b1400/podcast/rss,"Bienvenidas to Sazón & Sentimientos, where we mix a little chisme, a little cafecito, and a whole lot of real-life feelings… aquí hablamos de todo—la vida, la familia, growing up Mexican, y esas conversaciones que solo se tienen entre amigas…”",Anchor,en-us,https://d3t3ozftmdmh3i.cloudfront.net/staging/podcast_uploaded_nologo/45614688/45614688-1774119830614-8a4af2a266251.jpg,2026-07-22 14:23:11,7965882,confirmed,https://podcasters.spotify.com/pod/show/sazn--sentimientos,1784730191,860bd252d420b69ba763c7b817738f6f,1890995487.0,2,0,CORPORATE
The Hubbubbery Ramblery,The Hubbubbery,https://anchor.fm/s/ff4e2e88/podcast/rss,"The Hubbubbery is a celebration of all things pop culture, specifically, the lesser known, the unknown or the forgotten, as well as what’s new, what’s weird, and whatever else.",Anchor,en-us,https://d3t3ozftmdmh3i.cloudfront.net/staging/podcast_uploaded_nologo/42733138/42733138-1746418870497-e5367e14cff1d.jpg,2026-07-22 14:17:48,7965876,confirmed,https://podcasters.spotify.com/pod/show/the-hubbubbery,1784729868,fe132768abd17adf08a6a9450ceda926,1813299973.0,2,0,CORPORATE
Clueless on Classics | Mythology & History for the Uninitiated,Natalie H,https://anchor.fm/s/1146b6164/podcast/rss,"Whether you're clueless about Greek and Roman mythology, or are so deep into it that you roll your eyes every time Zeus is mentioned - this is the place for you. Taking a topic from the ancient Mediterranean each episode, whether mythology, history, heroes, or monsters, with the aim to tell it all with humour and liberal sprinklings of sarcasm. Grab a drink, and marvel in the stupidity, hilarity, ingenuity and sheer audacity of the ancient world
Hosted by Nat, a neurospicy millennial with a degree in really old stuff - come and chat shit about god, heroes, history and everything in-between!",Anchor,en-gb,https://d3t3ozftmdmh3i.cloudfront.net/staging/podcast_uploaded_nologo/46275489/46275489-1782893653820-570ce598363d8.jpg,2026-07-22 14:11:31,7965870,confirmed,https://podcasters.spotify.com/pod/show/natalie-hayward5,1784729491,42c955b97af268ebae0c097713e25691,6792273331.0,2,0,INDIVIDUAL
Media Markus Show,Media Markus,https://anchor.fm/s/108da8488/podcast/rss,"A daily podcast reviewing and covering trending topics as well as what’s happening in news, sports and entertainment.",Anchor,en,https://d3t3ozftmdmh3i.cloudfront.net/staging/podcast_uploaded_nologo/44335058/44335058-1756597097674-4f7b79e4da1e2.jpg,2026-07-22 14:10:31,7965868,confirmed,https://podcasters.spotify.com/pod/show/media-markus,1784729431,5fa8aac885eacc3f50f8e39cf7c29f10,1867391748.0,2,0,CORPORATE
Staging - Show with Video Enabled,Kieran Mckeefery,https://feeds-staging.captivate.fm/staging-show-with-video/,Staging - Show with Video Enabled,Captivate,en,https://artwork.captivate.fm/8811f281-48ee-4c43-b233-a84408370095/AB50D4ED-48F8-41EA-BBAE-AA925F976B41.jpg,2026-07-22 14:09:39,7965867,confirmed,https://staging-show-with-video.captivate-testing.com,1784729379,e3141a29e6d4a858e106dc9895576313,1896749351.0,2,0,INDIVIDUAL
"Waypoint Church | Winchester, VA",Waypoint Church,https://anchor.fm/s/110cdc268/podcast/rss,"Weekly messages from Waypoint Church. 
Visit thewaypointchurch.com.",Anchor,en,https://d3t3ozftmdmh3i.cloudfront.net/staging/podcast_uploaded_nologo/45668874/45668874-1774796562095-0ae2f0ffffaf.jpg,2026-07-22 14:06:17,7965863,confirmed,https://podcasters.spotify.com/pod/show/waypoint-church,1784729177,786fbdb000b7510c5daa5b5683a92b5e,6792325083.0,2,0,CORPORATE
"Juifs, Musulmans: tenir ensemble",Carole Harari,https://feeds.captivate.fm/tenir-ensemble/,lorem ipsum,Captivate,en,https://artwork.captivate.fm/cdb663ea-22b9-4bfa-a5b6-baaa28f4151f/260701-CHA-podcast-visual-Juifs-musulmans-3000x3000-blanc.jpeg,2026-07-22 14:02:53,7965859,confirmed,https://tenir-ensemble.captivate.fm,1784728973,199cc8c590aec237c02f95b7c734b87a,,4,0,INDIVIDUAL
SERVANT Magazine: Beyond the Pages,AV Support,https://feeds.captivate.fm/servant-magazine-podcast/,"Moving beyond the page, the SERVANT Magazine Podcast brings you into raw, inspiring, and unscripted conversations with today’s Christians. From the campus of Prairie College to the frontlines of global ministry, we interview the fascinating people behind the articles you love to read. Join us as we share real stories of faith, grit, and grace designed to edify, exhort, and encourage you in your walk with Christ.",Captivate,en,https://cdn.captivate.fm/placeholder/default-artwork.jpg,2026-07-22 14:01:26,7965857,confirmed,https://servant-magazine-podcast.captivate.fm,1784728886,b6b626e43203e90b80b1a655ba3fb7ff,,4,0,INDIVIDUAL
The Christian Chronicle Podcast,The Christian Chronicle Podcast,https://rss.buzzsprout.com/2111187.rss,<p>The Christian Chronicle Podcast explores the news and stories shaping Church of Christ congregations and members around the world. </p>,Buzzsprout,en,https://hosting-media.riverside.com/media/imports/podcasts/66e3f40b-1c9d-4ecc-bfff-29b75e3d26fd/29qmb42ite9vbbl609xnj2a0c4fr.jpg,2026-07-22 14:00:29,7965856,confirmed,http://christianchronicle.org/podcast,1784728829,47c45d242b7c357210aeb86edb0d646e,,4,0,CORPORATE
Overbooked Besties,Alana and Sinn,https://anchor.fm/s/1145dc568/podcast/rss,"Overbooked Besties is what happens when two best friends turn their calls into a podcast, so they can do what they'd be doing anyway... dissecting fictional drama and reality tv with equal obsession and minimal filters. Except now we're nervous and on display! We're currently rereading Throne of Glass and crashing out over Summer House and Love Island. If you have opinions, you'll fit right in! Pull up a chair, we've saved you a seat.",Anchor,en,https://d3t3ozftmdmh3i.cloudfront.net/staging/podcast_uploaded_nologo/46266570/46266570-1784034583526-b5c2d856f2345.jpg,2026-07-22 13:53:22,7965853,confirmed,https://podcasters.spotify.com/pod/show/overbooked-besties0,1784728402,61dce254677b2c5a6e1c438f66f10192,6792926577.0,2,0,CORPORATE
Be Well with Rachel,Be Well with Rachel,https://feed.podbean.com/bewellwithrachel/feed.xml,"<p>Life can feel loud, overwhelming and a bit relentless sometimes.</p>
<p>This is a space for guided meditations, calming resets and gentle support for busy minds, anxious thoughts and emotionally tired humans.</p>
<p>Here you'll find practices to help you slow down, regulate your nervous system, quiet the mental noise, release stress, reconnect with yourself and start feeling calmer, clearer and more like <em>you</em> again.</p>
<p>Expect anxiety relief meditations, morning boosts, sleep support, emotional reset sessions, visualisations and practical moments of calm — without the fluff, pressure or pretending you've got to meditate perfectly.</p>
<p>Just real, down-to-earth support for real life.</p>
<p>Hosted by Rachel — holistic therapist, meditation teacher and straight-talking believer that healing doesn't have to be complicated.</p>
<p>Take what you need. Press play. Breathe.</p>
<p>If you want to explore more of what I do, join me at www.bewellwithrachel.co.uk.</p>",Podbean,en,https://pbcdn1.podbean.com/imglogo/image-logo/22390642/Be_Well_with_Rachel_2_9i1jq.png,2026-07-22 13:50:42,7965849,confirmed,https://bewellwithrachel.podbean.com,1784728242,8f85dcf32813e4dc6de626173466e9ee,1896858259.0,2,0,CORPORATE
Talking Power,EDF / The Energyst,https://rss.buzzsprout.com/2631989.rss,"<p>Talking Power is a podcast series focused on the future of energy and decarbonisation from the perspective of large UK businesses. Hosted by The Energyst’s Tim McManan-Smith and featuring industry experts from EDF, we'll explore themes such as the net zero solutions for business, the rise of corporate PPAs, the future of the UK energy mix and energy market insights.</p><p> </p><p>To find out more, follow EDF Business Solutions on LinkedIn or visit <a href=""https://www.edfenergy.com/large-business/talk-power"" target=""_blank"">https://www.edfenergy.com/large-business/talk-power</a></p><p> </p><p>And for the latest news and views, visit <a href=""http://theenergyst.com/"" target=""_blank"">theenergyst.com</a></p><hr /><p></p>",Buzzsprout,en,https://storage.buzzsprout.com/z3cx6qjdujwpvr9424flduxybs3w?.jpg,2026-07-22 13:46:22,7965846,confirmed,https://www.edfenergy.com/large-business/talk-power,1784727982,a52a007ff36dfa49396ad2a38b695c5f,,4,0,INDIVIDUAL
Hakim’s World,Hakim,https://feed.podbean.com/tvgpn5ztqv/feed.xml,New podcast weblog,Podbean,en,https://pbcdn1.podbean.com/imglogo/image-logo/19873829/podcast_image_A93D6ADF-458E-47D8-9D96-44AECCD8A907.jpg,2026-07-22 13:45:42,7965843,confirmed,https://tvgpn5ztqv.podbean.com,1784727942,2dbd828496d0fc16b51fe8a08ce352dc,6792791316.0,2,0,INDIVIDUAL
