title,author,url,description,host_platform,language,image,dateAdded,id,status,link,timeAdded,contentHash,itunesId,source,dead,is_corporate
Signal Stitch,Signal Stitch,https://anchor.fm/s/110c0f5d8/podcast/rss,"Master the business of fashion with Signal Stitch.
We connect creative innovation with the realities of retail, supporting designers, label founders, retailers, and industry pros.
We dive into honest conversations exploring the journeys of UK fashion designers, brands, and retailers. 
From sustainable production to scaling retail operations, we deliver insights you need to navigate today’s fashion landscape.
Join the host and expert guests as they share practical knowledge and real-world experiences to help you build a lasting fashion business. Follow & visit signalstitch.co.uk to stay updated",Anchor,en-gb,https://d3t3ozftmdmh3i.cloudfront.net/staging/podcast_uploaded_nologo/45660486/45660486-1774718246011-a8639e93b95b3.jpg,2026-07-23 01:39:04,7966422,confirmed,https://signalstitch.co.uk,1784770744,8cbfca106b51d471eeed10fd15c5fb12,1888792605.0,2,0,INDIVIDUAL
Untangled,Sam Scibetta and Sushaant Bakhru,https://anchor.fm/s/114ef00b4/podcast/rss,Asia's Untold Business Stories.,Anchor,en,https://d3t3ozftmdmh3i.cloudfront.net/staging/podcast_uploaded_nologo/46361749/46361749-1784081939938-2db0d5b93e26c.jpg,2026-07-23 01:29:43,7966414,confirmed,https://podcasters.spotify.com/pod/show/untangled5,1784770183,1cc92015a0b204a68bcf9672c3ff5694,6791526755.0,2,0,CORPORATE
The Blueprint Grid (Silas Kingsley),Silas Conrad Drake Kingsley,https://www.spreaker.com/show/7198232/episodes/feed,"Hey everyone, Silas here!",Spreaker,en,https://d3wo5wojvuv7l.cloudfront.net/images.spreaker.com/nuvolari-assets/green_square_mic.jpg,2026-07-23 01:15:43,7966402,confirmed,https://www.spreaker.com/podcast/the-blueprint-grid-silas-kingsley--7198232,1784769343,4ba17ed773275b7c4bd9369a2e47fb70,,4,0,INDIVIDUAL
Burnt Shores,Rick Devereaux | Caribbean and Sea Thrillers,https://www.omnycontent.com/d/playlist/3082f102-29e2-476c-974b-a78d001c3a4c/eb0b2cdb-23df-41f5-8c19-b45b00f76c76/43753e23-b25f-4911-8333-b45b00f771fb/podcast.rss,"Cap Gilroy was just an aimless Uber driver scraping by on the Florida Gulf Coast when a marina night guard is brutally murdered on his late father’s classic boat. Hoping to just stay out of the way of the police, Cap discovers that his absentee dad wasn't just a paranoid survivalist, but a deep-cover CIA operative who hid a package before his death, a package everyone now seems desperate to find.
Now, the ultimate deadly treasure hunt is on. Pursued by cartel assassins and entangled with a lethal Mossad spy, Cap must team up with his father's formidable former CIA partner to find the hidden truth before their enemies do. 
Burnt Shores is a pulse-pounding Caribbean thriller where family legacies are forged in gunfire and the deadliest secrets are hidden at sea. Each 5-15 minute episode is a pulse-pounding sprint to a secret Cap may not want to find. 
A new chapter. Every day. For free. From Surface Tension Studio.",Megaphone,en-US,https://www.omnycontent.com/d/programs/3082f102-29e2-476c-974b-a78d001c3a4c/eb0b2cdb-23df-41f5-8c19-b45b00f76c76/image.jpg?t=1780239761&size=Large,2026-07-23 01:12:42,7966396,confirmed,https://signalbox.studio/,1784769162,e8d5bf40f0a6999e30d1837e6e85de66,6793203192.0,2,0,CORPORATE
"Nikki Cosma: Real Talk, No Filter",Nikki Cosma,https://feed.podbean.com/founderh/feed.xml,"Unscripted & unapologetic conversations from a free-spirited, sex-positive, self-employed, festival-girlie travelling the world in the 21st century - I’m Nikki Cosma, facilitator and founder of Holofractal Life Systems & Retreats. 
No notes, no script, just what’s real. New episodes whenever I feel there’s something worth sharing with y’all. Expect my craziest story-times (I will have you cry-laughing at my best and worst moments!), reflections on emotional regulation, personal self-care philosophy, women’s health navigation, financial literacy development, living a life of flow and literally anything and everything else that pops into my cheeky lil’ brain.
Tune in, have some laughs and always remember - the magic within me is blessed to be witnessed by the magic within you!
Thanks for being here :D
— Nikki Cosma ＜3",Podbean,en,https://pbcdn1.podbean.com/imglogo/image-logo/22496956/Copy_of_nikkicosma_3_6uewi.jpg,2026-07-23 01:10:01,7966392,confirmed,https://founderh.podbean.com,1784769001,f98a3b49003ca0723ef158eeb5cbf18d,6792113671.0,2,0,INDIVIDUAL
Produced By,Second Signal Media,https://feeds.transistor.fm/produced-by,"Go behind the scenes with the hosts, producers, editors, and creators who make podcasts happen. Explore everything that happens before, during, and after the recording, and discover what success really means for a podcast",Transistor,en,https://img.transistorcdn.com/j0qlPUIviLWogDRO9UKE0UKJKtLrWTMVe__iM2gi3Wc/rs:fill:0:0:1/w:1400/h:1400/q:60/mb:500000/aHR0cHM6Ly9pbWct/dXBsb2FkLXByb2R1/Y3Rpb24udHJhbnNp/c3Rvci5mbS9mZTQ5/NjM1MzVmMGI1NjQ4/MDdiMmZmOTRlMjMy/MDZmZS5wbmc.jpg,2026-07-23 01:09:56,7966391,confirmed,http://www.producedbypod.com,1784768996,d8a5b150da1c7cb9ad9f670419e84155,,4,0,CORPORATE
mohit's Podcast,Mohit,https://rss.buzzsprout.com/2632125.rss,<p>educational</p><p><br></p>,Buzzsprout,en-us,https://storage.buzzsprout.com/q29vg1x0p7qk9johvjg8ebjbc2va?.jpg,2026-07-23 01:06:49,7966389,confirmed,,1784768809,47f9b332d1988f7a1844eb9736fd9908,,4,0,INDIVIDUAL
Conscious Accomplishment,Scott Britton,https://feeds.captivate.fm/conscious-accomplishment/,A podcast with Scott Britton on how to balance the process of spiritual growth and professional success. ,Captivate,en,https://artwork.captivate.fm/6463abd5-20f7-46ca-853e-d7f02042e181/conscious-accomplishment-cover-1400.png,2026-07-23 01:03:19,7966382,confirmed,https://consciousaccomplishment.com/,1784768599,952bee3378d11f890a29adf7e35bf8a3,,4,0,INDIVIDUAL
Zachary Studying for FCP Exam Help 2026,Zitti,https://feed.podbean.com/zacharydaniels/feed.xml,Studying help FCP for NOB.,Podbean,en,https://pbcdn1.podbean.com/imglogo/image-logo/22506466/Test_3000_pixels99qhl.jpg,2026-07-23 00:58:51,7966375,confirmed,https://zacharydaniels.podbean.com,1784768331,c57dd1b90fd72cbf0fe2c9d72549c37c,6792759814.0,2,0,INDIVIDUAL
Tayya's Podcast,Tayya,https://rss.buzzsprout.com/2632122.rss,<p>Hello description </p>,Buzzsprout,en-us,https://storage.buzzsprout.com/82ou1kv7mhg7ktis4npuyxt6l20p?.jpg,2026-07-23 00:57:14,7966374,confirmed,,1784768234,c837d4673606ebbb7082799521371fc6,,4,0,INDIVIDUAL
First Read,Penguin Books Australia,https://anchor.fm/s/114e55b2c/podcast/rss,"The meeting ground for big ideas, compelling stories, and the conversations shaping our world. Insightful author interviews with leading thinkers, bestselling writers, and the experts behind today's most talked-about non-fiction books. Join Charle Malycon for this weekly podcast from Penguin, providing thoughtful conversation, expert analysis, and engaging cultural commentary. From politics, history, religion, business, society + culture, to conversations about cults, conspiracy theories, and the forces shaping our lives. First, Read - new episodes every Wednesday. Powered by Penguin.",Anchor,en-au,https://d3t3ozftmdmh3i.cloudfront.net/staging/podcast_uploaded_nologo/46355427/46355427-1784000983873-1b0d15c29b4f8.jpg,2026-07-23 00:53:36,7966370,confirmed,https://podcasters.spotify.com/pod/show/penguin-books-australia4,1784768016,166bffb59d05b021053e5abaeae1d73f,6792980673.0,2,0,INDIVIDUAL
All Things Possible With Bethany Hamilton,bethanyhamiltonpodcast,https://feed.podbean.com/allthingspossible/feed.xml,"All Things Possible with Bethany Hamilton
Pro surfer, best-selling author, and Soul Surfer Bethany Hamilton joins her husband Adam Dirks to explore how faith, family, and intentional living make all things possible—even in life’s toughest moments. From raising kids and homeschooling to health, discipleship, and navigating today’s culture, this podcast delivers real conversations and practical encouragement. With inspiring guests and powerful stories, All Things Possible is your weekly dose of hope, resilience, and purpose-filled living.
Perfect for families of faith, homeschoolers, and anyone seeking joy and strength in the unexpected.",Podbean,en,https://pbcdn1.podbean.com/imglogo/image-logo/21717391/podcastart.jpg,2026-07-23 00:48:34,7966363,confirmed,https://allthingspossible.podbean.com,1784767714,6f7f7c2dc9fce295b140d5b51bc10ee6,1857843428.0,2,0,INDIVIDUAL
Classified Connects,Classified Cycling,https://anchor.fm/s/11498b678/podcast/rss,"Classified connects is a podcast, a conversation and a love letter to cycling. Coming out every two weeks in July and August and from September every first Wednesday of the month.",Anchor,en,https://d3t3ozftmdmh3i.cloudfront.net/staging/podcast_uploaded_nologo/46305198/46305198-1784221980643-b8aa5fa397a04.jpg,2026-07-23 00:41:44,7966356,confirmed,https://podcasters.spotify.com/pod/show/classified-cycling6,1784767304,9648c9272bc600b83c3c30454c667402,6793397874.0,2,0,INDIVIDUAL
The Spirit,ADB,https://rss.buzzsprout.com/2604170.rss,"<p>The Spirit shares real stories of faith from people living in country Australia. It is for those already living with faith and those curious to know more about what that actually looks like. It is a glimpse into the lives of people living in country Australia and how being there has shaped their faith.</p><p>These are the stories of a police officer, an army cadet, a recipient of an Order of Australia and an advocate against family and domestic violence just to name a few. Their stories are not always neat, and each challenges us to think differently. But ultimately these are encouraging stories of hope.</p><p>The Spirit was recorded on the lands of the Dja Dja Wurrung, Baraba Baraba, Yorta Yorta and Bangerang peoples. </p>",Buzzsprout,en-us,https://storage.buzzsprout.com/ox1ix6pyr6zl1pu4e3wu7u89salq?.jpg,2026-07-23 00:35:39,7966348,confirmed,https://www.buzzsprout.com/2604170,1784766939,e9b8fd7443b6375fc52fafe9b48cddc4,,4,0,CORPORATE
Livin’ On A Prayerie,"Dr. Heidi Griffin, Cassy Bostron",https://anchor.fm/s/114ecd85c/podcast/rss,An Everything Podcast,Anchor,en-us,https://d3t3ozftmdmh3i.cloudfront.net/staging/podcast_uploaded_nologo/46360335/46360335-1784064826292-d68f8d2d9787b.jpg,2026-07-23 00:18:44,7966343,confirmed,https://podcasters.spotify.com/pod/show/livinonaprayerie,1784765924,cb345a3f9850fff20bd8e6fd1b10fc49,6792525608.0,2,0,INDIVIDUAL
Disability Dialogues,Kimberly Walljasper,https://feed.podbean.com/disabilitydialogues/feed.xml,"Have you ever found yourself in a situation where you don’t know what to do or say because you don’t have any background knowledge or prior experiences?
Welcome to Disability Dialogues! This is a bi-weekly podcast that spreads awareness about individuals with disabilities. I am your host Kimberly Walljasper, and together we will explore inclusion through expert interviews as well as personal stories. Whether you have experience with individuals with disabilities or not, this podcast is here to provide you with resources so that you can be educated in this area and build meaningful connections.  
As a pre-service special education teacher with over eight years of experience working with various nonprofits like the Penguin Project, Spectrum Project, and Best Buddies, I’ve had the privilege of learning firsthand about the diverse challenges and triumphs faced by individuals with disabilities. From navigating the early days of volunteering to becoming deeply involved in advocacy, I’ve gained valuable insights into inclusion, adaptability, and understanding. This journey has taught me the importance of patience, perseverance, and building genuine connections. I understand the concerns you may have because I’ve walked that path myself, learning and growing alongside the incredible individuals I’ve had the honor to support.
Through my experience with individuals with disabilities, I discovered the incredible capabilities within every person, regardless of their challenges. This realization changed how I view inclusion, teaching me that everyone has a unique voice and story that deserves to be heard. This led me to start my podcast, where I can spotlight those stories and amplify voices often overlooked. Now, I want to share these powerful insights, personal triumphs, and practical guidance with you, helping to foster understanding and a more inclusive world for all.
So, if you’re ready to make a change in the community, subscribe to Disability Dialogues.",Podbean,en,https://pbcdn1.podbean.com/imglogo/image-logo/19723035/Podcast_Cover_Art9ezxx.png,2026-07-23 00:18:39,7966342,confirmed,https://disabilitydialogues.podbean.com,1784765919,8b5846928f94e118d43c84a47def3832,1778315326.0,2,0,INDIVIDUAL
"Guide To The Weird, Wacky, and Macabre",Mediabyte Podcast Network,https://www.spreaker.com/show/7198163/episodes/feed,"True Crime, Cryptids, Aliens, Bigfoot? oh my! The stories of The Wacky, tales of the macabre, Long winded folk tales of the weird. All right here. ",Spreaker,en,https://d3wo5wojvuv7l.cloudfront.net/t_rss_itunes_square_1400/images.spreaker.com/original/2e11507523c971958a8101767eccdf28.jpg,2026-07-23 00:12:51,7966333,confirmed,https://www.spreaker.com/podcast/guide-to-the-weird-wacky-and-macabre--7198163,1784765571,3d522bedc68fefa49ce8f5c0b9ef87ec,,4,0,CORPORATE
Unapologetically Us with John & Heather,Unapologetically Us with John & Heather,https://rss.buzzsprout.com/2061732.rss,"We talk about everything from parenting, marriage, podcastingand everything else in between! Join John and Heather each week as they talk about the hard truth of being parents.",Buzzsprout,en,https://storage.buzzsprout.com/p0s71a9ta74frzyfm9d3wgnd6mc7?.jpg,2026-07-23 00:10:08,7966329,confirmed,https://www.buzzsprout.com/2061732,1784765408,12d3d91548cc370487de3f8c8ef0f33f,,4,0,CORPORATE
The Railway Modeller Podcast,Railway Modeller,https://feeds.acast.com/public/shows/68e8e76fde9a2a62c4a5a01f,An informal podcast from the editorial team of Railway Modeller magazine<hr><p style='color:grey; font-size:0.75em;'> Hosted on Acast. See <a style='color:grey;' target='_blank' rel='noopener noreferrer' href='https://acast.com/privacy'>acast.com/privacy</a> for more information.</p>,Acast,en,https://assets.pippa.io/shows/68e8e76fde9a2a62c4a5a01f/1784807229903-08d12161-6f69-4b8f-80c5-16d3198f8104.jpeg,2026-07-23 00:07:36,7966328,confirmed,https://peco-uk.com/pages/publications,1784765256,e0baff4527f5fa5949e013eb9759a373,6793444756.0,2,0,INDIVIDUAL
Cardiac Output,michaelcharlesworth,https://feed.podbean.com/CardiacOutput/feed.xml,"<p><span>Cardiac Output is a podcast on cardiothoracic anaesthesia and intensive care medicine. Dr Mike Charlesworth and Dr Calum Downes discuss the evidence, the controversies and the practicalities of modern practice.</span></p>",Podbean,en,https://pbcdn1.podbean.com/imglogo/image-logo/19082625/CardiacOutput_logo_1400jpg8d5fi.jpeg,2026-07-23 00:06:28,7966326,confirmed,https://CardiacOutput.podbean.com,1784765188,a05c64604d83f162bda9d8ab1e449ebe,6793434361.0,2,0,INDIVIDUAL
Murdered On A Sunday with Elle Madison,Elle Madison,https://anchor.fm/s/10a2f0ac0/podcast/rss,Listen to the new chilling short podcast episodes of Elle Madison’s Murdered On A Sunday. Elle covers lesser known unsolved murder cases that are believed to have happened on a Sunday.,Anchor,en,https://d3t3ozftmdmh3i.cloudfront.net/staging/podcast_uploaded_nologo/44558224/44558224-1784605440495-18efffd745417.jpg,2026-07-23 00:01:46,7966325,confirmed,https://podcasters.spotify.com/pod/show/elle-madison,1784764906,c3ee01e1a45534cb01f5e7407411de2f,6792987018.0,2,0,INDIVIDUAL
What Do Engineers Do?,Douglas Tree,https://feed.podbean.com/WDED/feed.xml,"<p>Engineers do so much for our society and economy, but no one seems to know what they do! Engineering students at Brigham Young University are on a quest to interview practicing engineers to figure out what they do and how they got there. This podcast will help us all better understand who engineers are and what they do to make the world a better place.</p>",Podbean,en,https://pbcdn1.podbean.com/imglogo/image-logo/21580473/WDED-logo.png,2026-07-23 00:00:37,7966323,confirmed,https://WDED.podbean.com,1784764837,6f4143640199eb2ba6cd8a5fdc3d4f30,6793319169.0,2,0,INDIVIDUAL
Papa’s Podcast,Erik Ritschard,https://www.spreaker.com/show/7198169/episodes/feed,Stories for grandchildren,Spreaker,en,https://d3wo5wojvuv7l.cloudfront.net/t_rss_itunes_square_1400/images.spreaker.com/original/05bb2571f37d3a0bd292928823a3ff11.jpg,2026-07-22 23:58:10,7966321,confirmed,https://www.spreaker.com/podcast/papa-s-podcast--7198169,1784764690,450fa45a24ae8cc7c3d426078ce5fbe9,,4,0,INDIVIDUAL
Lord of the Mysteries,AudioVerse Archives,https://anchor.fm/s/114391f60/podcast/rss,Lord of the Mysteries Webnovel,Anchor,en,https://d3t3ozftmdmh3i.cloudfront.net/staging/podcast_uploaded_nologo/46242552/46242552-1782414980528-7ce22240b9f32.jpg,2026-07-22 23:52:21,7966319,confirmed,https://podcasters.spotify.com/pod/show/haiden-weese6,1784764341,041185a19c0656ada857f379ad5c8b65,6788581225.0,2,0,INDIVIDUAL
Podcast poephol,Aiden and Justin,https://rss.buzzsprout.com/2632116.rss,<p>We are a funny south africa startup</p>,Buzzsprout,en-us,https://storage.buzzsprout.com/bf8zs53452y5a0rz0rdiilkgea3u?.jpg,2026-07-22 23:50:02,7966317,confirmed,,1784764202,93cb567289b67411864c5f621860558e,,0,0,CORPORATE
The Redox Podcast,Mark Porteous and Russell Mariani,https://feeds.captivate.fm/the-redox-podcast/,"Health begins with communication. Every cell in the body relies on signals that support recovery, resilience, vitality, and healthy aging, yet cellular communication remains one of the most overlooked aspects of wellness.
Hosted by Russell Mariani and Mark Porteous, The Redox Podcast explores the science of redox signaling and why it matters through conversations with scientists, clinicians, educators, entrepreneurs, and wellness leaders. Complex science is translated into practical, accessible conversations that connect cellular health with everyday life, helping make sense of how the body communicates, adapts, and supports its own natural processes.
The ASEA Redox technology is not intended to diagnose, treat, cure, or prevent any disease or medical condition. The statements made during this podcast have not been evaluated by the Food and Drug Administration. People featured in this podcast may have received remuneration through the ASEA compensation plan. Most consumers of the ASEA redox products use them as part of an already healthy lifestyle. Results may vary. This information is intended for the US market only.",Captivate,en,https://artwork.captivate.fm/c4e724e6-3645-48f3-b862-81f6aa31fc16/Main-Cover.jpg,2026-07-22 23:48:49,7966316,confirmed,https://the-redox-podcast.captivate.fm,1784764129,1b8314265e13884f5cd94e9f3552b954,,0,0,CORPORATE
The Brandon Straka Show,Brandon Straka,https://anchor.fm/s/1152bb2fc/podcast/rss,"The Brandon Straka Show — honest, in-depth conversations that go beyond politics. Host Brandon Straka, founder of the #WalkAway Campaign, sits down with some of the most fascinating and often controversial voices in the country. From foreign policy, national security, and free speech to culture, media, and everything in between, these are the conversations others won't have, with guests from the right, the left, and everywhere between. 
New episode every Monday.",Anchor,en,https://d3t3ozftmdmh3i.cloudfront.net/staging/podcast_uploaded_nologo/46401527/46401527-1784660052938-9a1232330ed15.jpg,2026-07-22 23:48:48,7966315,confirmed,https://podcasters.spotify.com/pod/show/thebrandonstrakashow,1784764128,caf424b921f1aaac1765d2154b494a54,6793201479.0,2,0,CORPORATE
1025 Black Sheep The memoirs of me,JAMAL DOCTOR,https://www.spreaker.com/show/7198166/episodes/feed,"For Jamal, growing up on 147 street ""grandmas house"" wasn't entirely bad but it wasn't good either. learning what drugs and entitlement can do first hand to a family1025 BLACKSHEEP' he shares his life story.Born and raised in South Jamaica Queens, Jamal Doctor lived a life of revolving emotions. This in his words is a soul baring tale of how he realized the hard truth of being the “Black Sheep” of the family. The obstacles he faced and the lack of support from his family and how much harder life was because of it. Learning to navigate family relationships while always being the one in the wrong was taxing mentally and physically. Being loyal and loving to a family that never loved him became his cross to bear.",Spreaker,en,https://d3wo5wojvuv7l.cloudfront.net/t_rss_itunes_square_1400/images.spreaker.com/original/6562326dd031445b419eebb44570d5cb.jpg,2026-07-22 23:43:25,7966312,confirmed,https://www.spreaker.com/podcast/1025-black-sheep-the-memoirs-of-me--7198166,1784763805,e41697f881daed81aaba73a1cddc93b7,,4,0,INDIVIDUAL
GO Hunt,C.A. Goodman,https://feed.podbean.com/goodmanoutdoors/feed.xml,"<p><span style=""font-family:impact, chicago;font-size:14pt;"">GO Hunt is an outdoors focused podcast. From hunting, fishing, off-roading, a sprinkling politics, pretty much all things outdoors, and last but not least God!</span></p>
<p></p>
<p><span style=""font-size:24pt;font-family:impact, chicago;""><strong>So what are you hunting for? Let's go hunting together!</strong></span></p>",Podbean,en,https://pbcdn1.podbean.com/imglogo/image-logo/22506986/GOODMAN_BLACK_copy90jzq.png,2026-07-22 23:41:33,7966310,confirmed,https://goodmanoutdoors.podbean.com,1784763693,7eb5d3c641b971b059627694da7202c7,6792865592.0,2,0,INDIVIDUAL
In Progress,Wyatt Bond,https://anchor.fm/s/111854294/podcast/rss,"This podcast is about the mental side of sports, faith, and consistency. I’m learning as I go and sharing how to think more clearly and grow through the process. Check out my content on TikTok: @wyatt_bond",Anchor,en-us,https://d3t3ozftmdmh3i.cloudfront.net/staging/podcast_uploaded_nologo/45789133/45789133-1776280233383-e4fba639be32d.jpg,2026-07-22 23:37:14,7966308,confirmed,https://podcasters.spotify.com/pod/show/wyatt-bond,1784763434,258ccc52b7f6ed30dd45a0ac9844671a,1895564315.0,2,0,INDIVIDUAL
The Power of Community: The EPBDF Podcast,EPBDF,https://anchor.fm/s/11521f1b8/podcast/rss,"The Power of Community is the official podcast of the Eastern Pennsylvania Bleeding Disorders Foundation (EPBDF). Through conversations with individuals, families, healthcare professionals, advocates, and community partners, we explore the stories, education, and connections that strengthen the bleeding disorders community. Join us for inspiring conversations that remind us no one has to face a bleeding disorder alone.",Anchor,en-us,https://d3t3ozftmdmh3i.cloudfront.net/staging/podcast_uploaded_nologo/46395134/46395134-1784575239801-c1bdb75485e66.jpg,2026-07-22 23:34:45,7966305,confirmed,https://podcasters.spotify.com/pod/show/epbdf7,1784763285,55c047de5cf87d1e38e998a7f513d0ae,6792898593.0,2,0,CORPORATE
Scared and Prepared,Scared and Prepared,https://anchor.fm/s/10f6ead10/podcast/rss,"This podcast is an outlet for the hosts and guests to share what they love about horror and what it means to them. 
How does horror create community, career, and relationships? How does horror allow us to express ourselves in ways we could not without it?
Tune in to find out...
Instagram: @scaredpreparedpod
Cover Art by:
Jade Alderman (Insta: @jadestarlingart)
Brandon Vasquez (Insta: @ma1um_)
Intro/Outro Music by:
Kristof
Mason Samuel",Anchor,en-us,https://d3t3ozftmdmh3i.cloudfront.net/staging/podcast_uploaded_nologo/45438788/45438788-1775620453869-fcfdefcfecf0a.jpg,2026-07-22 23:30:27,7966302,confirmed,https://podcasters.spotify.com/pod/show/scared--prepared,1784763027,b4eb8d7c7a2da00a1549742a2c872e8c,,0,0,CORPORATE
The Frozen River: A GMA Book Club Pick: A Novel by Ariel Lawhon,Momentum Media Advertising,https://feeds.captivate.fm/the-frozen-river-a-gma/,"Step into the biting winter of 1789 Maine to follow Martha Ballard, a daring midwife who defied a corrupt legal system to solve a shocking murder frozen in time. Through this gripping eight-part journey, you will transform from a passive observer of history into an active investigator of a forgotten past, unearthing the dangerous secrets of a town built on silence. By the season's end, you will see the early American frontier not through the eyes of its powerful men, but through the lens of a revolutionary woman who refused to be silenced.  Listeners will walk away with a profound framework for decoding historical bias, learning how to read between the lines of archival diaries to uncover marginalized voices. You will master the fundamentals of 18th-century forensic medicine, discovering how early midwives used empirical observation to challenge the formal authority of male physicians. Finally, you will gain a deep understanding of the structural legal barriers faced by colonial women and the exact strategies Martha used to navigate them.  This podcast is custom-made for historical fiction lovers, true crime addicts, and feminist history buffs who crave deep, character-driven mysteries based on real events. If you are someone who questions the official narrative and believes that the most important historical figures are the ones left out of the textbooks, this season is your sanctuary. Prepare to get lost in a world where a simple diary becomes the most dangerous weapon in the fight for justice.",Captivate,en,https://artwork.captivate.fm/ec918ec0-adb9-4900-85fd-b583e0bc6a92/The-Frozen-River-A-GMA-Book-Club-Pick-cover-1400x1400.jpg,2026-07-22 23:23:24,7966295,confirmed,https://the-frozen-river-a-gma.captivate.fm,1784762604,7874ee99ad830b01443ccb58bb962186,,4,0,CORPORATE
